Description,Price,Ratings,Review Count,URL
"Betron BS10 Earphones, In Ear Headphone, Noise Isolating Earbuds, Powerful Bass Sound, 3.5mm Jack, Black",£10.99,4.3 out of 5 stars,"8,170",https://www.amazon.co.uk//gp/slredirect/picassoRedirect.html/ref=pa_sp_atf_aps_sr_pg1_1?ie=UTF8&adId=A0219998163H81VG08XFN&url=%2FBetron-Earphones-Headphones-Powerful-Ergonomic-Black%2Fdp%2FB01M2V05RE%2Fref%3Dsr_1_1_sspa%3Fdchild%3D1%26keywords%3Dearphones%26qid%3D1631700537%26sr%3D8-1-spons%26psc%3D1&qualifier=1631700537&id=6092049641301616&widgetName=sp_atf
Wired Earphones In Ear Headphones Wired Earbuds Noise Isolating Headset With Microphone remote sound control Compatible With iPhone Samsung Huawei Android Smartphones Tablets Laptops(white and black),£6.98,3.8 out of 5 stars,789,https://www.amazon.co.uk//gp/slredirect/picassoRedirect.html/ref=pa_sp_atf_aps_sr_pg1_1?ie=UTF8&adId=A00738642C1NTQ5AK49SN&url=%2FEarphones-Headphones-Microphone-Compatible-Smartphones-Black%2Fdp%2FB09278PXJG%2Fref%3Dsr_1_2_sspa%3Fdchild%3D1%26keywords%3Dearphones%26qid%3D1631700537%26sr%3D8-2-spons%26psc%3D1&qualifier=1631700537&id=6092049641301616&widgetName=sp_atf
"Betron B25 Earphones, Noise Isolating In-Ear Wired Headphones with Strong Bass, Tangle-Free Cord, Lightweight, Carry Case and Soft Earbud Tips, Black",£9.99,4.2 out of 5 stars,"19,095",https://www.amazon.co.uk//Betron-Headphones-Earphones-Smartphones-Microphone-Black/dp/B00P89DXYI/ref=sr_1_3?dchild=1&keywords=earphones&qid=1631700537&sr=8-3
"Blukar Earphones, In-Ear Headphones Earphones High Sensitivity Microphone – Noise Isolating, High Definition, Pure Sound for iPhone, iPad, Smartphone, MP3 Players etc.",£8.99,4.3 out of 5 stars,"17,782",https://www.amazon.co.uk//Earphones-Blukar-Headphones-Sensitivity-Microphone-Silver/dp/B07QLWMDLC/ref=sr_1_4?dchild=1&keywords=earphones&qid=1631700537&sr=8-4
"JUKSTG Earphones, In-Ear Headphones Wired Earphones with Microphone and Volume Control, Pure Sound and Powerful Bass, Earphones with Mic Compatible with Devices with 3.5mm Headphones Jack",£5.99,4.4 out of 5 stars,"2,938",https://www.amazon.co.uk//JUKSTG-Headphones-Sensitivity-Microphone-Compatible-black/dp/B08G123YN8/ref=sr_1_5?dchild=1&keywords=earphones&qid=1631700537&sr=8-5
"Earphones, JKSWT Wired Earbuds with Microphone and Volume Control, High Definition,Powerful Bass Sound, In-Ear Headphones Compatible with 3.5mm Headphones Devices",£5.99,4.4 out of 5 stars,"1,772",https://www.amazon.co.uk//JKSWT-Microphone-Definition-Headphones-Compatible-Black/dp/B0919BBRB2/ref=sr_1_6?dchild=1&keywords=earphones&qid=1631700537&sr=8-6
"Tiksounds Wireless Earbuds 5.1, Bluetooth Headphones in-Ear, 35H Playtime, USB-C Fast Charge, Wireless Earphones Deep Bass, Touch Control, IPX7 Waterproof Sport Wireless Headphones",£24.99,4.4 out of 5 stars,"1,813",https://www.amazon.co.uk//gp/slredirect/picassoRedirect.html/ref=pa_sp_mtf_aps_sr_pg1_1?ie=UTF8&adId=A07676503UIVHHZAQN28L&url=%2FTiksounds-headphones-Bluetooth-Waterproof-black%2Fdp%2FB08LGRK6MT%2Fref%3Dsr_1_7_sspa%3Fdchild%3D1%26keywords%3Dearphones%26qid%3D1631700537%26sr%3D8-7-spons%26psc%3D1&qualifier=1631700537&id=6092049641301616&widgetName=sp_mtf
"4 Pairs earphones Heavy Bass Stereo Earphones Earbuds with Remote & Microphon,Laptops,Gaming Noise Isolating Tangle Free Headsets in Ear earphones",£8.99,4.1 out of 5 stars,"2,260",https://www.amazon.co.uk//gp/slredirect/picassoRedirect.html/ref=pa_sp_mtf_aps_sr_pg1_1?ie=UTF8&adId=A04207112MBFY656JIGM9&url=%2FMUNSKT-Headphones-Microphone-Isolating-Smartphones-4-mixed-colors%2Fdp%2FB07XN1BMFN%2Fref%3Dsr_1_8_sspa%3Fdchild%3D1%26keywords%3Dearphones%26qid%3D1631700537%26sr%3D8-8-spons%26psc%3D1&qualifier=1631700537&id=6092049641301616&widgetName=sp_mtf
"Earphones, JKSWT Wired Headphones with Microphone and Volume Control,Powerful Bass Sound,In-Ear Headphones Compatible with Most 3.5mm Devices",£5.99,4.3 out of 5 stars,"5,162",https://www.amazon.co.uk//JKSWT-Headphones-Sensitivity-Microphone-compatible-Black/dp/B085T5DR32/ref=sr_1_9?dchild=1&keywords=earphones&qid=1631700537&sr=8-9
Samsung Galaxy Buds Live Wireless Earphones Mystic Bronze (UK Version),£108.53,4.5 out of 5 stars,"13,384",https://www.amazon.co.uk//Samsung-Galaxy-Wireless-Earphones-Version/dp/B08C5G5SL8/ref=sr_1_10?dchild=1&keywords=earphones&qid=1631700537&sr=8-10
Sony MDREX110APB.CE7 Deep Bass Earphones with Smartphone Control and Mic - Metallic Black,£11.99,4.4 out of 5 stars,"3,989",https://www.amazon.co.uk//Sony-MDREX110APB-CE7-Earphones-Smartphone-Control-Metallic-Black/dp/B00I3LUUIU/ref=sr_1_11?dchild=1&keywords=earphones&qid=1631700537&sr=8-11
"Biseoamz Headphones for i Phone 12, Stereo Earphones for Phone 7 Magnetic In-Ear Headphones Wired Earbuds with Mic Compatible with Phone 12, Phone 11 Pro Max, Phone X, XS Max, XR, Phone 8, 8 Plus, 7",£15.99,4.3 out of 5 stars,"2,519",https://www.amazon.co.uk//Headphones-Earphones-Magnetic-Earbuds-Compatible/dp/B07ZNQYB27/ref=sr_1_12?dchild=1&keywords=earphones&qid=1631700537&sr=8-12
"New Upgrade, Wireless Earphones, Earbuds with More Than 5 Hours Playing Time Deep Bass Stereo Production With Voice Assistance 10M Bluetooth Range V5.0 Plus Charging Pot",£22.00,3.9 out of 5 stars,42,https://www.amazon.co.uk//gp/slredirect/picassoRedirect.html/ref=pa_sp_mtf_aps_sr_pg1_1?ie=UTF8&adId=A102724731YD8Y8XN34&url=%2FEarphones-Authentic-Production10M-Bluetooth-RangeV4-2-Black%2Fdp%2FB081WNLQXF%2Fref%3Dsr_1_13_sspa%3Fdchild%3D1%26keywords%3Dearphones%26qid%3D1631700537%26sr%3D8-13-spons%26psc%3D1&qualifier=1631700537&id=6092049641301616&widgetName=sp_mtf
"Wireless Earbuds, Anker Soundcore Life P2 Wireless Headphones with cVc 8.0 Noise Reduction, Bluetooth Earbuds with Clear Sound, 40H Playtime, IPX7 Waterproof, Wireless Earphones for Work, Home Office",£41.99,4.3 out of 5 stars,"85,504",https://www.amazon.co.uk//Soundcore-Microphones-Reduction-Waterproof-Earphones-Black/dp/B07SJR6HL3/ref=sr_1_14?dchild=1&keywords=earphones&qid=1631700537&sr=8-14
"Wireless Earbuds, E90 Bluetooth Earbuds Built-in Dual-Mic Stereo/Deep Bass/Type-C Fast Charge/Touch Control/IPX8 Waterproof/Low Latency/White In-Ear Wireless Earphones for Business, Travels, Sports",£21.98,4.7 out of 5 stars,163,https://www.amazon.co.uk//Wireless-Bluetooth-Dual-Mic-Waterproof-Earphones-White/dp/B098FC876Y/ref=sr_1_15?dchild=1&keywords=earphones&qid=1631700537&sr=8-15
"Hi-Res Extra Bass Earbuds Noise Isolating In-Ear Headphones Wired Earbuds with Microphone for iPhone, iPod, iPad, MP3, HUAWEI, Samsung, Lightweight Earphones with Volume Control 3.5mm Jack Headphones",£10.99,4.3 out of 5 stars,"5,265",https://www.amazon.co.uk//Isolating-Headphones-Microphone-Lightweight-Earphones/dp/B083J88QRS/ref=sr_1_16?dchild=1&keywords=earphones&qid=1631700537&sr=8-16
"Wireless Headphones, Tiksounds Bluetooth Headphones with Microphone, IPX7 Waterproof, HI-FI Stereo earphones, 150H Playtime with Charging Case, LED Display for Work/Sports/Game",£25.99,4.2 out of 5 stars,"14,211",https://www.amazon.co.uk//Wireless-Headphones-Charging-Immersive-Waterproof-Black/dp/B08B3QSV16/ref=sr_1_17?dchild=1&keywords=earphones&qid=1631700537&sr=8-17
ASENTER 4 Pack Headphones Earphones Earbuds 3.5mm Wired Headphones Noise Isolating Earphones with Built-in Microphon Volume Control Compatible with iPhone 6 Plus SE 5S 4 Samsung Android MP3,£8.99,4.2 out of 5 stars,224,https://www.amazon.co.uk//gp/slredirect/picassoRedirect.html/ref=pa_sp_mtf_aps_sr_pg1_1?ie=UTF8&adId=A03522352HSDBFT2UQ3ND&url=%2FASENTER-Headphones-Earphones-Isolating-Compatible%2Fdp%2FB08YQTDY83%2Fref%3Dsr_1_18_sspa%3Fdchild%3D1%26keywords%3Dearphones%26qid%3D1631700537%26sr%3D8-18-spons%26psc%3D1&qualifier=1631700537&id=6092049641301616&widgetName=sp_mtf
"SoundPEATS Bluetooth Earphones with Mic, Q30 HD Dual 5.0 Wireless Earbuds Magnetic IPX6 Running Headphones,APTX-HD, CVC Noise Cancellation, 10mm Drivers, Super Bass,Lightweight,13 Hrs Play Time",£32.99,4.3 out of 5 stars,650,https://www.amazon.co.uk//SoundPEATS-Bluetooth-Headphones-Cancellation-Lightweight-Black/dp/B0836XWCPN/ref=sr_1_19?dchild=1&keywords=earphones&qid=1631700537&sr=8-19
"Bose QuietComfort Noise Cancelling Earbuds, True Wireless Bluetooth Earphones, Triple Black",£249.00,4.4 out of 5 stars,"10,111",https://www.amazon.co.uk//Bose-QuietComfort-Cancelling-Earbuds-True-Earphones-Triple-Triple-Black/dp/B08C4KWM9T/ref=sr_1_20?dchild=1&keywords=earphones&qid=1631700537&sr=8-20
osloon Wired Earphones Stereo Sound in-Ear Earbuds with 3.5mm Headphones Plug Microphone Volume Control for Sports Workout Compatible with Cell Phones Tablets Laptops,£9.99,4.2 out of 5 stars,"4,992",https://www.amazon.co.uk//MASOMRUN-Earphones-Headphones-Microphone-Compatible-White/dp/B085F3HKHK/ref=sr_1_21?dchild=1&keywords=earphones&qid=1631700537&sr=8-21
TOZO T10 Bluetooth 5.0 Earbuds True Wireless Stereo Earphones Headphones IPX8 Waterproof in Ear Wireless Charging Case Built in Mic Headset Premium Sound with Deep Bass for Running Sport Black,£22.99,4.4 out of 5 stars,"219,359",https://www.amazon.co.uk//TOZO-Bluetooth-Wireless-Headphones-Waterproof-Black/dp/B07J2Z5DBM/ref=sr_1_22?dchild=1&keywords=earphones&qid=1631700537&smid=A33K9U5ICQB006&sr=8-22
"Betron BS10 Earphones, In Ear Headphones Earphones with Microphone and Volume Control, Powerful Bass Driven Sound, 12mm Large Drivers, Ergonomic Design, Gold",£12.99,4.3 out of 5 stars,"2,406",https://www.amazon.co.uk//gp/slredirect/picassoRedirect.html/ref=pa_sp_atf_next_aps_sr_pg2_1?ie=UTF8&adId=A05969833QXXJBXYGLSRM&url=%2FBetron-Earphones-Headphones-Microphone-Ergonomic-Gold%2Fdp%2FB074P74J4V%2Fref%3Dsr_1_17_sspa%3Fdchild%3D1%26keywords%3Dearphones%26qid%3D1631700539%26sr%3D8-17-spons%26psc%3D1&qualifier=1631700539&id=3037926458547183&widgetName=sp_atf_next
"Betron B750s Earphones, Wired In-Ear Headphones Earphones, Noise Isolating, Tangle-Free Cable, Enhanced Bass, Black",£10.99,4.2 out of 5 stars,"16,495",https://www.amazon.co.uk//gp/slredirect/picassoRedirect.html/ref=pa_sp_atf_next_aps_sr_pg2_1?ie=UTF8&adId=A10276173H5OV0YD4NIE2&url=%2FBetron-Earphones-Headphones-Definition-BlackBerry-Black%2Fdp%2FB00I3LTQ9O%2Fref%3Dsr_1_18_sspa%3Fdchild%3D1%26keywords%3Dearphones%26qid%3D1631700539%26sr%3D8-18-spons%26psc%3D1&qualifier=1631700539&id=3037926458547183&widgetName=sp_atf_next
"Bluetooth Headphones, Otium Wireless Headphones IPX7 Waterproof Earphones Sport Earbuds With Bluetooth 5.1 CSR Chip 7-9 Hrs Battery,Noise Cancelling Mic Earbuds for Gym Running Outdoor Sports Workout",£19.99,4.3 out of 5 stars,"6,280",https://www.amazon.co.uk//Bluetooth-Headphones-Otium-Waterproof-Cancelling-black/dp/B07JJN35Z2/ref=sr_1_19?dchild=1&keywords=earphones&qid=1631700539&sr=8-19
"Wireless Earbuds Running Headphones,Bluetooth 5.0 Sports Headphones with Ear Earphones Bluetooth Earphones IPX65 Waterproof with 6D Stereo HiFi Sound Noise Cancelling Headphones for Workout",£32.98,4.3 out of 5 stars,533,https://www.amazon.co.uk//Headphones-Bluetooth-Earphones-Waterproof-Cancelling-Black/dp/B092RZLT3Z/ref=sr_1_20?dchild=1&keywords=earphones&qid=1631700539&sr=8-20
"Wireless Earbuds, yobola Wireless Headphones, IPX5 Waterproof Wireless Earphones Touch Control, Bluetooth 5.1 Earbuds, 25 Hrs with USB-C Charging with Running/Fitness",£22.99,4.1 out of 5 stars,"6,345",https://www.amazon.co.uk//yobola-Headphones-Waterproof-Earphones-Bluetooth-T2-Pro-White/dp/B08K4Y4RMB/ref=sr_1_21?dchild=1&keywords=earphones&qid=1631700539&sr=8-21
TOZO T6 True Wireless Earbuds Bluetooth Headphones Touch Control Wireless Charging Case IPX8 Waterproof Stereo Earphones in-Ear Headset Premium Deep Bass Black,£35.99,4.4 out of 5 stars,"124,244",https://www.amazon.co.uk//TOZO-True-Wireless-Headphones-Stereo-Black/dp/B07RGZ5NKS/ref=sr_1_22?dchild=1&keywords=earphones&qid=1631700539&sr=8-22
"Betron B750s Earphones, Wired In-Ear Headphones Earphones, Noise Isolating, Tangle-Free Cable, Enhanced Bass, Red",£10.99,4.2 out of 5 stars,"1,563",https://www.amazon.co.uk//gp/slredirect/picassoRedirect.html/ref=pa_sp_mtf_aps_sr_pg2_1?ie=UTF8&adId=A10274613NPU6OSMZPS88&url=%2FBetron-Earphones-Headphones-Definition-Tangle-Free-Red%2Fdp%2FB00I3LTQAI%2Fref%3Dsr_1_23_sspa%3Fdchild%3D1%26keywords%3Dearphones%26qid%3D1631700539%26sr%3D8-23-spons%26psc%3D1&qualifier=1631700539&id=3037926458547183&widgetName=sp_mtf
Wireless Earbuds Earphones Bluetooth 5.0 LED Display IPX7 Waterproof 40H Playtime USB-C Charging Built-in Mic in-Ear Headphones Touch Control Deep Bass for Sports Work Outdoor(Black),£24.99,4.4 out of 5 stars,"1,481",https://www.amazon.co.uk//Wireless-Earphones-Bluetooth-Waterproof-Headphones-Black/dp/B08NV7QK8B/ref=sr_1_24?dchild=1&keywords=earphones&qid=1631700539&sr=8-24
"Wireless Earbuds, yobola Wireless Headphones, IPX5 Waterproof Wireless Earphones Touch Control, Bluetooth 5.1 Earbuds, 25 Hrs with USB-C Charging with Running",£22.99,4.1 out of 5 stars,"3,921",https://www.amazon.co.uk//yobola-Headphones-Waterproof-Earphones-Bluetooth-Black/dp/B08YK2R5CV/ref=sr_1_25?dchild=1&keywords=earphones&qid=1631700539&sr=8-25
"Tiksounds Bluetooth Headphones, True Wireless Headphones 150 Hrs Playtime with Charging Case, Deep Bass Sports Earphones, IPX7 Waterproof, Built-in Mic, LED Display for Running/Gaming/Workout",£28.99,4.2 out of 5 stars,"3,636",https://www.amazon.co.uk//Tiksounds-Bluetooth-Headphones-Earphones-Waterproof-black/dp/B08MJPGPKZ/ref=sr_1_26?dchild=1&keywords=earphones&qid=1631700539&sr=8-26
SOUNDPEATS TrueAir2 Wireless Earbuds Bluetooth V5.2 Headphones Wireless Earphones with Qualcomm QCC3040 TrueWireless Mirroring 4-Mic cVc 8.0 Total 25 Hours (Black),£35.99,4.3 out of 5 stars,"1,828",https://www.amazon.co.uk//SOUNDPEATS-Bluetooth-Headphones-Earphones-TrueWireless-Black/dp/B08GCMSZ74/ref=sr_1_27?dchild=1&keywords=earphones&qid=1631700539&sr=8-27
"Earphones, 2pack in-Ear Wired earphones GWAWG with High Sensitivity Microphone,subwoofer earphones Compatible with Most Devices with 3.5mm earphones Jack",£9.99,4.4 out of 5 stars,29,https://www.amazon.co.uk//gp/slredirect/picassoRedirect.html/ref=pa_sp_mtf_aps_sr_pg2_1?ie=UTF8&adId=A0043103JN8IKHB3RMSG&url=%2FEarphones-GWAWG-Sensitivity-Microphone-Compatible%2Fdp%2FB097B93WRX%2Fref%3Dsr_1_28_sspa%3Fdchild%3D1%26keywords%3Dearphones%26qid%3D1631700539%26sr%3D8-28-spons%26psc%3D1&qualifier=1631700539&id=3037926458547183&widgetName=sp_mtf
"Tiksounds Wireless Earbuds 5.1, Bluetooth Headphones in-Ear, 35H Playtime, USB-C Fast Charge, Wireless Earphones Deep Bass, Touch Control, IPX7 Waterproof Sport Wireless Headphones",£24.99,4.4 out of 5 stars,"1,813",https://www.amazon.co.uk//Tiksounds-headphones-Bluetooth-Waterproof-black/dp/B08LGRK6MT/ref=sr_1_29?dchild=1&keywords=earphones&qid=1631700539&sr=8-29
Apple EarPods with 3.5mm Headphone Plug - White,£17.91,4.5 out of 5 stars,"13,134",https://www.amazon.co.uk//Apple-EarPods-3-5mm-Headphone-Plug/dp/B06XDLJL26/ref=sr_1_30?dchild=1&keywords=earphones&qid=1631700539&sr=8-30
Apple EarPods with Lightning Connector - White,£17.20,4.5 out of 5 stars,"15,287",https://www.amazon.co.uk//Apple-EarPods-with-Lightning-Connector/dp/B01M1EEPOB/ref=sr_1_31?dchild=1&keywords=earphones&qid=1631700539&sr=8-31
"UGREEN HiTune Wireless Earbuds, Bluetooth Earphones cVc 8 Noise Reduction Microphones, aptX Codec Hifi Stereo, 27H Playtime Bluetooth 5.0 Earbuds, Comfort Fit In-Ear Wireless Earphones for Work Sport",£35.99,4.3 out of 5 stars,"8,035",https://www.amazon.co.uk//UGREEN-Earphones-Cancelling-Headphones-Waterproof/dp/B0851C5KLV/ref=sr_1_32?dchild=1&keywords=earphones&qid=1631700539&sr=8-32
"Betron BS10 Earphones, In Ear Headphone, Noise Isolating Earbuds, Powerful Bass Sound, 3.5mm Jack, Gold",£10.99,4.3 out of 5 stars,"1,443",https://www.amazon.co.uk//gp/slredirect/picassoRedirect.html/ref=pa_sp_mtf_aps_sr_pg2_1?ie=UTF8&adId=A0686871N1BM8VHFM18X&url=%2FBetron-Earphones-Headphones-Powerful-Ergonomic-Gold%2Fdp%2FB074P677HT%2Fref%3Dsr_1_33_sspa%3Fdchild%3D1%26keywords%3Dearphones%26qid%3D1631700539%26sr%3D8-33-spons%26psc%3D1&qualifier=1631700539&id=3037926458547183&widgetName=sp_mtf
"DPS Deep Noise Reduction Earphones,Sport Headphones Bluetooth 5.0 EDR Wireless Stereo HiFi in-Ear Earbuds for Gym Running Outdoor Sports Workout (Black 13) (C7)",£59.99,,,https://www.amazon.co.uk//Reduction-Earphones-Headphones-Bluetooth-Wireless-C7/dp/B09D3MF3BY/ref=sr_1_34?dchild=1&keywords=earphones&qid=1631700539&sr=8-34
Apple AirPods Pro,£179.00,4.7 out of 5 stars,"66,385",https://www.amazon.co.uk//Apple-MWP22ZM-A-AirPods-Pro/dp/B07ZPML7NP/ref=sr_1_35?dchild=1&keywords=earphones&qid=1631700539&sr=8-35
"Wireless Earbuds, ERITEX M30 Bluetooth Headphones, Immersive Bass Sound Wireless Earphones Built in Microphones IPX8 Waterproof Bluetooth Earbud in Ear Touch Control, 25 Hrs USB-C for Sports/Running",£18.69,4.4 out of 5 stars,438,https://www.amazon.co.uk//ERITEX-Bluetooth-Headphones-Microphones-Waterproof-Black/dp/B096F35B76/ref=sr_1_36?dchild=1&keywords=earphones&qid=1631700539&sr=8-36
"Hybrid Active Noise Canceling Wreless Earphones, Selorr ANC Wireless Headphones Bluetooth 5.2, Touch Control In Ear Headphones, USB-C Fast Charging, 30H Playtime with Charging Case, IPX7 Waterproof",£35.99,4.9 out of 5 stars,128,https://www.amazon.co.uk//Canceling-Earphones-Headphones-Bluetooth-Waterproof-Black/dp/B09B2GBPWD/ref=sr_1_37?dchild=1&keywords=earphones&qid=1631700539&sr=8-37
"Betron BS10 Earphones, In Ear Headphones Earphones with Microphone and Volume Control, Powerful Bass Driven Sound, 12mm Large Drivers, Ergonomic Design, Black",£12.99,4.3 out of 5 stars,"12,951",https://www.amazon.co.uk//gp/slredirect/picassoRedirect.html/ref=pa_sp_btf_aps_sr_pg2_1?ie=UTF8&adId=A06176003VOPGMQAGEQ6Q&url=%2FBetron-Earphones-Headphones-Microphone-Ergonomic-Black%2Fdp%2FB01MA1MJ6H%2Fref%3Dsr_1_38_sspa%3Fdchild%3D1%26keywords%3Dearphones%26qid%3D1631700539%26sr%3D8-38-spons%26psc%3D1&qualifier=1631700539&id=3037926458547183&widgetName=sp_btf
"Betron B25 Earphones, Noise Isolating In-Ear Wired Headphones with Strong Bass, Tangle-Free Cord, Lightweight, Carry Case and Soft Earbud Tips, Black",£9.99,4.2 out of 5 stars,"19,095",https://www.amazon.co.uk//gp/slredirect/picassoRedirect.html/ref=pa_sp_atf_next_aps_sr_pg3_1?ie=UTF8&adId=A08182092WN6XREB7Z00K&url=%2FBetron-Headphones-Earphones-Smartphones-Microphone-Black%2Fdp%2FB00P89DXYI%2Fref%3Dsr_1_33_sspa%3Fdchild%3D1%26keywords%3Dearphones%26qid%3D1631700540%26sr%3D8-33-spons%26psc%3D1&qualifier=1631700540&id=5249915206413911&widgetName=sp_atf_next
"Wireless Earbuds Bluetooth Earphones M2 Premium Fidelity Sound Quality, True Wireless Earbuds with Mic and 30Hrs Playtime, in-Ear Stereo Touch Control Headphones for Sport Black",£21.99,4.4 out of 5 stars,77,https://www.amazon.co.uk//gp/slredirect/picassoRedirect.html/ref=pa_sp_atf_next_aps_sr_pg3_1?ie=UTF8&adId=A07754637DO9NSP2WFD4&url=%2FWireless-Bluetooth-Earphones-Fidelity-Headphones-Black%2Fdp%2FB0972PD2ZY%2Fref%3Dsr_1_34_sspa%3Fdchild%3D1%26keywords%3Dearphones%26qid%3D1631700540%26sr%3D8-34-spons%26psc%3D1%26smid%3DAT2JKSK7ID19U&qualifier=1631700540&id=5249915206413911&widgetName=sp_atf_next
"Wireless Earbuds, Soundcore by Anker Life A1 Bluetooth Earbuds, Powerful Customized Sound, 35H Playtime, Wireless Charging, USB-C Fast Charge, IPX7 Waterproof, Button Control, Commute, Sports",£39.99,4.5 out of 5 stars,"1,524",https://www.amazon.co.uk//Soundcore-Wireless-Customized-Waterproof-Bluetooth-Black/dp/B08KDZ2NZX/ref=sr_1_35?dchild=1&keywords=earphones&qid=1631700540&sr=8-35
"New Beats Flex Wireless Earphones – Apple W1 Headphone Chip, Magnetic Earbuds, Class 1 Bluetooth, 12 Hours of Listening Time, Built-in Microphone - Black (Latest Model)",£40.39,4.4 out of 5 stars,"1,614",https://www.amazon.co.uk//Beats-Flex-Wireless-Earphones-Built/dp/B08L6YRFDC/ref=sr_1_36?dchild=1&keywords=earphones&qid=1631700540&sr=8-36
Apple AirPods with Charging Case (Wired),£109.00,4.8 out of 5 stars,"106,511",https://www.amazon.co.uk//Apple-Airpods-Charging-latest-Model/dp/B07PZR3PVB/ref=sr_1_37?dchild=1&keywords=earphones&qid=1631700540&sr=8-37
"Betron BS10 Earphones, In Ear Headphone, Noise Isolating Earbuds, Powerful Bass Sound, 3.5mm Jack, Black",£10.99,4.3 out of 5 stars,"8,170",https://www.amazon.co.uk//Betron-Earphones-Headphones-Powerful-Ergonomic-Black/dp/B01M2V05RE/ref=sr_1_38?dchild=1&keywords=earphones&qid=1631700540&sr=8-38
"Betron B25 Earphones, Noise Isolating In-Ear Wired Headphones with Strong Bass, Tangle-Free Cord, Lightweight, Carry Case and Soft Earbud Tips, Silver",£9.99,4.2 out of 5 stars,"2,544",https://www.amazon.co.uk//gp/slredirect/picassoRedirect.html/ref=pa_sp_mtf_aps_sr_pg3_1?ie=UTF8&adId=A0982947PABHJO3QXGOK&url=%2FBetron-Isolating-Headphones-Earphones-Silver-Black-Black-Silver%2Fdp%2FB00P89DY6K%2Fref%3Dsr_1_39_sspa%3Fdchild%3D1%26keywords%3Dearphones%26qid%3D1631700540%26sr%3D8-39-spons%26psc%3D1&qualifier=1631700540&id=5249915206413911&widgetName=sp_mtf
"Betron BS10 Earphones, In Ear Headphones Earphones with Microphone and Volume Control, Powerful Bass Driven Sound, 12mm Large Drivers, Ergonomic Design, Black",£12.99,4.3 out of 5 stars,"12,951",https://www.amazon.co.uk//Betron-Earphones-Headphones-Microphone-Ergonomic-Black/dp/B01MA1MJ6H/ref=sr_1_40?dchild=1&keywords=earphones&qid=1631700540&sr=8-40
"Linklike Quad Dynamic Drivers Air-flow Hi-Res Extra Bass Headphones Noise Isolating Wired Earbuds with Microphone, Lightweight Earphones with Volume Control 3.5mm Jack In-Ear Headphones (Bright Black)",£19.99,4.3 out of 5 stars,"4,189",https://www.amazon.co.uk//Linklike-Headphones-Microphone-Lightweight-Earphones-Bright-Black/dp/B07MZ6624S/ref=sr_1_41?dchild=1&keywords=earphones&qid=1631700540&sr=8-41
"Wireless Earphones Bluetooth Earbuds for Running, Bluetooth Earphones with Microphone, True Wireless Noise Cancelling Earbuds, IPX7 Waterproof Sport Earphones for Gym and Workout",£21.99,4.6 out of 5 stars,81,https://www.amazon.co.uk//Wireless-Earphones-Microphone-Cancelling-Waterproof-Black/dp/B099MY9WF7/ref=sr_1_42?dchild=1&keywords=earphones&qid=1631700540&sr=8-42
"DPS Deep Noise Reduction Earphone,Bluetooth 5.0 Wireless Stereo Headphone with HiFi Wireless in-Ear Earbud with Smart LCD Digital Display (C1)",£59.99,,,https://www.amazon.co.uk//Reduction-Earphone-Bluetooth-Wireless-Headphone-C1/dp/B09D3N741F/ref=sr_1_43?dchild=1&keywords=earphones&qid=1631700540&sr=8-43
"UGREEN HiTune Wired Earphones, In Ear 3.5mm Headphones with Stereo Audio, Microphones, Line Control, Noise Isolation Earbud Compatible with S10 PS5 PS4 Xbox iPhone iPad MP3 Laptop with 3.5mm Jack",£9.99,4.4 out of 5 stars,48,https://www.amazon.co.uk//gp/slredirect/picassoRedirect.html/ref=pa_sp_mtf_aps_sr_pg3_1?ie=UTF8&adId=A04595913V8OE369RJ9Z7&url=%2FUGREEN-Earphones-Headphones-Definition-Isolation%2Fdp%2FB08TQSV2BS%2Fref%3Dsr_1_44_sspa%3Fdchild%3D1%26keywords%3Dearphones%26qid%3D1631700540%26sr%3D8-44-spons%26psc%3D1&qualifier=1631700540&id=5249915206413911&widgetName=sp_mtf
"Sony WF-XB700 Truly Wireless Bluetooth Headphones, with Extra Bass, up to 18h battery life, splash and sweat resistance, Built-in Mic and Voice Assistant - Black",£69.99,4.4 out of 5 stars,"3,032",https://www.amazon.co.uk//Sony-Bluetooth-Headphones-resistance-Assistant-Black/dp/B086LKXYMD/ref=sr_1_45?dchild=1&keywords=earphones&qid=1631700540&sr=8-45
"Sony MDREX650APT.CE7 Earphones with Brass Housing, Smartphone Mic and Control - Gold/black",£44.29,4.4 out of 5 stars,"2,353",https://www.amazon.co.uk//Sony-MDREX650APT-CE7-Earphones-Housing-Smartphone-Gold-black/dp/B00I3LV11K/ref=sr_1_46?dchild=1&keywords=earphones&qid=1631700540&sr=8-46
Jabra Elite Active 65t Earbuds - Passive Noise Cancelling Bluetooth Sports Earphones with Motion Sensor for Fitness Tracking - True Wireless Calls and Music - Copper Blue,£55.65,4.3 out of 5 stars,"3,932",https://www.amazon.co.uk//Jabra-Wireless-Bluetooth-Earbuds-Charging-Copper-Blue/dp/B07BHY7M8P/ref=sr_1_47?dchild=1&keywords=earphones&qid=1631700540&sr=8-47
"Powerbeats Pro Wireless Earphones - Apple H1 Headphone Chip, Class 1 Bluetooth, 9 Hours Of Listening Time, Sweat Resistant Earbuds, Built-in Microphone - Navy",£169.00,4.5 out of 5 stars,"8,226",https://www.amazon.co.uk//Powerbeats-Pro-Wireless-Earphones-headphone/dp/B07W4LWQF3/ref=sr_1_48?dchild=1&keywords=earphones&qid=1631700540&sr=8-48
"Betron YSM1000 Earphones, In-Ear Wired Headphones with Bass Driven Sound, Tangle-Free Wire, Noise Isolating",£15.99,4.2 out of 5 stars,"13,229",https://www.amazon.co.uk//gp/slredirect/picassoRedirect.html/ref=pa_sp_mtf_aps_sr_pg3_1?ie=UTF8&adId=A08246201ZFYVWB5RQE37&url=%2FBetron-Earphones-Headphones-Definition-Microphone-gold-black%2Fdp%2FB00S2P0M1C%2Fref%3Dsr_1_49_sspa%3Fdchild%3D1%26keywords%3Dearphones%26qid%3D1631700540%26sr%3D8-49-spons%26psc%3D1&qualifier=1631700540&id=5249915206413911&widgetName=sp_mtf
"Bluetooth Wireless Earbuds, Votomy Bluetooth Earphones In Ear with Noise Cancellation & Deep Bass, 200H Playtime, LED Display, Touch Control, IPX7 Waterproof, HD Stereo Earphones w/Built-in Mic",£49.99,4.7 out of 5 stars,113,https://www.amazon.co.uk//Bluetooth-Votomy-Earphones-Cancellation-Waterproof-Black-V20/dp/B096B8ZCJJ/ref=sr_1_50?dchild=1&keywords=earphones&qid=1631700540&sr=8-50
TOZO T12 Wireless Earbuds Bluetooth Headphones Premium Fidelity Sound Quality Wireless Charging Case Digital LED Intelligence Display IPX8 Waterproof Earphones Built-in Mic Headset for Sport Black,£39.98,4.4 out of 5 stars,"27,127",https://www.amazon.co.uk//TOZO-Bluetooth-Headphones-Intelligence-Waterproof-Black/dp/B085DL3KMR/ref=sr_1_51?dchild=1&keywords=earphones&qid=1631700540&sr=8-51
PALOVUE Lightning Headphones Earphones Earbuds Compatible iPhone 12 11 Pro Max iPhone X XS Max XR iPhone 8 Plus iPhone 7 Plus MFi Certified with Microphone Controller SweetFlow (Black),£19.99,4.2 out of 5 stars,"9,257",https://www.amazon.co.uk//PALOVUE-Headphones-Compatible-Microphone-SweetFlow-Black/dp/B083BT3VXZ/ref=sr_1_52?dchild=1&keywords=earphones&qid=1631700540&sr=8-52
