Description,Price,Ratings,Review Count,URL
"Sephia SP4080VC Earphones, In Ear Headphones Earphones with Microphone and Volume Control, Case and Various Earbud Tips",£10.99,4.3 out of 5 stars,729,https://www.amazon.co.uk//gp/slredirect/picassoRedirect.html/ref=pa_sp_mtf_aps_sr_pg12_1?ie=UTF8&adId=A0061604BU0U9XP9KAHW&url=%2FSephia-Earphones-Isolating-Headphones-Microphone-Control%2Fdp%2FB079T6MLNC%2Fref%3Dsr_1_188_sspa%3Fdchild%3D1%26keywords%3Dearphones%26qid%3D1631700553%26sr%3D8-188-spons%26psc%3D1&qualifier=1631700553&id=8489176958999562&widgetName=sp_mtf
"LYCHL Wireless Headphones, Bluetooth 5.1 Earbuds 40H Playtime Wireless Earbuds with Earhooks & LED Display Charging Case IP7 Waterproof Noise Cancelling In Ear Headphones for Sport Gym Workout Running",£21.66,4.2 out of 5 stars,"1,545",https://www.amazon.co.uk//Headphones-Bluetooth-Earphones-Waterproof-Cancelling-Black/dp/B08978YSWG/ref=sr_1_189?dchild=1&keywords=earphones&qid=1631700553&sr=8-189
"Bang & Olufsen Beoplay E6 Motion In - Ear Wireless Earphones - Active Earphones, Graphite",,3.9 out of 5 stars,56,https://www.amazon.co.uk//Bang-Olufsen-Beoplay-Wireless-Earphones-Graphite/dp/B07RS4G7BJ/ref=sr_1_190?dchild=1&keywords=earphones&qid=1631700553&sr=8-190
"Wireless Headphones Sports, Wireless Earbuds Bluetooth 5.1 with 2 Pairs of M/L Detachable Earhooks, Touch Control Bluetooth Sport Earphones with HD Mic Stereo Running Bluetooth Headphones 30H Playtime",£29.99,4.8 out of 5 stars,46,https://www.amazon.co.uk//Wireless-Headphones-Bluetooth-Detachable-Earphones-black/dp/B09B76NZSK/ref=sr_1_191?dchild=1&keywords=earphones&qid=1631700553&sr=8-191
"Taopod Wireless Headphones, Bluetooth 5.1 Wireless Earbuds with Mic, 36H Playtime with Compact Charging Case, Deep Bass, Touch Control, IPX7 Waterproof Portable for Sports (Black)",£21.99,4.9 out of 5 stars,46,https://www.amazon.co.uk//Wireless-Headphones-Bluetooth-Playtime-Waterproof-Black/dp/B099DNJD6T/ref=sr_1_192?dchild=1&keywords=earphones&qid=1631700553&sr=8-192
VPB Heavy bass Earphone Color Call with Mic Stereo Earbud Headphones Mixed Colors (Black + White + Pink + Green 4 Pairs),£8.99,4.3 out of 5 stars,555,https://www.amazon.co.uk//gp/slredirect/picassoRedirect.html/ref=pa_sp_mtf_aps_sr_pg12_1?ie=UTF8&adId=A0391072JAE3NWX8NNL4&url=%2FVPB-Headphones-Microphone-Compatible-Smartphones%2Fdp%2FB07RPYH9C8%2Fref%3Dsr_1_193_sspa%3Fdchild%3D1%26keywords%3Dearphones%26qid%3D1631700553%26sr%3D8-193-spons%26psc%3D1&qualifier=1631700553&id=8489176958999562&widgetName=sp_mtf
Samsung Galaxy Buds Pro - Wireless Earphones Black,£133.85,4.3 out of 5 stars,458,https://www.amazon.co.uk//Samsung-Galaxy-Buds-Pro-Earphones-Black/dp/B08QYRYH9J/ref=sr_1_194?dchild=1&keywords=earphones&qid=1631700553&sr=8-194
Nothing ear(1) - Earbuds,£99.99,,,https://www.amazon.co.uk//2140110001A-Nothing-ear-1-Earbuds/dp/B09C8NKJ8Z/ref=sr_1_195?dchild=1&keywords=earphones&qid=1631700553&sr=8-195
E18 Wireless Earbuds Bluetooth 5.0 Earbuds 3D Stereo Sound True Wireless Earphones with Mic One-Step Pairing In ear Wireless Headphones Snug Design Bluetooth Earphones Grey,,4.0 out of 5 stars,5,https://www.amazon.co.uk//Wireless-Bluetooth-Earphones-One-Step-Headphones-Grey/dp/B097ZQ5866/ref=sr_1_196?dchild=1&keywords=earphones&qid=1631700553&sr=8-196
"Sennheiser MOMENTUM True Wireless In-Ear Headphones with Touch Control, Transparent Hearing and Charging Case",,3.9 out of 5 stars,"2,563",https://www.amazon.co.uk//Sennheiser-MOMENTUM-True-Wireless-Transparent-Black-Silver/dp/B07HRHM8F3/ref=sr_1_197?dchild=1&keywords=earphones&qid=1631700553&sr=8-197
"Bluedio Earphones, Li Pro Wired Earbuds In-Ear Magnetic Headphones with Mic, 7.1 Channel Virtual USB Surround Stereo, Noise Isolating for Computer, Smartphones, PSP which Support 3.5mm (Black)",£15.99,4.0 out of 5 stars,648,https://www.amazon.co.uk//gp/slredirect/picassoRedirect.html/ref=pa_sp_btf_aps_sr_pg12_1?ie=UTF8&adId=A09839163UT84N6DSO18T&url=%2FBluedio-Li-Pro-Headphones-Smartphones-Black%2Fdp%2FB086MZPL8P%2Fref%3Dsr_1_198_sspa%3Fdchild%3D1%26keywords%3Dearphones%26qid%3D1631700553%26sr%3D8-198-spons%26psc%3D1&qualifier=1631700553&id=8489176958999562&widgetName=sp_btf
"Mifo O5 Gen2 Wireless Earbuds,Bluetooth 5.2 Wireless Earphones,CVC8.0 Noise Cancelling Earbuds,IP67 Waterproof Sport In-ear Headphones,150hrs Playtime with 2600mAh charging case",£109.99,,,https://www.amazon.co.uk//gp/slredirect/picassoRedirect.html/ref=pa_sp_atf_next_aps_sr_pg13_1?ie=UTF8&adId=A066212830Y4KWL68APWA&url=%2FBluetooth-Earphones-Cancelling-Waterproof-Headphones-gray%2Fdp%2FB099PPMGN1%2Fref%3Dsr_1_193_sspa%3Fdchild%3D1%26keywords%3Dearphones%26qid%3D1631700555%26sr%3D8-193-spons%26psc%3D1&qualifier=1631700555&id=1788301178669125&widgetName=sp_atf_next
"True Wireless Earbuds, Bluetooth 5 Headphones with Wireless Charging Case, In-Ear Detection, Ultra-Low-Latency, IPX5 Water Resistance, and 30-Hour Playtime for iPhones",£22.99,5.0 out of 5 stars,1,https://www.amazon.co.uk//gp/slredirect/picassoRedirect.html/ref=pa_sp_atf_next_aps_sr_pg13_1?ie=UTF8&adId=A0026485D63I315U08BR&url=%2FBluetooth-Headphones-Detection-Ultra-Low-Latency-Resistance-Black%2Fdp%2FB099ZK2FW5%2Fref%3Dsr_1_194_sspa%3Fdchild%3D1%26keywords%3Dearphones%26qid%3D1631700555%26sr%3D8-194-spons%26psc%3D1&qualifier=1631700555&id=1788301178669125&widgetName=sp_atf_next
"SoundPEATS T2 Hybrid Active Noise Cancelling Wireless Earbuds in-Ear Bluetooth 5.1 Headphones ANC Wireless Earphones with Transparency Mode, Touch Control, Total 30 Hours, USB-C Charge, Stereo Sound",£59.99,4.5 out of 5 stars,75,https://www.amazon.co.uk//SoundPEATS-T2-Cancelling-Headphones-Transparency-Black/dp/B098779PDV/ref=sr_1_195?dchild=1&keywords=earphones&qid=1631700555&sr=8-195
"HUAWEI FreeBuds 4i - Wireless In-Ear Bluetooth Earphones with Comfortable Active Noise Cancellation, Fast Charging, Long Battery Life, Crystal Clear Sound Dual-Mic Earbuds, Ceramic White",£64.99,4.3 out of 5 stars,331,https://www.amazon.co.uk//HUAWEI-FreeBuds-Ear-Comfortable-Cancellation/dp/B08WH2CNDZ/ref=sr_1_196?dchild=1&keywords=earphones&qid=1631700555&sr=8-196
2021 Upgraded Version MIFO O5 PLUS Gen 2 TWS True Wireless Earbuds Stereo Sound Bluetooth 5.0 100h Playtime Waterproof Built in Mic Wireless Sports Earphones for Running 2600mAH Charging Case,£89.99,4.2 out of 5 stars,848,https://www.amazon.co.uk//Wireless-Bluetooth-Playtime-Waterproof-Earphones/dp/B07WT2S84D/ref=sr_1_197?dchild=1&keywords=earphones&qid=1631700555&sr=8-197
"Wireless Earbuds GUSGU Bluetooth 5.0 True Wireless Earphones,IPX7 Waterproof HiFi Stereo Sound CVC8.0 Tech In Ear Headphones with Mic,One-Step Pairing,up to 90H Playtime with Wireless Charging Case",£39.99,4.4 out of 5 stars,863,https://www.amazon.co.uk//GUSGU-Bluetooth-Earphones-Waterproof-Headphones/dp/B082FJHF56/ref=sr_1_198?dchild=1&keywords=earphones&qid=1631700555&sr=8-198
"Betron RK300 Earphones, Wired In-Ear Headphones Earphones, Noise Isolating, Enhanced Bass, Tangle-Free Cord, Black",£11.99,4.3 out of 5 stars,"3,353",https://www.amazon.co.uk//gp/slredirect/picassoRedirect.html/ref=pa_sp_mtf_aps_sr_pg13_1?ie=UTF8&adId=A08123161TGGFVP8ECRH8&url=%2FBetron-Earphones-Headphones-Isolating-Lightweight-Black%2Fdp%2FB00O35B89K%2Fref%3Dsr_1_199_sspa%3Fdchild%3D1%26keywords%3Dearphones%26qid%3D1631700555%26sr%3D8-199-spons%26psc%3D1&qualifier=1631700555&id=1788301178669125&widgetName=sp_mtf
"Cleer Ally Wireless Earbuds, Extended Battery Life Up To 10 Hours, Bluetooth Headphones Gun Metal",£99.99,4.2 out of 5 stars,58,https://www.amazon.co.uk//Cleer-Wireless-Extended-Bluetooth-Headphones-Gun-Metal/dp/B07R8WT9N3/ref=sr_1_200?dchild=1&keywords=earphones&qid=1631700555&sr=8-200
"Wireless Earbuds Bluetooth Earbuds in-Ear Wireless Earphones 5.1 IPX6 Waterproof, Hi-Fi Stereo Bluetooth Headphones Playtimes 35 Hours with Charging Case Noise-Reduction Earbuds for iPhone Samsung",£30.97,4.6 out of 5 stars,18,https://www.amazon.co.uk//Bluetooth-Earphones-Waterproof-Headphones-Noise-Reduction-black/dp/B092QKQJ6C/ref=sr_1_201?dchild=1&keywords=earphones&qid=1631700555&sr=8-201
"Urbanista London True Wireless Earbuds Headphones with Active Noise Cancelling, 25 Hours Playtime, Touch Controls & 6 Microphones for Clear Calling, Bluetooth 5.0 Earphones, Pink",£99.99,3.8 out of 5 stars,478,https://www.amazon.co.uk//Urbanista-Headphones-Cancelling-Microphones-Bluetooth-Rose-Gold/dp/B08CVP6NMC/ref=sr_1_202?dchild=1&keywords=earphones&qid=1631700555&sr=8-202
"Wireless Headphones, Wireless Earbuds Bluetooth Headphones with Mic, 2600mAh 70H Playtime, HI-FI Stereo In Ear Headphones with LED Torch, IP7 Waterproof Sport Wireless Earphones for iOS Android, Black",£29.99,4.4 out of 5 stars,133,https://www.amazon.co.uk//Wireless-Headphones-Bluetooth-Waterproof-Earphones-Black/dp/B097Y7P66V/ref=sr_1_203?dchild=1&keywords=earphones&qid=1631700555&sr=8-203
"Wireless Earbuds, Bluetooth Headphones In Ear Running Earphones with Noise Cancelling Mic, Built-in Microphone, IPX7 Waterproof, Upgrade Wireless Headset for laptop/Sports",£13.38,4.2 out of 5 stars,33,https://www.amazon.co.uk//gp/slredirect/picassoRedirect.html/ref=pa_sp_mtf_aps_sr_pg13_1?ie=UTF8&adId=A01182352S5HADGSU3RWR&url=%2FBluetooth-Headphones-Cancelling-Microphone-Waterproof-Black%2Fdp%2FB0963KS4NM%2Fref%3Dsr_1_204_sspa%3Fdchild%3D1%26keywords%3Dearphones%26qid%3D1631700555%26sr%3D8-204-spons%26psc%3D1&qualifier=1631700555&id=1788301178669125&widgetName=sp_mtf
"JLab JBuds Air Sport True Wireless Earbuds, Sports Headphones - Bluetooth Earbuds with IP55 Sweat Resistant and Be Aware Audio - Wireless Earphones Running with Charging Case, Custom EQ3 Sound, Black",£49.99,4.2 out of 5 stars,"5,434",https://www.amazon.co.uk//Audio-Wireless-Bluetooth-Earbuds-Charging-Black/dp/B07R7DT3JV/ref=sr_1_205?dchild=1&keywords=earphones&qid=1631700555&sr=8-205
"DIZO Wireless Earbuds, Active Noise Cancellation headphones Built in Mic, Bluetooth 5.0 earphones with Waterproof, Instant connect 20H Playtime Low Latency Game Mode Bass Boost",£29.99,4.9 out of 5 stars,19,https://www.amazon.co.uk//DIZO-Cancellation-headphones-Bluetooth-Waterproof-Black/dp/B095KJ8SBD/ref=sr_1_206?dchild=1&keywords=earphones&qid=1631700555&sr=8-206
OPPO Enco X True Wireless Bluetooth Headphones In-Ear Earbuds Hybrid Active Noise Cancellation Wireless Charging IP54 AAC SBC - White,£158.09,4.2 out of 5 stars,292,https://www.amazon.co.uk//OPPO-Wireless-Bluetooth-Headphones-Cancellation-White/dp/B08MVC9CTC/ref=sr_1_207?dchild=1&keywords=earphones&qid=1631700555&sr=8-207
"Defunc True Music - True Wireless Earphones - Earbuds with Bluetooth 5.0, Built in Microphone - TWS Stereo - Silicone Tip Headphones for Secure Comfort - IPX4 Rain & Sweatproof Buds",£27.99,4.6 out of 5 stars,57,https://www.amazon.co.uk//Defunc-True-Music-Microphone-Headphones-Black/dp/B0924SJ2ZT/ref=sr_1_208?dchild=1&keywords=earphones&qid=1631700555&sr=8-208
"Betron B550s Earphones, Wired In-Ear Headphones Earphones with Bass Driven Sound, Tangle-Free Cable, Noise Isolating, Silver",£9.99,4.2 out of 5 stars,"5,098",https://www.amazon.co.uk//gp/slredirect/picassoRedirect.html/ref=pa_sp_mtf_aps_sr_pg13_1?ie=UTF8&adId=A081903628S6HPSCJOI58&url=%2FBetron-Isolating-Headphones-Earphones-Powerful-Silver%2Fdp%2FB00JLFC0MQ%2Fref%3Dsr_1_209_sspa%3Fdchild%3D1%26keywords%3Dearphones%26qid%3D1631700555%26sr%3D8-209-spons%26psc%3D1&qualifier=1631700555&id=1788301178669125&widgetName=sp_mtf
"AfterShokz Trekz Titanium Wireless Bone Conduction Headphones Bluetooth Sweatproof Earphones with Mic for Sports, Canyon Red",£55.96,4.5 out of 5 stars,"22,122",https://www.amazon.co.uk//AfterShokz-Conduction-Headphones-Bluetooth-Sweatproof-Canyon-Red/dp/B07PDDK7TV/ref=sr_1_210?dchild=1&keywords=earphones&qid=1631700555&sr=8-210
"[Upgrade Version 2021] True Wireless Earbuds, mifo O7 Bluetooth Earbuds 5.0 with Charging Case, Bluetooth Headphones Built-in Mic Noise Cancelling Earphones with Deep Bass for Sport",£149.99,3.9 out of 5 stars,195,https://www.amazon.co.uk//mifo-O7-Bluetooth-Headphones-Cancelling-Grey/dp/B0855GZF8J/ref=sr_1_211?dchild=1&keywords=earphones&qid=1631700555&sr=8-211
Bose QuietControl 30 Wireless In-Ear Headphones - Black,,3.8 out of 5 stars,"2,360",https://www.amazon.co.uk//Bose-Quietcontrol-Cancelling-Bluetooth-Headphones/dp/B01HETFQA8/ref=sr_1_212?dchild=1&keywords=earphones&qid=1631700555&sr=8-212
"Avantree TW115 Tiny True Wireless Earbuds for Small Ear Canals, Sport Bluetooth 5.0 Earphones with Noise Isolation & Mic, Comfortable & Secure Fit, 36H In Ear Headphones with Wireless Charging Case",£34.99,4.2 out of 5 stars,453,https://www.amazon.co.uk//Avantree-Comfortable-Headphones-Bluetooth-Isolation-Black/dp/B07QDST5LG/ref=sr_1_213?dchild=1&keywords=earphones&qid=1631700555&sr=8-213
"TATUNER Wireless Earbuds, Bluetooth Headphones 5.1, 30H Playtime USB-C Fast Charge, HiFi Stereo Earphones, Built-in Microphone IPX8 Waterproof in Ear Ear buds, Suitable for Work, Running (White)",£35.99,4.8 out of 5 stars,139,https://www.amazon.co.uk//gp/slredirect/picassoRedirect.html/ref=pa_sp_btf_aps_sr_pg13_1?ie=UTF8&adId=A05143013625S7AXUC35R&url=%2FTATUNER-Bluetooth-Headphones-Microphone-Waterproof-White%2Fdp%2FB098XH7FL6%2Fref%3Dsr_1_214_sspa%3Fdchild%3D1%26keywords%3Dearphones%26qid%3D1631700555%26sr%3D8-214-spons%26psc%3D1&qualifier=1631700555&id=1788301178669125&widgetName=sp_btf
Wireless Headphones Bluetooth 5.0 Earphones True Wireless Earbuds HD Stereo Bass Sound Mini in Ear Bluetooth Earbuds with Built in Mic IPX6 Waterproof/30 Hrs with USB-C Charging for Work/Travel(Black),£13.99,4.2 out of 5 stars,258,https://www.amazon.co.uk//gp/slredirect/picassoRedirect.html/ref=pa_sp_atf_next_aps_sr_pg14_1?ie=UTF8&adId=A08625681DM8UVOPTTSYN&url=%2FWireless-Headphones-Bluetooth-Earphones-Waterproof-Black%2Fdp%2FB08R776ZZZ%2Fref%3Dsr_1_209_sspa%3Fdchild%3D1%26keywords%3Dearphones%26qid%3D1631700556%26sr%3D8-209-spons%26psc%3D1&qualifier=1631700556&id=4189306183834094&widgetName=sp_atf_next
USB C HiFi Stereo In-Ear Headphones with Microphone and Volume Control Bass Earphones Type C Black,£13.99,,,https://www.amazon.co.uk//gp/slredirect/picassoRedirect.html/ref=pa_sp_atf_next_aps_sr_pg14_1?ie=UTF8&adId=A0215736250SYYQKDPXBD&url=%2FStereo-Headphones-Microphone-Control-Earphones-Black%2Fdp%2FB097B81R7S%2Fref%3Dsr_1_210_sspa%3Fdchild%3D1%26keywords%3Dearphones%26qid%3D1631700556%26sr%3D8-210-spons%26psc%3D1&qualifier=1631700556&id=4189306183834094&widgetName=sp_atf_next
"Monster Wireless Earbuds 700 ANC Wireless Earphones/Active Noise Cancelling Bluetooth Earbuds with aptX Codec Hi-Fi Audio/CVC 8.0 Mic, 28Hrs ANC Earphones/Type-C Charging (Black)",£129.99,4.2 out of 5 stars,6,https://www.amazon.co.uk//Monster-Wireless-Earphones-Cancelling-Bluetooth-Black/dp/B07HVK7J2G/ref=sr_1_211?dchild=1&keywords=earphones&qid=1631700556&sr=8-211
Samsung Galaxy Buds - Black (UK Version),£97.00,4.5 out of 5 stars,"7,598",https://www.amazon.co.uk//Samsung-SM-R170-Galaxy-Buds-Black/dp/B07NLLLXNX/ref=sr_1_212?dchild=1&keywords=earphones&qid=1631700556&sr=8-212
1MORE E1001BT-SILVER Triple Driver Bt In-Ear Headphones Bluetooth Earphones With Hi-Res Ldac Wireless Sound Quality,£89.00,3.9 out of 5 stars,382,https://www.amazon.co.uk//1MORE-Bluetooth-Headphones-Microphone-Environmental-Sliver/dp/B0829NW67M/ref=sr_1_213?dchild=1&keywords=earphones&qid=1631700556&sr=8-213
"IKKO Gems OH1S in-Ear Monitor,Wired Earbuds Headphones, Noise-Isolating IEM Earphones with MMCX Detachable Cables,Blue",,4.7 out of 5 stars,27,https://www.amazon.co.uk//Monitor-Headphones-Noise-Isolating-Earphones-Detachable-blue/dp/B09655VHL7/ref=sr_1_214?dchild=1&keywords=earphones&qid=1631700556&sr=8-214
"ZCOTU Lightning Earphone for iPhone,In-Ear Headphones Wired Earbuds Support Microphone Volume Control Compatible with i Phone 12 Mini Pro Max 11 SE XR XS 7 8 Plus(MFi Certified-White)",£14.98,4.0 out of 5 stars,102,https://www.amazon.co.uk//gp/slredirect/picassoRedirect.html/ref=pa_sp_mtf_aps_sr_pg14_1?ie=UTF8&adId=A01886983BYA1DS0XTDMW&url=%2FZCOTU-Headphones-Microphone-Compatible-Certified-White-MFi%2Fdp%2FB08Z3ZMDT5%2Fref%3Dsr_1_215_sspa%3Fdchild%3D1%26keywords%3Dearphones%26qid%3D1631700556%26sr%3D8-215-spons%26psc%3D1&qualifier=1631700556&id=4189306183834094&widgetName=sp_mtf
Sony WI-SP600N Wireless Sports Headphones with Noise Cancelling and IPX4 Splash Proof - Black,£122.99,3.6 out of 5 stars,336,https://www.amazon.co.uk//Sony-WI-SP600N-Wireless-Headphones-Cancelling-Black/dp/B078VGQ1WR/ref=sr_1_216?dchild=1&keywords=earphones&qid=1631700556&sr=8-216
"2 PACK Headphones for iPhone,In Ear wired Earphones with Microphone and Volume Control HiFi-Audio Stereo Noise Isolating Sport Earbud Compatible with iPhone 12/SE/11/XS/X/XR/8/8P/7/7P Support All iOS",£12.99,4.6 out of 5 stars,"1,635",https://www.amazon.co.uk//Headphones-Earphones-Microphone-HiFi-Audio-Compatible-WD-2PC-A2/dp/B097ZM1WLB/ref=sr_1_217?dchild=1&keywords=earphones&qid=1631700556&sr=8-217
"3 Pack Earphones, In-Ear Headphones Wired Earbuds, Noise Isolating Headset With Microphone, Heavy Deep Bass, Compatible with Phone Pad Samsung HuaWei MP3 Players Tablets and Laptops",£8.99,4.1 out of 5 stars,420,https://www.amazon.co.uk//Earphones-Headphones-Isolating-Microphone-Compatible-Black/dp/B08HYK6G5B/ref=sr_1_218?dchild=1&keywords=earphones&qid=1631700556&sr=8-218
"Bang & Olufsen Beoplay EQ - Active Noise Cancelling wireless earphones with microphone, up to 20 hours of playtime, Sand",£349.00,4.0 out of 5 stars,12,https://www.amazon.co.uk//Bang-Olufsen-Beoplay-Cancelling-microphone-Sand/dp/B08WLY9GVW/ref=sr_1_219?dchild=1&keywords=earphones&qid=1631700556&sr=8-219
"Sephia SP9090VC Earphones, Wired in Ear Headphones with Mic and Volume Control, Noise Isolating Earphone Tips",£10.99,4.0 out of 5 stars,633,https://www.amazon.co.uk//gp/slredirect/picassoRedirect.html/ref=pa_sp_mtf_aps_sr_pg14_1?ie=UTF8&adId=A00532322O7PN3HGGY588&url=%2FSephia-SP9090-Earphones-Headphones-Smartphones-Control-Mic%2Fdp%2FB079GB8ZX9%2Fref%3Dsr_1_220_sspa%3Fdchild%3D1%26keywords%3Dearphones%26qid%3D1631700556%26sr%3D8-220-spons%26psc%3D1&qualifier=1631700556&id=4189306183834094&widgetName=sp_mtf
"DPS Deep Noise Reduction Earphones,Sport Headphones Bluetooth 5.0 EDR Wireless Stereo HiFi in-Ear Earbuds for Gym Running Outdoor Sports Workout (Black 13) (D9)",£59.99,,,https://www.amazon.co.uk//Reduction-Earphones-Headphones-Bluetooth-Wireless-D9/dp/B09D9LN9PG/ref=sr_1_221?dchild=1&keywords=earphones&qid=1631700556&sr=8-221
"KZ AS16 Hifi Earbuds IEM Headphones 8BA Drivers,Yinyoo Wired In Ear Monitors KZ Audio Headsets High Fidelity In Ear Earphones for Musician",£120.76,4.5 out of 5 stars,120,https://www.amazon.co.uk//Headphones-Yinyoo-Monitors-Headsets-Earphones-Blue/dp/B07T2X3MHJ/ref=sr_1_222?dchild=1&keywords=earphones&qid=1631700556&sr=8-222
"Wireless Earbuds, Bluetooth Earbuds In Ear, Bluetooth 5.0/Stereo Bass/CVC 8.0 Noise Cancelling with Microphone Wireless Headphones, IPX8 Waterproof Rating/35Hrs/USB-C/Three Modes/Touch for Sports",£14.44,4.2 out of 5 stars,188,https://www.amazon.co.uk//Bluetooth-Cancelling-Microphone-Headphones-Waterproof-Black/dp/B095K2XD9M/ref=sr_1_223?dchild=1&keywords=earphones&qid=1631700556&smid=A1HWWU5MDVP4ZO&sr=8-223
Bose SoundSport Free Truly Wireless Sport Headphones - Midnight Blue,,4.4 out of 5 stars,"11,020",https://www.amazon.co.uk//Bose-SoundSport-Truly-Wireless-Headphones-Midnight-Blue/dp/B0748JM8M5/ref=sr_1_224?dchild=1&keywords=earphones&qid=1631700556&sr=8-224
"Sephia SP2040 Earphones, In Ear Headphones with Enhanced Bass, Noise Isolating Earbud Tps, Tangle-Free Wire",£8.49,4.2 out of 5 stars,511,https://www.amazon.co.uk//gp/slredirect/picassoRedirect.html/ref=pa_sp_mtf_aps_sr_pg14_1?ie=UTF8&adId=A0582664OX19B82ZXHN1&url=%2FSephia-SP2040-Isolating-Headphones-Earphones-Black%2Fdp%2FB0170SNTVQ%2Fref%3Dsr_1_225_sspa%3Fdchild%3D1%26keywords%3Dearphones%26qid%3D1631700556%26sr%3D8-225-spons%26psc%3D1&qualifier=1631700556&id=4189306183834094&widgetName=sp_mtf
"DPS Deep Noise Reduction Earphones,Sport Headphones Bluetooth 5.0 EDR Wireless Stereo HiFi in-Ear Earbuds for Gym Running Outdoor Sports Workout (Black 13) (C9)",£59.99,5.0 out of 5 stars,1,https://www.amazon.co.uk//Reduction-Earphones-Headphones-Bluetooth-Wireless-C9/dp/B09D3NJFRT/ref=sr_1_226?dchild=1&keywords=earphones&qid=1631700556&sr=8-226
【2 Pack】Earphones For iPhone Earbuds in-Ear Wired Headphone Headest with Mic and Volume Control Compatible with iPhone 12/12Pro/11/11Pro/XS/XS Max/X/XR/8/8,£20.99,4.3 out of 5 stars,476,https://www.amazon.co.uk//Pack%E3%80%91Earphones-Earbuds-Headphone-Headest-Compatible-LC-9SS/dp/B099RZR9SS/ref=sr_1_227?dchild=1&keywords=earphones&qid=1631700556&sr=8-227
"USB C Headphones HiFi Stereo Magnetic USB Type C Earphones USB C Earbud with Mic Volume Control for Google Pixel 5 4 3 2 XL, Huawei P40 P30 P20 Mate 20, iPad Pro 2018, OnePlus 6T 8T Samsung S21 S20",£12.99,4.2 out of 5 stars,"2,575",https://www.amazon.co.uk//Headphones-Magnetic-Earbuds-Earphones-Control/dp/B07Z4NCV2J/ref=sr_1_228?dchild=1&keywords=earphones&qid=1631700556&sr=8-228
"Bowers & Wilkins PI4 Noise Cancelling Wireless Headphones, With Magnetic In-Ear Earbuds, Bluetooth 5.0 - Gold",£154.04,3.8 out of 5 stars,275,https://www.amazon.co.uk//Bowers-Wilkins-Cancelling-Headphones-Bluetooth-Gold/dp/B07WQF3G5P/ref=sr_1_229?dchild=1&keywords=earphones&qid=1631700556&sr=8-229
Running Headphones Earphones Wireless Sports Headphones Bluetooth 5.0 Earphone In-Ear Noise Cancelling Earbuds with Charging Case Waterproof/Touch Control/HI-FI Stereo (Black),£27.99,4.3 out of 5 stars,99,https://www.amazon.co.uk//gp/slredirect/picassoRedirect.html/ref=pa_sp_btf_aps_sr_pg14_1?ie=UTF8&adId=A071981425EZGWKJR1V9Y&url=%2FHeadphones-Earphones-Bluetooth-Cancelling-Waterproof-Black%2Fdp%2FB094VSW4RY%2Fref%3Dsr_1_230_sspa%3Fdchild%3D1%26keywords%3Dearphones%26qid%3D1631700556%26sr%3D8-230-spons%26psc%3D1&qualifier=1631700556&id=4189306183834094&widgetName=sp_btf
"Holiper X6 True Wireless Earbuds 3D Stereo Bluetooth Headphones in Ear with Long Battery Life, Cordless Ear Buds with Mic, Touch Control Earphones, Black",£32.99,4.1 out of 5 stars,125,https://www.amazon.co.uk//gp/slredirect/picassoRedirect.html/ref=pa_sp_atf_next_aps_sr_pg15_1?ie=UTF8&adId=A104088930H2K8XDJ4YDJ&url=%2FHoliper-X6-Headphones-Soundstage-Cancelling-Black%2Fdp%2FB0875SY4BY%2Fref%3Dsr_1_225_sspa%3Fdchild%3D1%26keywords%3Dearphones%26qid%3D1631700557%26sr%3D8-225-spons%26psc%3D1&qualifier=1631700557&id=1638743164566496&widgetName=sp_atf_next
"True Wireless Earbuds, Bluetooth 5 Headphones in Ear with Charging Case, Hands-Free Headset with Mic, Touch Control, 35 Hours Playback for iPhone and Android (Black)",£22.99,3.7 out of 5 stars,4,https://www.amazon.co.uk//gp/slredirect/picassoRedirect.html/ref=pa_sp_atf_next_aps_sr_pg15_1?ie=UTF8&adId=A1013406179QI33ZEHE4N&url=%2FWireless-Bluetooth-Headphones-Charging-Hands-Free-Black%2Fdp%2FB099NLL8RR%2Fref%3Dsr_1_226_sspa%3Fdchild%3D1%26keywords%3Dearphones%26qid%3D1631700557%26sr%3D8-226-spons%26psc%3D1&qualifier=1631700557&id=1638743164566496&widgetName=sp_atf_next
"Bluetooth Headphones, Otium Wireless Headphones IPX7 Waterproof in-Ear Earbuds Bluetooth 5.1 Earphones with 10 Hrs Playtime HD Stereo Headset for Gym Workout with Noise Cancelling Mic",£19.99,4.3 out of 5 stars,"6,059",https://www.amazon.co.uk//Bluetooth-Headphones-Waterproof-Earphones-Cancelling-Red/dp/B09C61F3C5/ref=sr_1_227?dchild=1&keywords=earphones&qid=1631700557&sr=8-227
"Sony WF-1000XM4 True Wireless Noise Cancelling Headphones - with Charging Case - Optimised for Alexa and the Google Assistant - with Built-in Mic for Phone Calls - Reliable Bluetooth Connection, Black",£249.00,4.4 out of 5 stars,715,https://www.amazon.co.uk//Sony-WF-1000XM4-Wireless-Cancelling-Headphones-Black/dp/B095DNPH4R/ref=sr_1_228?dchild=1&keywords=earphones&qid=1631700557&sr=8-228
"Edifier True Wireless Active Noise Canceling Earbuds,ANC In-ear Headphones with Button Control,Bluetooth 5.0 with aptX support IPX4 Waterproof Earphones,33-Hour Battery Life",£110.99,3.9 out of 5 stars,51,https://www.amazon.co.uk//Edifier-Canceling-Headphones-Bluetooth-Earphones/dp/B07XHH8HF5/ref=sr_1_229?dchild=1&keywords=earphones&qid=1631700557&sr=8-229
"Shure AONIC 215 True Wireless Sound Isolating Earbuds, Premium Audio Sound with Deep Bass, Bluetooth 5, Secure Fit Over-the-Ear, Long Battery Life with Charging Case, Fingertip Controls - Clear",£143.00,4.1 out of 5 stars,395,https://www.amazon.co.uk//Shure-Wireless-Isolating-Bluetooth-Fingertip/dp/B084RZSWQF/ref=sr_1_230?dchild=1&keywords=earphones&qid=1631700557&sr=8-230
"Lighting Earphones For iPhone Earbuds in-Ear Wired Headphone Headest with Mic and Volume Control Compatible whit iPhone 12/11/11 Pro/X/XS/XS Max/XR, 8 and 8 Plus / 7/7 Plus",£14.99,4.5 out of 5 stars,"1,955",https://www.amazon.co.uk//gp/slredirect/picassoRedirect.html/ref=pa_sp_mtf_aps_sr_pg15_1?ie=UTF8&adId=A00003112AT8IRJUS70YK&url=%2FLighting-Earphones-Earbuds-Headphone-Compatible-LC-F89%2Fdp%2FB099RY3F89%2Fref%3Dsr_1_231_sspa%3Fdchild%3D1%26keywords%3Dearphones%26qid%3D1631700557%26sr%3D8-231-spons%26psc%3D1%26smid%3DA365DJ0876YNXB&qualifier=1631700557&id=1638743164566496&widgetName=sp_mtf
"LINSOUL TIN HIFI T2 HiFi 2DD Double Dynamic Drive In Ear Earphone Bass DJ Metal Headphones, 3.5 mm MMCX",£45.99,4.3 out of 5 stars,"2,175",https://www.amazon.co.uk//LINSOUL-TIN-T2-Earphone-Headphones-Silver/dp/B07DL2FPBL/ref=sr_1_232?dchild=1&keywords=earphones&qid=1631700557&sr=8-232
"KZ ZSX 5BA+1DD 6 Driver Hybrid in-Ear HiFi Earphones with Zinc Alloy Faceplate, 0.75mm 2 Pin Detachable Cable (With mic, Black)",£47.99,4.4 out of 5 stars,42,https://www.amazon.co.uk//Driver-Hybrid-Earphones-Faceplate-Detachable-Black/dp/B07XDQFH48/ref=sr_1_233?dchild=1&keywords=earphones&qid=1631700557&sr=8-233
