Description,Price,Ratings,Review Count,URL
"Wireless Earbuds Bluetooth 5.1, Wireless Earphones Deep Bass Stereo Sound IPX7 Waterproof 24-Hours Playtime, Mini Wireless Headphones Touch Control Sport Headset Type-C Charging Case for Workout/Home",£24.99,5.0 out of 5 stars,18,https://www.amazon.co.uk//Wireless-Bluetooth-Earphones-Waterproof-Headphones/dp/B09BN4WQML/ref=sr_1_143?dchild=1&keywords=earphones&qid=1631700549&sr=8-143
"Betron YSM1000 Earphones, In-Ear Wired Earphones Headphones with Microphone, Deep Bass, Tangle-Free Wire, Noise Isolating Eartips",£16.99,4.2 out of 5 stars,"1,994",https://www.amazon.co.uk//gp/slredirect/picassoRedirect.html/ref=pa_sp_mtf_aps_sr_pg9_1?ie=UTF8&adId=A09695302HGKDBYXQNJOR&url=%2FBetron-Earphones-Headphones-Definition-BlackBerry-black-gold%2Fdp%2FB00S2P0M4Y%2Fref%3Dsr_1_144_sspa%3Fdchild%3D1%26keywords%3Dearphones%26qid%3D1631700549%26sr%3D8-144-spons%26psc%3D1&qualifier=1631700549&id=6366555073414898&widgetName=sp_mtf
Sennheiser CX 300S Ear-Canal Headphones with Universal Smart Remote - Black,£25.50,4.2 out of 5 stars,"1,482",https://www.amazon.co.uk//Sennheiser-Ear-Canal-Headphones-Universal-Remote-Black/dp/B07N1YLC23/ref=sr_1_145?dchild=1&keywords=earphones&qid=1631700549&sr=8-145
"SoundPEATS True Wireless Earbuds, Bluetooth 5.0 Sport Headphones In-Ear Wireless Earphones, IPX7 Waterproof, One-Step Pairing, Total 20 Hours",,4.4 out of 5 stars,"1,342",https://www.amazon.co.uk//SoundPEATS-2020-Bluetooth-Headphones-Earphones-Luxury-Black/dp/B085D8M99T/ref=sr_1_146?dchild=1&keywords=earphones&qid=1631700549&sr=8-146
"Wireless Earbuds, Aglaia Wireless Headphones with Wireless Charging,Noise Cancelling Earphones with Deep Bass,30H Playtime,IPX6 Waterproof Bluetooth Headphones with Microphone for iPhone and Android",£28.99,3.8 out of 5 stars,58,https://www.amazon.co.uk//Aglaia-Headphones-Cancelling-Waterproof-Microphone-Black/dp/B099Z91126/ref=sr_1_147?dchild=1&keywords=earphones&qid=1631700549&sr=8-147
SKULLCANDY - Sesh Evo Wireless Earphones - Black,£39.99,4.3 out of 5 stars,"18,023",https://www.amazon.co.uk//Skullcandy-Wireless-Earbuds-Bluetooth-Resistant-Black/dp/B0857JLRFJ/ref=sr_1_148?dchild=1&keywords=earphones&qid=1631700549&sr=8-148
"Otium Wireless Earbuds, Bluetooth 5.0 Earbuds IPX 6 Waterproof of 30-Hours Playtime, Wireless headphones with Touch Control, Wireless earphones with Mic and USB C Charging for Calls/Working/Travel/Gym",£16.99,4.4 out of 5 stars,759,https://www.amazon.co.uk//gp/slredirect/picassoRedirect.html/ref=pa_sp_btf_aps_sr_pg9_1?ie=UTF8&adId=A08621242YE1ATSH8CZBY&url=%2FWireless-Bluetooth-Waterproof-headphones-earphones-White%2Fdp%2FB08RMW5Y31%2Fref%3Dsr_1_149_sspa%3Fdchild%3D1%26keywords%3Dearphones%26qid%3D1631700549%26sr%3D8-149-spons%26psc%3D1&qualifier=1631700549&id=6366555073414898&widgetName=sp_btf
"Bluetooth Earphones for Musisc and Call, Holiper X08 Noise Cancelling Wireless Earbuds Bluetooth Headphones IPX5 Waterproof Touch Control Cordless in Ear Buds Built-in Microphone, Black",£21.99,3.4 out of 5 stars,8,https://www.amazon.co.uk//gp/slredirect/picassoRedirect.html/ref=pa_sp_btf_aps_sr_pg9_1?ie=UTF8&adId=A0728261QXOW9WUSOWVE&url=%2FHoliper-X08-Cancelling-Headphones-Waterproof-black%2Fdp%2FB098NHCF5T%2Fref%3Dsr_1_150_sspa%3Fdchild%3D1%26keywords%3Dearphones%26qid%3D1631700549%26sr%3D8-150-spons%26psc%3D1&qualifier=1631700549&id=6366555073414898&widgetName=sp_btf
"Anflowe ES850 Wired Sports Headphones, Half In-Ear Running Earphones with Mic & Pure Sound, Secure Fit with Ear Wings, Tangle-Free Braided Earbuds for Workouts, Gym, Jogging - Grey",£15.99,4.3 out of 5 stars,111,https://www.amazon.co.uk//gp/slredirect/picassoRedirect.html/ref=pa_sp_atf_next_aps_sr_pg10_1?ie=UTF8&adId=A03146351DKRWV2UA93YS&url=%2FAnflowe-Headphones-Earphones-Tangle-Free-Workouts-Grey%2Fdp%2FB096X9QTP3%2Fref%3Dsr_1_145_sspa%3Fdchild%3D1%26keywords%3Dearphones%26qid%3D1631700550%26sr%3D8-145-spons%26psc%3D1&qualifier=1631700550&id=8030332764626843&widgetName=sp_atf_next
"Truly Wireless Earbuds Mifo O5 II,Bluetooth 5.2 in-Ear Dual Mic Noise Cancelling Headphones,150 Hours of Playback Dymatic Bass Earphones,IPX7 Water Resistance Sport Earbuds 4 Built-in Mic",£109.99,4.7 out of 5 stars,10,https://www.amazon.co.uk//gp/slredirect/picassoRedirect.html/ref=pa_sp_atf_next_aps_sr_pg10_1?ie=UTF8&adId=A06126632YG9AP1PP382M&url=%2FBluetooth-Cancelling-Headphones-Earphones-Resistance%2Fdp%2FB07YFYK3HQ%2Fref%3Dsr_1_146_sspa%3Fdchild%3D1%26keywords%3Dearphones%26qid%3D1631700550%26sr%3D8-146-spons%26psc%3D1%26smid%3DA1GQCVSUYI0QBK&qualifier=1631700550&id=8030332764626843&widgetName=sp_atf_next
"Cshidworld Wireless Headphones, Bluetooth 5.0 Earbuds Noise Cancelling Headphones 30H Cycle Playtime Sweatproof Earphones with mic, In-Ear Headset with Charging Case",£14.99,4.1 out of 5 stars,"4,872",https://www.amazon.co.uk//Wireless-Headphones-Cshidworld-Bluetooth-5-0-Earbuds-Noise-Cancelling-Bluetooth-Headphones-30H-Cycle-Playtime-Hi-Fi-APT-X-CVC8-0-Sweatproof-Earphones-Ear-Headset-Charging-White/dp/B0872NSVDK/ref=sr_1_147?dchild=1&keywords=earphones&qid=1631700550&sr=8-147
"JBL Tune 125 TWS In-Ear Earphones - True Wireless Bluetooth headphones with powerful bass, up to 32 hours battery life and charging case, in blue",£89.00,4.2 out of 5 stars,"1,637",https://www.amazon.co.uk//JBL-True-Wireless-Bluetooth-Headphones-Blue/dp/B08CNPRFZF/ref=sr_1_148?dchild=1&keywords=earphones&qid=1631700550&sr=8-148
"Wireless Earbuds, KRAFTCARE Wireless Headphones Bluetooth 5.1 Touch Control In-Ear Earbuds with 4 Built-in Mic Stereo Wireless earphones USB-C Quick Charge 30H Playtime IPX7 Waterproof for Sports",£29.99,4.6 out of 5 stars,781,https://www.amazon.co.uk//KRAFTCARE-Headphones-Bluetooth-earphones-Waterproof-White/dp/B093NYQHZ2/ref=sr_1_149?dchild=1&keywords=earphones&qid=1631700550&sr=8-149
Samsung Galaxy Buds Live - Wireless Earphones Mystic Black,£76.00,4.3 out of 5 stars,202,https://www.amazon.co.uk//Samsung-Galaxy-Buds-Live-Earphones-Mystic-Black/dp/B08KHMX956/ref=sr_1_150?dchild=1&keywords=earphones&qid=1631700550&sr=8-150
"Betron ELR50 Earphones with Microphone, Noise Isolating Wired Headphones Earphones with Microphone and Volume Control, Carry Case, Enhanced Bass, 3.5 mm Jack, Gold",£11.99,4.2 out of 5 stars,"1,396",https://www.amazon.co.uk//gp/slredirect/picassoRedirect.html/ref=pa_sp_mtf_aps_sr_pg10_1?ie=UTF8&adId=A1035825ZUAQFR7JL3DB&url=%2FBetron-Earphones-Headphones-Isolating-Microphone-Gold%2Fdp%2FB074P5K78Q%2Fref%3Dsr_1_151_sspa%3Fdchild%3D1%26keywords%3Dearphones%26qid%3D1631700550%26sr%3D8-151-spons%26psc%3D1&qualifier=1631700550&id=8030332764626843&widgetName=sp_mtf
Sony MDREX110LPB.AE Deep Bass Earphones Black,£13.25,4.4 out of 5 stars,"4,284",https://www.amazon.co.uk//Sony-MDREX110LPB-AE-Deep-Earphones-Black/dp/B00I3LUSN2/ref=sr_1_152?dchild=1&keywords=earphones&qid=1631700550&sr=8-152
"SoundPEATS Sonic Wireless Earbuds in-Ear Bluetooth Headphone, Bluetooth 5.2 Earbuds APTX-Adaptive Wireless Earphones with Immersive Bass, TrueWireless Mirroring 35 Hrs",£49.99,4.3 out of 5 stars,"1,808",https://www.amazon.co.uk//SoundPEATS-Sonic-Bluetooth-APTX-Adaptive-TrueWireless-Black/dp/B08NB13BNM/ref=sr_1_153?dchild=1&keywords=earphones&qid=1631700550&sr=8-153
JBL TUNE 220TWS True Wireless Earbud Headphones (Black),£54.99,3.8 out of 5 stars,"1,114",https://www.amazon.co.uk//JBL-T220-Wireless-Headphone-Black/dp/B082TPPLRV/ref=sr_1_154?dchild=1&keywords=earphones&qid=1631700550&sr=8-154
GO5 Mini Wireless Earbuds Bluetooth Headphones Premium Fidelity Sound Quality Wireless Charging Case Digital LED Intelligence Display IPX7 Waterproof Earphones Built-in Mic Headset for Sport Black,£17.99,4.5 out of 5 stars,325,https://www.amazon.co.uk//Bluetooth-Headphones-Intelligence-Waterproof-Earphones-Black/dp/B096RR1LYX/ref=sr_1_155?dchild=1&keywords=earphones&qid=1631700550&sr=8-155
"Wireless Earbuds, Bluetooth Headphones In Ear Running Earphones with Noise Cancelling Mic, Built-in Microphone, IPX7 Waterproof, Vinlley Upgrade Wireless Headset for laptop/Sports/iPhone/Android",£17.88,3.8 out of 5 stars,286,https://www.amazon.co.uk//gp/slredirect/picassoRedirect.html/ref=pa_sp_mtf_aps_sr_pg10_1?ie=UTF8&adId=A0465718AII5DKYO2KMT&url=%2FBluetooth-Headphones-Cancelling-Microphone-Waterproof-Black%2Fdp%2FB096LJBJZ9%2Fref%3Dsr_1_156_sspa%3Fdchild%3D1%26keywords%3Dearphones%26qid%3D1631700550%26sr%3D8-156-spons%26psc%3D1&qualifier=1631700550&id=8030332764626843&widgetName=sp_mtf
beyerdynamic Soul BYRD Wired Premium In-Ear Headphones in Black,£65.21,4.1 out of 5 stars,"1,121",https://www.amazon.co.uk//beyerdynamic-Wired-Premium-Headphones-Black/dp/B07JY8SSVD/ref=sr_1_157?dchild=1&keywords=earphones&qid=1631700550&sr=8-157
Wireless Headphones Aoslen Bluetooth Headphones In Ear 5.0 Wireless Earbuds Touch Control with Microphone HD Sound IPX5 Single/Twin Mode for IOS Android Samsung Huawei HTC White,£19.99,4.2 out of 5 stars,332,https://www.amazon.co.uk//Wireless-Headphones-Aoslen-Bluetooth-Microphone-White/dp/B08Y8L38M3/ref=sr_1_158?dchild=1&keywords=earphones&qid=1631700550&sr=8-158
"Amazon Brand – Umi Bluetooth 5.0 IPX7 W5s True Wireless Earbud Headphones for iPhone, Samsung, Huawei with Patented Intelligent Metal Charging Case (Grey)",£29.99,4.2 out of 5 stars,"21,697",https://www.amazon.co.uk//UMI-Bluetooth-headphones-earphones-intelligent-GREY/dp/B07N428SG9/ref=sr_1_159?dchild=1&keywords=earphones&qid=1631700550&sr=8-159
"1MORE Active Noise Cancelling Wireless Earbuds, Dual Driver ANC Pro Bluetooth Wireless Earphones, Wind Noise Resistance, 20H Playtime, IPX5 Waterproof, for Clearly Phone Calls, Home Office,Sports",£129.99,4.0 out of 5 stars,875,https://www.amazon.co.uk//1MORE-Cancelling-Bluetooth-Resistance-Waterproof-Black/dp/B07Z922742/ref=sr_1_160?dchild=1&keywords=earphones&qid=1631700550&sr=8-160
"Betron B550s Earphones, Wired In-Ear Headphones Earphones with Bass Driven Sound, Tangle-Free Cable, Noise Isolating, Black",£9.99,4.2 out of 5 stars,"5,098",https://www.amazon.co.uk//gp/slredirect/picassoRedirect.html/ref=pa_sp_mtf_aps_sr_pg10_1?ie=UTF8&adId=A0567156PCE5HHIR39N5&url=%2FBetron-Isolating-Headphones-Earphones-Powerful-Black%2Fdp%2FB00MIQQVIY%2Fref%3Dsr_1_161_sspa%3Fdchild%3D1%26keywords%3Dearphones%26qid%3D1631700550%26sr%3D8-161-spons%26psc%3D1&qualifier=1631700550&id=8030332764626843&widgetName=sp_mtf
JustJamz Kidz 2.0 Color Call with Mic Stereo Earbud Headphones Mixed Colors - 100 Pack,£89.99,4.6 out of 5 stars,26,https://www.amazon.co.uk//JustJamz-Stereo-Earbud-Headphones-Colors-multicoloured/dp/B00J8TMIZ4/ref=sr_1_162?dchild=1&keywords=earphones&qid=1631700550&sr=8-162
"Cambridge Audio Melomania 1+ True Wireless Earbuds - Bluetooth 5.0, Hi-Fi Sound, In Ear Headphones for iPhone and Android with Charging Case and App Control (Black) (PLUS, Black)",£99.95,4.4 out of 5 stars,"7,609",https://www.amazon.co.uk//Cambridge-Audio-Melomania-Wireless-Earbuds-Black/dp/B08XBJVKG9/ref=sr_1_163?dchild=1&keywords=earphones&qid=1631700550&sr=8-163
Samsung Galaxy Buds Live - Wireless Earphones Mystic White,£90.00,4.2 out of 5 stars,108,https://www.amazon.co.uk//Samsung-Galaxy-Buds-Live-Earphones-Mystic-White/dp/B08FF599J1/ref=sr_1_164?dchild=1&keywords=earphones&qid=1631700550&sr=8-164
"Panasonic RZ-S500WE-K True Wireless Earbuds with Dual Hybrid Noise Cancelling, Alexa Built-In and IPX4 Water Resistance - Black",£99.99,4.1 out of 5 stars,459,https://www.amazon.co.uk//Panasonic-RZ-S500WE-K-Wireless-Cancelling-Resistance-Black/dp/B088C43RGZ/ref=sr_1_165?dchild=1&keywords=earphones&qid=1631700550&sr=8-165
"Betron B650 Earphones, Headphones Earphones with Microphone and Volume Control, Noise Isolating, Tangle-Free Cable, Strong Bass, Black",£11.99,3.9 out of 5 stars,426,https://www.amazon.co.uk//gp/slredirect/picassoRedirect.html/ref=pa_sp_btf_aps_sr_pg10_1?ie=UTF8&adId=A09619233R60T0NV6TQMC&url=%2FBetron-Isolating-Headphones-Smartphones-Microphone-Black%2Fdp%2FB079R9JM67%2Fref%3Dsr_1_166_sspa%3Fdchild%3D1%26keywords%3Dearphones%26qid%3D1631700550%26sr%3D8-166-spons%26psc%3D1&qualifier=1631700550&id=8030332764626843&widgetName=sp_btf
"1MORE Triple Driver In-Ear Earphones Hi-Res Headphones with High Resolution, Bass Driven Sound, MEMS Mic, In-Line Remote, High Fidelity for Smartphones/PC/Tablet - E1001 Silver",£69.99,4.3 out of 5 stars,"5,282",https://www.amazon.co.uk//gp/slredirect/picassoRedirect.html/ref=pa_sp_atf_next_aps_sr_pg11_1?ie=UTF8&adId=A03193773V2F84KXEBYQ9&url=%2F1MORE-Earphones-Headphones-Resolution-Smartphones-Silver%2Fdp%2FB01KB9K9Z0%2Fref%3Dsr_1_161_sspa%3Fdchild%3D1%26keywords%3Dearphones%26qid%3D1631700552%26sr%3D8-161-spons%26psc%3D1&qualifier=1631700552&id=3971950844380670&widgetName=sp_atf_next
"1MORE Active Noise Cancelling Wireless Earbuds, Dual Driver ANC Pro Bluetooth Wireless Earphones, Wind Noise Resistance, 20H Playtime, IPX5 Waterproof, for Clearly Phone Calls, Home Office,Sports",£129.99,4.0 out of 5 stars,875,https://www.amazon.co.uk//gp/slredirect/picassoRedirect.html/ref=pa_sp_atf_next_aps_sr_pg11_1?ie=UTF8&adId=A016316316NRZXN1BCRZ&url=%2F1MORE-Cancelling-Bluetooth-Resistance-Waterproof-Black%2Fdp%2FB07Z922742%2Fref%3Dsr_1_162_sspa%3Fdchild%3D1%26keywords%3Dearphones%26qid%3D1631700552%26sr%3D8-162-spons%26psc%3D1&qualifier=1631700552&id=3971950844380670&widgetName=sp_atf_next
"Sennheiser CX 400BT True Wireless Earbuds - Bluetooth In-Ear Headphones for Music and Calls - with Passive Noise Cancellation and Customisable Touch Controls, Black",,4.4 out of 5 stars,"1,784",https://www.amazon.co.uk//Sennheiser-400BT-True-Wireless-Earbuds-Black/dp/B08CZQXLQJ/ref=sr_1_163?dchild=1&keywords=earphones&qid=1631700552&sr=8-163
"HUAWEI FreeBuds Pro, True Wireless Bluetooth Earphone with Intelligent Noise Cancellation, 3-mic System, Quick Wireless Charging, Silver Frost",£118.98,4.5 out of 5 stars,"1,004",https://www.amazon.co.uk//HUAWEI-FreeBuds-Bluetooth-Intelligent-Cancellation/dp/B08HCTFT78/ref=sr_1_164?dchild=1&keywords=earphones&qid=1631700552&sr=8-164
"Wireless Bluetooth 5.0 Earbuds Headphones,Hi-Fi Stereo Sound Wireless Earphones,Sport Earbuds with Built-in Mic/Noise Cancelling,30H Playtime Touch Control Bluetooth Earbuds in-Ear,for iphone/Android",£69.95,4.8 out of 5 stars,"1,273",https://www.amazon.co.uk//Wireless-Bluetooth-Headphones-Earphones-Cancelling-White-New/dp/B09F9FKFY9/ref=sr_1_165?dchild=1&keywords=earphones&qid=1631700552&sr=8-165
"DPS Deep Noise Reduction Earphones,Sport Headphones Bluetooth 5.0 EDR Wireless Stereo HiFi in-Ear Earbuds for Gym Running Outdoor Sports Workout (Black 13) (D4)",£59.99,,,https://www.amazon.co.uk//Reduction-Earphones-Headphones-Bluetooth-Wireless-D4/dp/B09D9L9FMH/ref=sr_1_166?dchild=1&keywords=earphones&qid=1631700552&sr=8-166
"Linklike QUAD Dynamic Driver Hi-Res Extra Bass Earbuds Headphones Wired Earbuds with Microphone, Lightweight Earphones with Volume Control 3.5mm Jack, In-Ear Headphones (Sapphire Blue)",£19.99,4.3 out of 5 stars,"4,189",https://www.amazon.co.uk//gp/slredirect/picassoRedirect.html/ref=pa_sp_mtf_aps_sr_pg11_1?ie=UTF8&adId=A0937213YYTNHKNXKOX2&url=%2FLinklike-Headphones-Microphone-Lightweight-Earphones-Sapphire-Blue%2Fdp%2FB08HWRRF1P%2Fref%3Dsr_1_167_sspa%3Fdchild%3D1%26keywords%3Dearphones%26qid%3D1631700552%26sr%3D8-167-spons%26psc%3D1&qualifier=1631700552&id=3971950844380670&widgetName=sp_mtf
Samsung Galaxy Buds Live Wireless Earphones Mystic Black (Spanish Version),£72.00,4.4 out of 5 stars,"1,072",https://www.amazon.co.uk//SAMSUNG-GALAXY-BUDS-MYSTIC-BLACK/dp/B08DRQNBY8/ref=sr_1_168?dchild=1&keywords=earphones&qid=1631700552&sr=8-168
"DPS Deep Noise Reduction Earphones,Sport Headphones Bluetooth 5.0 EDR Wireless Stereo HiFi in-Ear Earbuds for Gym Running Outdoor Sports Workout (Black 13) (D7)",£59.99,,,https://www.amazon.co.uk//Reduction-Earphones-Headphones-Bluetooth-Wireless-D7/dp/B09D9N31JR/ref=sr_1_169?dchild=1&keywords=earphones&qid=1631700552&sr=8-169
"Wireless Headphones, lecover Wireless Earbuds Bluetooth 5.1 Headphones Sport Earhooks Wireless Earphones In Ear Noise Cancelling with Mic Deep Bass, IP7 Waterproof 40H Stereo for Running Gym[2021 New]",£21.99,4.2 out of 5 stars,"2,137",https://www.amazon.co.uk//Headphones-lecover-Bluetooth-Cancelling-Waterproof-New-Model/dp/B08TZVJXLG/ref=sr_1_170?dchild=1&keywords=earphones&qid=1631700552&sr=8-170
"Amazon Brand – Eono wireless earbuds, Eonobuds 1 wireless bluetooth earphones with Clear Sound, IPX7 Waterproof, USB C charging, Bluetooth Headphones in Ear for Work, Home Office(black)",£18.77,4.3 out of 5 stars,"1,540",https://www.amazon.co.uk//Eono-Eonobuds-bluetooth-Waterproof-Headphones-Black/dp/B08832CDT9/ref=sr_1_171?dchild=1&keywords=earphones&qid=1631700552&smid=A2BD0RL38B8BJ3&sr=8-171
"RMD-MA Portable Bluetooth 5.1 Headset True Wireless Earbuds with Charging Case Lightweight Waterproof Stereo Headphones Built-in Microphone in Ear Earphones with Deep Bass for Sport, Running",£16.99,3.9 out of 5 stars,18,https://www.amazon.co.uk//gp/slredirect/picassoRedirect.html/ref=pa_sp_mtf_aps_sr_pg11_1?ie=UTF8&adId=A0066351133FB6EXDIJC6&url=%2FBluetooth-Lightweight-Waterproof-Headphones-Microphone-Black%2Fdp%2FB095XC5B28%2Fref%3Dsr_1_172_sspa%3Fdchild%3D1%26keywords%3Dearphones%26qid%3D1631700552%26sr%3D8-172-spons%26psc%3D1&qualifier=1631700552&id=3971950844380670&widgetName=sp_mtf
"Yamaha TW-E3A Bluetooth Earphones - True wireless earphones, 6 hours playback time on one charge, waterproof (IPX5 certification), with wireless charging case, black",£98.98,4.1 out of 5 stars,56,https://www.amazon.co.uk//TW-E3A-Wireless-Bluetooth-Waterproof-Optimized-Black/dp/B0814N96JY/ref=sr_1_173?dchild=1&keywords=earphones&qid=1631700552&sr=8-173
Bang & Olufsen Beoplay E8 Premium Truly Wireless Bluetooth Earphones - Black,£79.95,4.0 out of 5 stars,"1,185",https://www.amazon.co.uk//Bang-Olufsen-Wireless-Bluetooth-Earphones/dp/B074WTKWG6/ref=sr_1_174?dchild=1&keywords=earphones&qid=1631700552&sr=8-174
"Jaybird Tarah, Wireless Sport Headphones, Earphones, Bluetooth, Waterproof, for Training and Fitness Performance, Sweat and Waterproof, Sport Fit, Music and Calls, Black Flash",,4.1 out of 5 stars,611,https://www.amazon.co.uk//Jaybird-Headphones-Earphones-Waterproof-Performance-Black/dp/B07HBHCKPF/ref=sr_1_175?dchild=1&keywords=earphones&qid=1631700552&sr=8-175
In-Ear Earphones for iPhone HiFi-Audio Stereo Noise Isolating Earbuds with Mic+Volume Control Compatible for iPhone 12 Pro Max/12 Pro/12/11Pro/11/XS Max/XS/XR/X/8 Plus/8/7Plus/7 Support All iOS System,£8.99,4.3 out of 5 stars,"1,579",https://www.amazon.co.uk//Earphones-HiFi-Audio-Isolating-Earbuds-Compatible-LATING-1/dp/B09DPQZQKH/ref=sr_1_176?dchild=1&keywords=earphones&qid=1631700552&sr=8-176
"Betron BS10C Earphones, Headphones Earphones with Microphone, Type C Connection, Noise Isolating in Ear Headphones, Bass Driven Sound",£17.99,3.9 out of 5 stars,476,https://www.amazon.co.uk//gp/slredirect/picassoRedirect.html/ref=pa_sp_mtf_aps_sr_pg11_1?ie=UTF8&adId=A0089391Q6YSQ5FPALB4&url=%2FBetron-Microphone-Type-Smartphones-connectivity-Black%2Fdp%2FB07ZP76C8K%2Fref%3Dsr_1_177_sspa%3Fdchild%3D1%26keywords%3Dearphones%26qid%3D1631700552%26sr%3D8-177-spons%26psc%3D1&qualifier=1631700552&id=3971950844380670&widgetName=sp_mtf
SoundMAGIC E11C High Fidelity Headphones Smartphone Earbuds In Ear Noise Reduction Earphones with Microphone and Remote Control for Audiophiles - Silver,£49.95,4.3 out of 5 stars,"1,818",https://www.amazon.co.uk//SoundMAGIC-E11C-Ear-Isolating-Earphones-remote-mic/dp/B07H2VPWFR/ref=sr_1_178?dchild=1&keywords=earphones&qid=1631700552&sr=8-178
JBL Reflect Flow - Truly Wireless in-Ear Sport Headphones in Black,£89.99,4.1 out of 5 stars,"2,671",https://www.amazon.co.uk//JBL-Reflect-Flow-Sport-Ear-Black/dp/B07N9G52SW/ref=sr_1_179?dchild=1&keywords=earphones&qid=1631700552&sr=8-179
"Anker Soundcore Life P2 True Wireless Earbuds with 4 Microphones, cVc 8.0 Noise Reduction, Graphene Drivers for Clear Sound, USB C, 40H Playtime, IPX7 Waterproof, Wireless Earphones (Renewed)",£33.59,4.3 out of 5 stars,"1,863",https://www.amazon.co.uk//Soundcore-Microphones-Reduction-Waterproof-Earphones-Black/dp/B0825V4PM9/ref=sr_1_180?dchild=1&keywords=earphones&qid=1631700552&sr=8-180
"Panasonic RP-HJE125E-K Ergofit In Ear Wired Earphones with Powerful Sound, Comfortable Non-Slip Fit, Includes 3 Sized Ear Buds - Black",£7.73,4.3 out of 5 stars,"11,089",https://www.amazon.co.uk//Panasonic-RP-HJE125E-K-Ergo-Ear-Headphone-Black/dp/B00CBU0IV8/ref=sr_1_181?dchild=1&keywords=earphones&qid=1631700552&sr=8-181
Wireless Earbuds Bluetooth Aoslen Wireless Headphones with Mic Bluetooth Earphones Touch Control with HIFI Stereo 40H Playtime LED Display Charging Case for Work/Travel/Gym/Game,£26.99,4.9 out of 5 stars,44,https://www.amazon.co.uk//gp/slredirect/picassoRedirect.html/ref=pa_sp_btf_aps_sr_pg11_1?ie=UTF8&adId=A01372211TQZ83NRU163C&url=%2FWireless-Bluetooth-Aoslen-Headphones-Earphones-White%2Fdp%2FB09B722FPK%2Fref%3Dsr_1_182_sspa%3Fdchild%3D1%26keywords%3Dearphones%26qid%3D1631700552%26sr%3D8-182-spons%26psc%3D1&qualifier=1631700552&id=3971950844380670&widgetName=sp_btf
"1MORE Quad Driver In-Ear Earphones Hi-Res High Fidelity Headphones with Warm Bass, Spacious Reproduction, High Resolution, Mic and In-Line Remote for Smartphones/PC/Tablet - E1010 Space Gray Silver",£119.99,4.5 out of 5 stars,"2,273",https://www.amazon.co.uk//gp/slredirect/picassoRedirect.html/ref=pa_sp_atf_next_aps_sr_pg12_1?ie=UTF8&adId=A03258253VQO4N1Z7YYRO&url=%2F1MORE-Headphones-Reproduction-Resolution-Smartphones-Silver%2Fdp%2FB06XSJV5B9%2Fref%3Dsr_1_177_sspa%3Fdchild%3D1%26keywords%3Dearphones%26qid%3D1631700553%26sr%3D8-177-spons%26psc%3D1%26smid%3DA20M2KH5WE97MP&qualifier=1631700553&id=8489176958999562&widgetName=sp_atf_next
"1MORE Triple Driver In-Ear Earphones Hi-Res Headphones with High Resolution, Bass Driven Sound, MEMS Mic, In-Line Remote, High Fidelity for Smartphones/PC/Tablet, Bluetooth Receiver/Included, Silver",£89.99,4.2 out of 5 stars,133,https://www.amazon.co.uk//gp/slredirect/picassoRedirect.html/ref=pa_sp_atf_next_aps_sr_pg12_1?ie=UTF8&adId=A0272002ENMRYXDAYXXJ&url=%2F1MORE-Earphones-Headphones-Resolution-Smartphones-Sliver%2Fdp%2FB08CGX3BKR%2Fref%3Dsr_1_178_sspa%3Fdchild%3D1%26keywords%3Dearphones%26qid%3D1631700553%26sr%3D8-178-spons%26psc%3D1&qualifier=1631700553&id=8489176958999562&widgetName=sp_atf_next
"Monster Bluetooth Earphones, Wireless Earbuds Waterproof, Bluetooth 5.0, Hi-FI Stereo Deep Bass Built in Mic, 36H Playtime with Touch Control Wireless Headphones fur iOS and Android",£65.99,4.5 out of 5 stars,57,https://www.amazon.co.uk//Monster-Bluetooth-Earphones-Waterproof-Headphones-Black/dp/B07HVCH294/ref=sr_1_179?dchild=1&keywords=earphones&qid=1631700553&sr=8-179
"1MORE ComfoBuds Z, 2-in-1 Bluetooth Sleep Earbuds with White Noise, Wireless Earphones with Noise Isolation, 5 Auto-Off Timers, Balanced Armature, White",,3.8 out of 5 stars,4,https://www.amazon.co.uk//1MORE-ComfoBuds-Bluetooth-Earphones-Isolation-White/dp/B099RRM6S2/ref=sr_1_180?dchild=1&keywords=earphones&qid=1631700553&sr=8-180
SoundPEATS Q True Wireless Earbuds Bluetooth 5.0 Headphones with Wireless Charging Case in-Ear Stereo Earphones with 4-Mic 10mm Driver Premium Sound Touch Control 7Hrs Playtime,£36.99,4.4 out of 5 stars,"2,655",https://www.amazon.co.uk//SOUNDPEATS-Earphones-Bluetooth-Headphones-USB-C-Black-Black/dp/B08M95H1YY/ref=sr_1_181?dchild=1&keywords=earphones&qid=1631700553&sr=8-181
Wired Earphones In Ear Headphones Wired Earbuds Noise Isolating Headset With Microphone remote sound control Compatible With iPhone Samsung Huawei Android Smartphones Tablets Laptops(white and black),£6.98,3.8 out of 5 stars,789,https://www.amazon.co.uk//Earphones-Headphones-Microphone-Compatible-Smartphones-Black/dp/B09278PXJG/ref=sr_1_182?dchild=1&keywords=earphones&qid=1631700553&sr=8-182
"XHNFCU 4 Pack Stereo Earbuds In-ear Headphones with Microphones Noise Isolating,High Definition and Heavy Bass Earphones,for Mobile Phone,Laptops,Gaming(Black+White+Pink+Blue)",£6.99,4.2 out of 5 stars,57,https://www.amazon.co.uk//gp/slredirect/picassoRedirect.html/ref=pa_sp_mtf_aps_sr_pg12_1?ie=UTF8&adId=A072579823H8QS8XJP1MG&url=%2FHeadphones-Microphones-Isolating-Definition-Earphones-Black-White-Pink-Blue-4-Pack%2Fdp%2FB088CHKN64%2Fref%3Dsr_1_183_sspa%3Fdchild%3D1%26keywords%3Dearphones%26qid%3D1631700553%26sr%3D8-183-spons%26psc%3D1&qualifier=1631700553&id=8489176958999562&widgetName=sp_mtf
Wireless Headphones Bluetooth 5.0 Earbuds CVC 8.0 Noise Canceling IPX7 Waterproof Earphones Immersive Bass Sound in Ear Built in Mic Headsets 25 Hrs with USB-C Charging for Work/Fitness(Black),£24.99,4.4 out of 5 stars,302,https://www.amazon.co.uk//Headphones-Bluetooth-Canceling-Waterproof-Earphones-Black/dp/B08X4FCYG6/ref=sr_1_184?dchild=1&keywords=earphones&qid=1631700553&sr=8-184
"Truly Wireless Earbuds Mifo O5 II,Bluetooth 5.2 in-Ear Dual Mic Noise Cancelling Headphones,150 Hours of Playback Dymatic Bass Earphones,IPX7 Water Resistance Sport Earbuds 4 Built-in Mic",£109.99,4.7 out of 5 stars,10,https://www.amazon.co.uk//Bluetooth-Cancelling-Headphones-Earphones-Resistance/dp/B07YFYK3HQ/ref=sr_1_185?dchild=1&keywords=earphones&qid=1631700553&sr=8-185
MAMAN True Wireless Earbuds Bluetooth Headphones Touch Control with Wireless Charging Case IPX8 Waterproof Stereo Earphones in-Ear Built-in Mic Headset Premium Deep Bass for Sport,£9.99,3.9 out of 5 stars,101,https://www.amazon.co.uk//MAMAN-Bluetooth-Headphones-Waterproof-Earphones/dp/B0952T892J/ref=sr_1_186?dchild=1&keywords=earphones&qid=1631700553&sr=8-186
"Jaybird Vista True Wireless Bluetooth Headphones with Charging Case - IPX7 Waterproof and Sweatproof Earphones, 16 Hour Playtime Siri Enabled In-Ear Earbuds for Sport, Running, Fitness, Gym - Black",£159.99,4.4 out of 5 stars,"1,806",https://www.amazon.co.uk//Jaybird-Wireless-Bluetooth-Headphones-Charging-Black/dp/B07VP91M7D/ref=sr_1_187?dchild=1&keywords=earphones&qid=1631700553&sr=8-187
