Description,Price,Ratings,Review Count,URL
"Soundcore by Anker Spirit Dot 2 True Wireless Earbuds, Deep Bass, IPX7 Waterproof, Sweatproof, 16H Playtime, Fast Charge, Comfortable AirWings, Bluetooth 5, Sports Earphones, Workout, Gym, Jogging",£79.99,4.1 out of 5 stars,"2,047",https://www.amazon.co.uk//Soundcore-Truly-Wireless-Headphones-Graphene-Enhanced-Waterproof/dp/B07SJFY5BK/ref=sr_1_98?dchild=1&keywords=earphones&qid=1631700544&sr=8-98
Samsung Galaxy Buds+ - Black (UK Version),£72.99,4.6 out of 5 stars,"10,358",https://www.amazon.co.uk//Samsung-Galaxy-Buds-Black-version/dp/B0842QKN99/ref=sr_1_99?dchild=1&keywords=earphones&qid=1631700544&sr=8-99
"Betron RK300 Earphones, Wired In-Ear Headphones Earphones, Noise Isolating, Enhanced Bass, Tangle-Free Cord, White",£11.99,4.2 out of 5 stars,449,https://www.amazon.co.uk//gp/slredirect/picassoRedirect.html/ref=pa_sp_btf_aps_sr_pg6_1?ie=UTF8&adId=A10190571W3GVERN7RHQV&url=%2FBetron-Earphones-Headphones-Isolating-Lightweight-White%2Fdp%2FB00O35B8AO%2Fref%3Dsr_1_100_sspa%3Fdchild%3D1%26keywords%3Dearphones%26qid%3D1631700544%26sr%3D8-100-spons%26psc%3D1&qualifier=1631700544&id=2409933219388061&widgetName=sp_btf
"Bearphones Noise Isolating Wired Earphones, Built-In HD Microphone + Volume Controls, Strong Bass, Tangle Free, 1.2m Long Cable, 3.5mm Jack, Compatible with Apple iPhone, iPad, Android, PC",£9.99,4.2 out of 5 stars,141,https://www.amazon.co.uk//gp/slredirect/picassoRedirect.html/ref=pa_sp_btf_aps_sr_pg6_1?ie=UTF8&adId=A07376671IPOJG78RJ4TJ&url=%2FBearphones-Comfortable-Sensitivity-Microphone-Compatible%2Fdp%2FB08JTX4V1N%2Fref%3Dsr_1_101_sspa%3Fdchild%3D1%26keywords%3Dearphones%26qid%3D1631700544%26sr%3D8-101-spons%26psc%3D1&qualifier=1631700544&id=2409933219388061&widgetName=sp_btf
"4 Packs Earphones, CBGGQ Noise Isolating In-Ear Headphones with Pure Sound and Powerful Bass, Earbuds with Microphone & Volume Control, Headphones for iOS and Android Smartphones, Laptops, Gaming,etc",£7.99,4.2 out of 5 stars,"5,430",https://www.amazon.co.uk//gp/slredirect/picassoRedirect.html/ref=pa_sp_btf_aps_sr_pg6_1?ie=UTF8&adId=A0179374LWAQV4LIDT7B&url=%2FEarphones-CBGGQ-Headphones-Microphone-Smartphones-4-pairs-color%2Fdp%2FB07XRXSWQ6%2Fref%3Dsr_1_102_sspa%3Fdchild%3D1%26keywords%3Dearphones%26qid%3D1631700544%26sr%3D8-102-spons%26psc%3D1&qualifier=1631700544&id=2409933219388061&widgetName=sp_btf
"Soundcore by Anker Spirit Dot 2 True Wireless Earbuds, Deep Bass, IPX7 Waterproof, Sweatproof, 16H Playtime, Fast Charge, Comfortable AirWings, Bluetooth 5, Sports Earphones, Workout, Gym, Jogging",£79.99,4.1 out of 5 stars,"2,047",https://www.amazon.co.uk//Soundcore-Truly-Wireless-Headphones-Graphene-Enhanced-Waterproof/dp/B07SJFY5BK/ref=sr_1_97?dchild=1&keywords=earphones&qid=1631700546&sr=8-97
Samsung Galaxy Buds+ - Black (UK Version),£72.99,4.6 out of 5 stars,"10,358",https://www.amazon.co.uk//Samsung-Galaxy-Buds-Black-version/dp/B0842QKN99/ref=sr_1_98?dchild=1&keywords=earphones&qid=1631700546&sr=8-98
"LYCHL Wireless Headphones, Sport Bluetooth 5.0 Earbuds Immersive Bass Stereo Sound IP7 Waterproof Earhooks Earphones,100H Playtime with Charging Case Touch Control True Wireless Headset",£24.99,4.2 out of 5 stars,"1,422",https://www.amazon.co.uk//Headphones-Bluetooth-Immersive-Waterproof-Earphones-Black/dp/B08K91F1M4/ref=sr_1_99?dchild=1&keywords=earphones&qid=1631700546&sr=8-99
"Bluetooth Headphones, Bluetooth Earbuds Sports Earphones, 14H Playtime/HD Stereo Sound with cVc 8.0 Noise Reduction Mic Magnetic In Ear Wireless Headphones IPX7 Waterproof for Running Sports",£19.99,4.1 out of 5 stars,55,https://www.amazon.co.uk//Bluetooth-Headphones-Earphones-Reduction-Waterproof/dp/B098QSLZNQ/ref=sr_1_100?dchild=1&keywords=earphones&qid=1631700546&sr=8-100
"Betron B750s Earphones, Wired In-Ear Headphones Earphones with Microphone, Noise Isolating, Tangle-Free Cable, Enhanced Bass, Red",£12.99,4.0 out of 5 stars,999,https://www.amazon.co.uk//gp/slredirect/picassoRedirect.html/ref=pa_sp_mtf_aps_sr_pg7_1?ie=UTF8&adId=A102740517RG3V82T5HMV&url=%2FBetron-Earphones-Headphones-Definition-BlackBerry-Red-Control-Mic%2Fdp%2FB00NEYPWL6%2Fref%3Dsr_1_101_sspa%3Fdchild%3D1%26keywords%3Dearphones%26qid%3D1631700546%26sr%3D8-101-spons%26psc%3D1&qualifier=1631700546&id=7473200163421424&widgetName=sp_mtf
Wireless Earbuds Headphones Bluetooth 5.1 Headphones Noise Canceling IPX6 Waterproof Earphones in-Ear Built-in Mic 3D Sound Headsets Touch Control Hi-Fi Stereo Sound for Work OfficeSports,,4.7 out of 5 stars,"1,025",https://www.amazon.co.uk//Headphones-Bluetooth-Canceling-Waterproof-OfficeSports-black/dp/B09C8HHGVR/ref=sr_1_102?dchild=1&keywords=earphones&qid=1631700546&sr=8-102
"Shure SE215-CL Professional Over the Ear Earphones, Sound Isolating with Single Dynamic MicroDriver, Clear Sound + Deep Bass, 3.5mm Cable - Clear ,SE215-CL-EFS",,4.3 out of 5 stars,"1,195",https://www.amazon.co.uk//SE215-CL-EFS-Isolating-Earphones-Dynamic-MicroDriver-Clear/dp/B004V3Q1ZA/ref=sr_1_103?dchild=1&keywords=earphones&qid=1631700546&sr=8-103
"Wireless Earbuds, Bluetooth Headphones in-Ear, Immersive Bass Sound, IPX8 Waterproof Sport Earphones, Touch Control Bluetooth Earbuds, 25 Hrs w/USB-C Charging Case/Twin & Mono Mode/Mics/Black",£20.99,4.5 out of 5 stars,167,https://www.amazon.co.uk//Bluetooth-Headphones-Immersive-Waterproof-Earphones-Black/dp/B09637LL9T/ref=sr_1_104?dchild=1&keywords=earphones&qid=1631700546&sr=8-104
"JBL Tune 225 TWS In-Ear Earphones - True wireless headphones with up to 25 hours of battery life with charging case, feel the music with JBL Pure Bass sound, in black",£59.00,4.2 out of 5 stars,"1,583",https://www.amazon.co.uk//JBL-Tune-225-Ear-Earphones-Black/dp/B086WZWJMQ/ref=sr_1_105?dchild=1&keywords=earphones&qid=1631700546&sr=8-105
"Betron AX3 Earphones, Wired In Ear Headphones Earphones with Microphone, Noise Isolating Eartips and Carry Case",£11.99,4.2 out of 5 stars,497,https://www.amazon.co.uk//gp/slredirect/picassoRedirect.html/ref=pa_sp_mtf_aps_sr_pg7_1?ie=UTF8&adId=A0031964175OVE2UZXNU4&url=%2FBetron-AX3-Headphones-Microphone-Smartphones-Black%2Fdp%2FB0787JJ8J9%2Fref%3Dsr_1_106_sspa%3Fdchild%3D1%26keywords%3Dearphones%26qid%3D1631700546%26sr%3D8-106-spons%26psc%3D1&qualifier=1631700546&id=7473200163421424&widgetName=sp_mtf
Bose SoundSport Wireless Headphones - Blue,£109.70,4.5 out of 5 stars,"4,897",https://www.amazon.co.uk//Bose-SoundSport-Bluetooth-Wireless-Headphones-Aqua-Blue/dp/B01E3SNNGW/ref=sr_1_107?dchild=1&keywords=earphones&qid=1631700546&sr=8-107
Wireless Earbuds Headphones Bluetooth 5.0 Headphones Noise Canceling IPX5 Waterproof Earphones in-Ear Built-in Mic 3D Sound Headsets Touch Control Hi-Fi Stereo Sound for Work Home Office(Black),£16.99,4.1 out of 5 stars,"5,344",https://www.amazon.co.uk//Headphones-Bluetooth-Canceling-Waterproof-Compatible-Black/dp/B08F7NRL73/ref=sr_1_108?dchild=1&keywords=earphones&qid=1631700546&sr=8-108
"TOZO NC9 Hybrid ANC Wireless Earbuds Active Noise Cancelling Headphones Bluetooth 5.0 Stereo in Ear Earphones, Immersive Sound Premium Deep Bass Built in 3 Mic Headset Black",£59.98,4.3 out of 5 stars,"14,528",https://www.amazon.co.uk//TOZO-Cancelling-Headphones-Bluetooth-Earphones-Black/dp/B085NPCQLT/ref=sr_1_109?dchild=1&keywords=earphones&qid=1631700546&sr=8-109
"BENEWY Earphones, In-Ear Headphones Earphones with Microphone and Volume Control, Hi-Res Extra Bass, Pure Sound, High Definition, Noise Isolating Wired Earbuds for iPhone, iPod, iPad, MP3, Samsung,etc",£6.79,4.1 out of 5 stars,209,https://www.amazon.co.uk//BENEWY-Earphones-Headphones-Microphone-Definition-White/dp/B091GQYZ8L/ref=sr_1_110?dchild=1&keywords=earphones&qid=1631700546&sr=8-110
"Betron DC950Hi Earphones, In Ear Headphones Earphones with Microphone and Volume Control, Enhanced Bass, Carry Case, Red",£12.99,4.2 out of 5 stars,"2,188",https://www.amazon.co.uk//gp/slredirect/picassoRedirect.html/ref=pa_sp_mtf_aps_sr_pg7_1?ie=UTF8&adId=A0093740G1E4MVILDCYH&url=%2FBetron-Headphones-Definition-Tangle-Free-Replaceable-Red-Mic-Control%2Fdp%2FB00N771OH6%2Fref%3Dsr_1_111_sspa%3Fdchild%3D1%26keywords%3Dearphones%26qid%3D1631700546%26sr%3D8-111-spons%26psc%3D1&qualifier=1631700546&id=7473200163421424&widgetName=sp_mtf
"Sony WF-1000XM3 Truly Wireless Noise Cancelling Headphones with Mic, up to 32H battery life, stable Bluetooth connection, wearing detection with Alexa built-in - Black",£149.00,4.3 out of 5 stars,"10,598",https://www.amazon.co.uk//Sony-WF-1000XM3-Cancelling-Headphones-Connection-Black/dp/B07T2FGG2Z/ref=sr_1_112?dchild=1&keywords=earphones&qid=1631700546&sr=8-112
"Bluetooth Headphones 5.0, Flame Running Headphones w/16 Hrs Playtime, Bass+ Stereo Wireless Sports Earphones w/IPX7 Waterproof In Ear Earbuds for Gym, Workout w/cVc6.0 Noise Cancelling Mic",£16.14,4.4 out of 5 stars,254,https://www.amazon.co.uk//Bluetooth-Headphones-Earphones-Waterproof-Cancelling-Black/dp/B095S4S388/ref=sr_1_113?dchild=1&keywords=earphones&qid=1631700546&sr=8-113
"4 Pairs earphones Heavy Bass Stereo Earphones Earbuds with Remote & Microphon,Laptops,Gaming Noise Isolating Tangle Free Headsets in Ear earphones",£8.99,4.1 out of 5 stars,"2,260",https://www.amazon.co.uk//MUNSKT-Headphones-Microphone-Isolating-Smartphones-4-mixed-colors/dp/B07XN1BMFN/ref=sr_1_114?dchild=1&keywords=earphones&qid=1631700546&sr=8-114
"Aztine MP3 & Bluetooth 2 in 1 Bone Conduction Headphones for Swimming, IPX8 Level Underwater 3 Metres Waterproof Earphones, 8 Hours Play with 16GB Memory",£59.99,3.7 out of 5 stars,96,https://www.amazon.co.uk//Bluetooth-Conduction-Headphones-Underwater-Waterproof-Grey/dp/B08HV3YK7N/ref=sr_1_115?dchild=1&keywords=earphones&qid=1631700546&sr=8-115
"In Ear Headphones Earphones Wired with Pure Sound, Powerful Bass and Noise Isolating Earbud for Samsung, Huawei, Nokia, HTC, Nexus, iPhone, iPod, iPad, Smartphones and Tablets (Without Mic and Remote)",£8.99,4.1 out of 5 stars,724,https://www.amazon.co.uk//gp/slredirect/picassoRedirect.html/ref=pa_sp_btf_aps_sr_pg7_1?ie=UTF8&adId=A0354913DSDYFSAQEH5C&url=%2FHeadphones-Earphones-Powerful-Isolating-Smartphones-Black%2Fdp%2FB09C1BPRV5%2Fref%3Dsr_1_116_sspa%3Fdchild%3D1%26keywords%3Dearphones%26qid%3D1631700546%26sr%3D8-116-spons%26psc%3D1&qualifier=1631700546&id=7473200163421424&widgetName=sp_btf
"Betron B650 Earphones, In Ear Headphones Earphones, Noise Isolating, Enhanced Bass and Tangle-Free Wire, Black",£9.99,4.1 out of 5 stars,"4,764",https://www.amazon.co.uk//gp/slredirect/picassoRedirect.html/ref=pa_sp_btf_aps_sr_pg7_1?ie=UTF8&adId=A089913229UD85AJZ2NX7&url=%2FBetron-Isolating-Earphones-Headphones-Powerful-Black-Silver%2Fdp%2FB00T27N540%2Fref%3Dsr_1_117_sspa%3Fdchild%3D1%26keywords%3Dearphones%26qid%3D1631700546%26sr%3D8-117-spons%26psc%3D1&qualifier=1631700546&id=7473200163421424&widgetName=sp_btf
"Earphones, In-ear Headphones Earbuds with Microphone，Wired Headphone with Sound Insulation, High-definition, Pure Sound, Suitable for iPhone, iPad, Smart phone, MP3 player and Other 3.5mm Jacks",£6.99,5.0 out of 5 stars,4,https://www.amazon.co.uk//gp/slredirect/picassoRedirect.html/ref=pa_sp_btf_aps_sr_pg7_1?ie=UTF8&adId=A082967833PBUTLGUF2JG&url=%2FEarphones-Headphones-Microphone%25EF%25BC%258CWired-Insulation-High-definition-Black%2Fdp%2FB096LV471F%2Fref%3Dsr_1_118_sspa%3Fdchild%3D1%26keywords%3Dearphones%26qid%3D1631700546%26sr%3D8-118-spons%26psc%3D1&qualifier=1631700546&id=7473200163421424&widgetName=sp_btf
Sennheiser RS 2000 Digital Wireless TV Headphones - Black,£159.99,4.3 out of 5 stars,924,https://www.amazon.co.uk//Sennheiser-RS-2000-Wireless-Headphones-Black/dp/B06XNNNVX6/ref=sr_1_113?dchild=1&keywords=earphones&qid=1631700547&sr=8-113
Bose QuietComfort 20 Acoustic Noise Cancelling Headphones for Apple Devices (Black),£149.99,4.6 out of 5 stars,"1,109",https://www.amazon.co.uk//Bose-QuietComfort-Acoustic-Cancelling-Headphones/dp/B00X9KV0HU/ref=sr_1_114?dchild=1&keywords=earphones&qid=1631700547&sr=8-114
Apple AirPods with Wireless Charging Case,£154.97,4.7 out of 5 stars,"17,527",https://www.amazon.co.uk//Apple-Airpods-Wireless-Charging-latest/dp/B07PYM8FB8/ref=sr_1_115?dchild=1&keywords=earphones&qid=1631700547&sr=8-115
"SONY WI-C200 Wireless Bluetooth Headphones with mic, up to 15h battery life - Black",£20.62,4.3 out of 5 stars,"3,630",https://www.amazon.co.uk//SONY-WI-C200-Wireless-Bluetooth-Headphones-Black/dp/B07QYWD718/ref=sr_1_116?dchild=1&keywords=earphones&qid=1631700547&sr=8-116
"BENEWY Earphones, In-Ear Headphones Earphones with Microphone and Volume Control, Hi-Res Extra Bass, Pure Sound, High Definition, Noise Isolating Wired Earbuds for iPhone, iPod, iPad, MP3, Samsung,etc",£6.79,4.1 out of 5 stars,209,https://www.amazon.co.uk//gp/slredirect/picassoRedirect.html/ref=pa_sp_mtf_aps_sr_pg8_1?ie=UTF8&adId=A07732371QEC1MPU4SYDB&url=%2FBENEWY-Earphones-Headphones-Microphone-Definition-White%2Fdp%2FB091GQYZ8L%2Fref%3Dsr_1_117_sspa%3Fdchild%3D1%26keywords%3Dearphones%26qid%3D1631700547%26sr%3D8-117-spons%26psc%3D1%26smid%3DA14JNMESHSIR0G&qualifier=1631700547&id=7555212291907885&widgetName=sp_mtf
"JBL Live 300TWS - Truly wireless bluetooth in-ear headphones, in black",£66.88,4.3 out of 5 stars,"2,179",https://www.amazon.co.uk//JBL-Live-300TWS-Ear-Headphones-Black/dp/B07XRYDQRQ/ref=sr_1_118?dchild=1&keywords=earphones&qid=1631700547&sr=8-118
"2021 Upgraded Version True Wireless Earbuds 05 Plus Gen 2 by MIFO, Bluetooth 5.0 Wireless Sport Headphones with 2600mAh Charging Case, Deep Bass Wireless Earphones Bulit-in Mic Headset",£89.99,4.4 out of 5 stars,240,https://www.amazon.co.uk//Wireless-Bluetooth-Headphones-Charging-Earphones-grey/dp/B07WX6MCGD/ref=sr_1_119?dchild=1&keywords=earphones&qid=1631700547&sr=8-119
"Razer Hammerhead True Wireless - Wireless Earbuds (in-Ear Earphones, Ultra-Low Latency, Water-Repellent, 13 mm Driver, Touch Support, Bluetooth 5.0, Voice Control, Charging Case), black",£54.99,4.2 out of 5 stars,"2,440",https://www.amazon.co.uk//Razer-Hammerhead-True-Wireless-Ear/dp/B07YV8C5NR/ref=sr_1_120?dchild=1&keywords=earphones&qid=1631700547&sr=8-120
"True Wireless Earbuds, IPX7 Waterproof Bluetooth 5.0 Wireless Headphones with Microphone Charging Case 35H Playtime in-Ear TWS Earphones Hi-Fi Stereo Sound Headset for Workout Running Travel",£19.99,1.0 out of 5 stars,1,https://www.amazon.co.uk//Waterproof-Bluetooth-Headphones-Microphone-Earphones/dp/B09CDD1F9N/ref=sr_1_121?dchild=1&keywords=earphones&qid=1631700547&sr=8-121
"Betron BS10L Earphones, In Ear Headphones Earphones, Wired, Noise Isolating, Strong Bass",£16.99,,,https://www.amazon.co.uk//gp/slredirect/picassoRedirect.html/ref=pa_sp_mtf_aps_sr_pg8_1?ie=UTF8&adId=A09504021177E7GR2SBVF&url=%2FBetron-BS10L-Earphones-Headphones-Isolating-Black%2Fdp%2FB0953YW8M5%2Fref%3Dsr_1_122_sspa%3Fdchild%3D1%26keywords%3Dearphones%26qid%3D1631700547%26sr%3D8-122-spons%26psc%3D1&qualifier=1631700547&id=7555212291907885&widgetName=sp_mtf
"Wireless Headphones, IPX7 Waterproof Bluetooth 5.1 Wireless Earbuds, Touch Control Hi-Fi Stereo Sound Bluetooth Earphones, 40H Playtime Wireless Earbuds Bluetooth With Fast Charging Case",£28.95,4.1 out of 5 stars,309,https://www.amazon.co.uk//Wireless-Headphones-Waterproof-Bluetooth-Earphones/dp/B092TDHWZ1/ref=sr_1_123?dchild=1&keywords=earphones&qid=1631700547&sr=8-123
"Anker Soundcore Liberty 2 Pro True Wireless Earbuds, Bluetooth Earbuds with ACAA, In-Ear Studio Performance, 8-Hour Playtime, HearID Personalized EQ via Soundcore App, Wireless Charging",£89.99,4.4 out of 5 stars,"4,233",https://www.amazon.co.uk//Soundcore-Headphones-Architecture-Performance-Personalised-Black/dp/B07ZCY85JZ/ref=sr_1_124?dchild=1&keywords=earphones&qid=1631700547&sr=8-124
"UGREEN HiTune T1 Wireless Earphones, Wireless Earbuds with 4 Mic ENC Noise Reduction, Bluetooth Earphones Hifi Stereo, 24Hour Playtime, SuperBass Mode, Bluetooth Earbuds for Phone Tablet PC (Black)",£35.99,4.1 out of 5 stars,724,https://www.amazon.co.uk//UGREEN-Wireless-Canceling-Bluetooth-Playtime-Black/dp/B08L7KXKM6/ref=sr_1_125?dchild=1&keywords=earphones&qid=1631700547&sr=8-125
"bakibo True Wireless Earphones, Bluetooth 5.1 Headphones with Mic Auto Pairing Sport Waterproof Ipx7 Earbuds in Ear with Portable LCD Charging Case, 30H Playtime, Touch Control, for Gym Running",£21.24,4.5 out of 5 stars,125,https://www.amazon.co.uk//bakibo-Earphones-Bluetooth-Headphones-Waterproof-Black/dp/B08ZXR6RHM/ref=sr_1_126?dchild=1&keywords=earphones&qid=1631700547&smid=A3CRMI13MCID7&sr=8-126
"Wireless Earbuds, DIGITNOW! Bluetooth5.0 Earphones, 48Hrs Play Time LED Display In-Ear Headphones Built in Mic Deep Bass Stereo IPX5 Waterproof Earbuds for Sports Workout Running",£29.89,4.3 out of 5 stars,36,https://www.amazon.co.uk//gp/slredirect/picassoRedirect.html/ref=pa_sp_mtf_aps_sr_pg8_1?ie=UTF8&adId=A08164771MOBU9ENKU3W9&url=%2FDIGITNOW-Bluetooth5-0-Earphones-Headphones-Waterproof-Black%2Fdp%2FB095YBS8RK%2Fref%3Dsr_1_127_sspa%3Fdchild%3D1%26keywords%3Dearphones%26qid%3D1631700547%26sr%3D8-127-spons%26psc%3D1&qualifier=1631700547&id=7555212291907885&widgetName=sp_mtf
"Sport Ergonomic Design Headphones APEKX True Wireless Bluetooth 5.0 Sports Earbuds, IPX7 Waterproof Stereo Sound, Built-in Mic Earphones,Supporting Wireless Charging(Black)",£33.99,4.4 out of 5 stars,"3,547",https://www.amazon.co.uk//Ergonomic-Headphones-APEKX-Waterproof-Supporting-Black/dp/B07XFMHQDP/ref=sr_1_128?dchild=1&keywords=earphones&qid=1631700547&sr=8-128
UGREEN HiTune X5 Wireless Earbuds Bluetooth 5.2 In Ear Earphones with Qualcomm QCC3040 aptX Codec Hifi Stereo 4 Mic cVc 8 Noise Reduction 28h Playtime Touch Control Wireless Earphones for Work Sport,£49.99,3.9 out of 5 stars,75,https://www.amazon.co.uk//UGREEN-Wireless-Bluetooth-Earphones-Reduction/dp/B0925X3JRV/ref=sr_1_129?dchild=1&keywords=earphones&qid=1631700547&sr=8-129
"QXQ Wireless Earbuds, in-Ear Sports Bluetooth 5.1 Headphones with Microphone, HiFi Stereo, 56H Playtime Wireless Earphones with LED Display Charging Case, IPX7 Waterproof for Running Workout",£27.99,4.2 out of 5 stars,185,https://www.amazon.co.uk//QXQ-Bluetooth-Headphones-Microphone-Waterproof/dp/B097RGPBW4/ref=sr_1_130?dchild=1&keywords=earphones&qid=1631700547&sr=8-130
"Wireless Earbuds, EarFun Air 4 Mics Noise Cancelling, Wireless Charging, Bluetooth 5.0 Earbuds, Touch Control, USB-C Quick Charge, Deep Bass, in-Ear Detection Headphones, 35H Playtime, IPX7 Waterproof",£42.49,4.4 out of 5 stars,"2,163",https://www.amazon.co.uk//EarFun-Wireless-Bluetooth-Detection-Headphones-Matte-Black/dp/B088H7GMHZ/ref=sr_1_131?dchild=1&keywords=earphones&qid=1631700547&sr=8-131
"Betron RK300 Earphones, Wired In-Ear Headphones Earphones, Noise Isolating, Enhanced Bass, Tangle-Free Cord, Red",£11.99,4.3 out of 5 stars,601,https://www.amazon.co.uk//gp/slredirect/picassoRedirect.html/ref=pa_sp_btf_aps_sr_pg8_1?ie=UTF8&adId=A10190012TYZSYSLP4FWU&url=%2FBetron-Earphones-Headphones-Isolating-Lightweight-Red%2Fdp%2FB00O35B89A%2Fref%3Dsr_1_132_sspa%3Fdchild%3D1%26keywords%3Dearphones%26qid%3D1631700547%26sr%3D8-132-spons%26psc%3D1&qualifier=1631700547&id=7555212291907885&widgetName=sp_btf
"Betron DC950Hi Earphones, In Ear Headphones Earphones with Microphone and Volume Control, Enhanced Bass, Carry Case, Black",£11.99,4.1 out of 5 stars,"6,672",https://www.amazon.co.uk//gp/slredirect/picassoRedirect.html/ref=pa_sp_btf_aps_sr_pg8_1?ie=UTF8&adId=A06279833UGJG7XHY3V1X&url=%2FBetron-Headphones-Earphones-Tangle-Free-Replaceable-Black%2Fdp%2FB00N771OEE%2Fref%3Dsr_1_133_sspa%3Fdchild%3D1%26keywords%3Dearphones%26qid%3D1631700547%26sr%3D8-133-spons%26psc%3D1%26smid%3DA3108QBFCDGHS1&qualifier=1631700547&id=7555212291907885&widgetName=sp_btf
"Sephia SP3060 Earphones, In-Ear Headphones with Tagle-Free Cord, Enhanced Bass, Noise Isolating Earbud Tips",£9.99,4.2 out of 5 stars,"16,926",https://www.amazon.co.uk//gp/slredirect/picassoRedirect.html/ref=pa_sp_btf_aps_sr_pg8_1?ie=UTF8&adId=A0776640PB4XF4FPZPHB&url=%2FSephia-SP3060-Isolating-Headphones-BlackBerry-Black%2Fdp%2FB0170RBJ9Q%2Fref%3Dsr_1_134_sspa%3Fdchild%3D1%26keywords%3Dearphones%26qid%3D1631700547%26sr%3D8-134-spons%26psc%3D1&qualifier=1631700547&id=7555212291907885&widgetName=sp_btf
"Wireless Earbuds Bluetooth, HOBEST Active Noise Cancelling Bluetooth 5.1 Earphones In Ear, IPX5 Waterproof/16Hrs/Built-in Mic/3D Sound/USB-C/Touch Control Wireless Headphones for Sports Running",£29.99,5.0 out of 5 stars,14,https://www.amazon.co.uk//gp/slredirect/picassoRedirect.html/ref=pa_sp_atf_next_aps_sr_pg9_1?ie=UTF8&adId=A104563221RDKO7XS0E8I&url=%2FBluetooth-HOBEST-Cancelling-Waterproof-Headphones%2Fdp%2FB09D7DJHSN%2Fref%3Dsr_1_129_sspa%3Fdchild%3D1%26keywords%3Dearphones%26qid%3D1631700549%26sr%3D8-129-spons%26psc%3D1&qualifier=1631700549&id=6366555073414898&widgetName=sp_atf_next
"Sport Ergonomic Design Headphones APEKX True Wireless Bluetooth 5.0 Sports Earbuds, IPX7 Waterproof Stereo Sound, Built-in Mic Earphones,Supporting Wireless Charging(Black)",£33.99,4.4 out of 5 stars,"3,547",https://www.amazon.co.uk//Ergonomic-Headphones-APEKX-Waterproof-Supporting-Black/dp/B07XFMHQDP/ref=sr_1_130?dchild=1&keywords=earphones&qid=1631700549&sr=8-130
"Wireless Earbuds Bluetooth, HOBEST Active Noise Cancelling Bluetooth 5.1 Earphones In Ear, IPX5 Waterproof/16Hrs/Built-in Mic/3D Sound/USB-C/Touch Control Wireless Headphones for Sports Running",£29.99,5.0 out of 5 stars,14,https://www.amazon.co.uk//Bluetooth-HOBEST-Cancelling-Waterproof-Headphones/dp/B09D7DJHSN/ref=sr_1_131?dchild=1&keywords=earphones&qid=1631700549&sr=8-131
"Philips Audio TAA7306/00 Wireless Sports Headphones, In Ear Wireless Headphones, Adults In Ear Running Headphones, Bluetooth Headphones Running, Up to 24 Hours Play Time, Wing Ear-Tip, Built In Mic",£159.99,3.0 out of 5 stars,1,https://www.amazon.co.uk//Philips-TAA7306-00-Headphones-Bluetooth-Black/dp/B097Q47KZ6/ref=sr_1_132?dchild=1&keywords=earphones&qid=1631700549&sr=8-132
"Wireless Headphones, Doubc Bluetooth 5.1 Earbuds with Mini Charging Case & HD Mic, 24H Playtime Wireless Earbuds, IPX7 Waterproof Wireless Earphones Touch Control In-Ear Headphones for Sport and Work",£24.99,4.7 out of 5 stars,181,https://www.amazon.co.uk//Headphones-Doubc-Bluetooth-Waterproof-Earphones-White/dp/B098PX6QVZ/ref=sr_1_133?dchild=1&keywords=earphones&qid=1631700549&sr=8-133
"Betron B750s Earphones, Wired In-Ear Headphones Earphones with Microphone, Noise Isolating, Tangle-Free Cable, Enhanced Bass, Black",£12.99,4.1 out of 5 stars,"5,215",https://www.amazon.co.uk//gp/slredirect/picassoRedirect.html/ref=pa_sp_mtf_aps_sr_pg9_1?ie=UTF8&adId=A1027281ZGVQ4962HFBO&url=%2FBetron-Earphones-Headphones-Definition-Isolating-Black-Control-Mic%2Fdp%2FB00NEYPWGG%2Fref%3Dsr_1_134_sspa%3Fdchild%3D1%26keywords%3Dearphones%26qid%3D1631700549%26sr%3D8-134-spons%26psc%3D1&qualifier=1631700549&id=6366555073414898&widgetName=sp_mtf
Wireless Earbuds Bluetooth Aoslen Wireless Headphones with Mic Bluetooth Earphones Touch Control with HIFI Stereo 40H Playtime LED Display Charging Case for Work/Travel/Gym/Game,£26.99,4.9 out of 5 stars,44,https://www.amazon.co.uk//Wireless-Bluetooth-Aoslen-Headphones-Earphones-White/dp/B09B722FPK/ref=sr_1_135?dchild=1&keywords=earphones&qid=1631700549&sr=8-135
"Wireless Earbuds, EarFun Air 4 Mics Noise Cancelling, Wireless Charging, Bluetooth 5.0 Earbuds, Touch Control, USB-C Quick Charge, Deep Bass, in-Ear Detection Headphones, 35H Playtime, IPX7 Waterproof",£42.49,4.4 out of 5 stars,"2,163",https://www.amazon.co.uk//EarFun-Wireless-Bluetooth-Detection-Headphones-Matte-Black/dp/B088H7GMHZ/ref=sr_1_136?dchild=1&keywords=earphones&qid=1631700549&sr=8-136
"AfterShokz Aeropex Sport Running Headphones, Wireless Bone Conduction Bluetooth Earphones with Mic, IP67 Waterproof for Cycling, Workout (Cosmic Black)",£149.95,4.6 out of 5 stars,"17,573",https://www.amazon.co.uk//AfterShokz-Open-Ear-Waterproof-Conduction-Headphones-Cosmic-Black/dp/B07RRQ59JR/ref=sr_1_137?dchild=1&keywords=earphones&qid=1631700549&sr=8-137
"DPS Deep Noise Reduction Earphones,Sport Headphones Bluetooth 5.0 EDR Wireless Stereo HiFi in-Ear Earbuds for Gym Running Outdoor Sports Workout (Black 13) (D3)",£59.99,,,https://www.amazon.co.uk//Reduction-Earphones-Headphones-Bluetooth-Wireless-D3/dp/B09D9L224Z/ref=sr_1_138?dchild=1&keywords=earphones&qid=1631700549&sr=8-138
"Betron B750s Earphones, Wired In-Ear Headphones Earphones, Noise Isolating, Tangle-Free Cable, Enhanced Bass, White",£10.99,4.2 out of 5 stars,"1,523",https://www.amazon.co.uk//gp/slredirect/picassoRedirect.html/ref=pa_sp_mtf_aps_sr_pg9_1?ie=UTF8&adId=A10271251N537OOOFB22N&url=%2FBetron-Earphones-Headphones-Definition-BlackBerry-White%2Fdp%2FB00I3LTQEE%2Fref%3Dsr_1_139_sspa%3Fdchild%3D1%26keywords%3Dearphones%26qid%3D1631700549%26sr%3D8-139-spons%26psc%3D1&qualifier=1631700549&id=6366555073414898&widgetName=sp_mtf
"Earphones, Headphones with Mic and Volume Control, In Ear Headphones Earphones Powerful Bass Sound Wired Earphones with Microphone for Samsung, and Most Smartphones which Support Headphones 3.5mm Jack",£5.99,4.1 out of 5 stars,922,https://www.amazon.co.uk//Earphones-Headphones-Powerful-Microphone-Smartphones-Black/dp/B09126J8ZG/ref=sr_1_140?dchild=1&keywords=earphones&qid=1631700549&sr=8-140
"EarFun Air Pro Wireless Earbuds Hybrid Active Noise Cancelling, Bluetooth 5.0 Wireless Headphones with 6 Mics ENC, Stereo Deep Bass, 32H Play Time with USB-C Charge, in-Ear Detection IPX5 Waterproof",£69.99,4.3 out of 5 stars,"2,865",https://www.amazon.co.uk//EarFun-Cancelling-Bluetooth-Headphones-Waterproof-Black/dp/B08J3XYKFW/ref=sr_1_141?dchild=1&keywords=earphones&qid=1631700549&sr=8-141
"AfterShokz OpenMove Wireless Sport Headphones, Bone Conduction Bluetooth Earphones with Mic, IP55 Sweat Resistant for Running, Cycling (Blue)",£79.95,4.6 out of 5 stars,"4,232",https://www.amazon.co.uk//AfterShokz-Conduction-Headphones-Bluetooth-Resistant-Blue/dp/B08BZDR3ZT/ref=sr_1_142?dchild=1&keywords=earphones&qid=1631700549&sr=8-142
