Description,Price,Ratings,Review Count,URL
GTPLAYER Gaming Chair Office Desk Chair Swivel Heavy Duty Chair Ergonomic Design with Cushion and Reclining Back Support(White),£99.99,4.3 out of 5 stars,"3,108",https://www.amazon.co.uk//gp/slredirect/picassoRedirect.html/ref=pa_sp_atf_aps_sr_pg1_1?ie=UTF8&adId=A0918451MINU4PKXR476&url=%2FGTPLAYER-Computer-Warranty%25E3%2580%2591-Ergonomic-Reclining%2Fdp%2FB07SVY3HVS%2Fref%3Dsr_1_1_sspa%3Fdchild%3D1%26keywords%3Dgaming%2Bchair%26qid%3D1631700250%26sr%3D8-1-spons%26psc%3D1&qualifier=1631700250&id=1710312999678670&widgetName=sp_atf
Requena Sport Desk Chair Adjustable Office Gaming Racing Chair Lumbar and Head Pillow Chair X3577 (Red),£89.99,4.4 out of 5 stars,"1,418",https://www.amazon.co.uk//gp/slredirect/picassoRedirect.html/ref=pa_sp_atf_aps_sr_pg1_1?ie=UTF8&adId=A002881615KAFX97NOML7&url=%2FRequena-Adjustable-Office-Gaming-Racing%2Fdp%2FB086X6BHCX%2Fref%3Dsr_1_2_sspa%3Fdchild%3D1%26keywords%3Dgaming%2Bchair%26qid%3D1631700250%26sr%3D8-2-spons%26psc%3D1&qualifier=1631700250&id=1710312999678670&widgetName=sp_atf
Millhouse Gaming Racing Desk Chair Adjustable Computer Office Chair Lumbar and Head Pillow Chairs X3681 (Black),£89.99,4.5 out of 5 stars,604,https://www.amazon.co.uk//gp/slredirect/picassoRedirect.html/ref=pa_sp_atf_aps_sr_pg1_1?ie=UTF8&adId=A0392262EGNJD63TUH9T&url=%2FMillhouse-Gaming-Racing-Adjustable-Computer%2Fdp%2FB07XJQ2HWH%2Fref%3Dsr_1_3_sspa%3Fdchild%3D1%26keywords%3Dgaming%2Bchair%26qid%3D1631700250%26sr%3D8-3-spons%26psc%3D1&qualifier=1631700250&id=1710312999678670&widgetName=sp_atf
Millhouse New Designed Racing Sport Swivel with Back Support Office Gaming Chair X2710S (Black-Red),£64.99,4.3 out of 5 stars,"2,242",https://www.amazon.co.uk//gp/slredirect/picassoRedirect.html/ref=pa_sp_atf_aps_sr_pg1_1?ie=UTF8&adId=A09989091YMCF8DFEWKYD&url=%2FMillhouse-Designed-Racing-Swivel-Black-Red%2Fdp%2FB079Z9F7SS%2Fref%3Dsr_1_4_sspa%3Fdchild%3D1%26keywords%3Dgaming%2Bchair%26qid%3D1631700250%26sr%3D8-4-spons%26psc%3D1&qualifier=1631700250&id=1710312999678670&widgetName=sp_atf
"mfavour Ergonomic Gaming Chair with Height Adjustment, Headrest Lumbar Support, E-Sports Swivel Chair for Game Playing and Working",£109.99,4.4 out of 5 stars,843,https://www.amazon.co.uk//mfavour-Ergonomic-Adjustment-Headrest-Support/dp/B096RKWLB2/ref=sr_1_5?dchild=1&keywords=gaming+chair&qid=1631700250&sr=8-5
NOKAXUS Gaming Chair Large Size High-back Ergonomic Racing Seat with Massager Lumbar Support and Retractible Footrest PU Leather 90-180 degree adjustment of backrest Thickening sponges (Yk-6008-red),£109.59,4.3 out of 5 stars,"4,631",https://www.amazon.co.uk//Nokaxus-Retractible-adjustment-Thickening-YK-6008-RED/dp/B07DZ8S3KQ/ref=sr_1_6?dchild=1&keywords=gaming+chair&qid=1631700250&sr=8-6
"Hbada Gaming Chair Racing Style Ergonomic High Back Computer Chair with Height Adjustment, Headrest and Lumbar Support E-Sports Swivel Chair, Gray",£149.99,4.3 out of 5 stars,"2,433",https://www.amazon.co.uk//Hbada-Ergonomic-Computer-Adjustment-Headrest/dp/B07WNSZFJW/ref=sr_1_7?dchild=1&keywords=gaming+chair&qid=1631700250&sr=8-7
GTPLAYER Gaming Chair Office Desk Chair Swivel Heavy Duty Chair Ergonomic Design with Cushion and Reclining Back Support(White),£99.99,4.3 out of 5 stars,"3,108",https://www.amazon.co.uk//GTPLAYER-Computer-Warranty%E3%80%91-Ergonomic-Reclining/dp/B07SVY3HVS/ref=sr_1_8?dchild=1&keywords=gaming+chair&qid=1631700250&sr=8-8
LUCKRACER Gaming Chair Massage With Footrest Ergonomic Office Chair With Massage Lumbar Pillow 360° Swivel & 150° Reclining High Back Support Height Adjustable Heavy Duty Computer Chair-BLACK,£99.98,4.4 out of 5 stars,846,https://www.amazon.co.uk//LUCKRACER-Ergonomic-Reclining-Adjustable-Chair-BLACK/dp/B091C66WW5/ref=sr_1_9?dchild=1&keywords=gaming+chair&qid=1631700250&sr=8-9
"MFAVOUR Ergonomic Gaming Chair with Breathable Mesh Pad, Racing Style Computer Chair with Adjustable Headrest and Lumbar Support, Gray",£109.99,4.3 out of 5 stars,189,https://www.amazon.co.uk//Ergonomic-Breathable-Computer-Adjustable-Headrest/dp/B09228ZQF8/ref=sr_1_10?dchild=1&keywords=gaming+chair&qid=1631700250&sr=8-10
"Gaming Chair - Yoleo Ergonomic Office Gamer Chair High Back, Computer Gaming Chair Backrest & Seat Height Adjustment, Executive Racing Swivel Desk Chair with Lumbar Support & Headrest - Black/Grey",£98.99,4.5 out of 5 stars,525,https://www.amazon.co.uk//Gaming-Chair-Ergonomic-Adjustment-Executive/dp/B08GC23VCM/ref=sr_1_11?dchild=1&keywords=gaming+chair&qid=1631700250&sr=8-11
Requena Sport Desk Chair Adjustable Office Gaming Racing Chair Lumbar and Head Pillow Chair X3577 (Red),£89.99,4.4 out of 5 stars,"1,418",https://www.amazon.co.uk//Requena-Adjustable-Office-Gaming-Racing/dp/B086X6BHCX/ref=sr_1_12?dchild=1&keywords=gaming+chair&qid=1631700250&sr=8-12
"Oversteel ULTIMET - Professional Gaming Chair, Blue",£109.89,4.3 out of 5 stars,205,https://www.amazon.co.uk//Oversteel-ULTIMET-Professional-Gaming-Chair/dp/B083SY1JH8/ref=sr_1_13?dchild=1&keywords=gaming+chair&qid=1631700250&sr=8-13
"STmeng Liberty T1 Ergonomic Gaming Chair, Computer Office Chair with Back Support, Home Work Desk Chairs with 360° Swivel Adjustable Height PU Leather Armrest Breathable Mesh Padded Seat, Blue",£89.99,4.3 out of 5 stars,"1,918",https://www.amazon.co.uk//STmeng-Revolving-Furniture-Adjustable-Essentials/dp/B087RCD6CH/ref=sr_1_14?dchild=1&keywords=gaming+chair&qid=1631700250&sr=8-14
Play haha.Gaming chair Office chair Swivel chair Computer chair Ergonomic Conference chair Work chair Lumbar support PU Leather Adjustable task chair Gas lift SGS tested (Red),£64.99,4.4 out of 5 stars,"3,353",https://www.amazon.co.uk//play-Ergonomic-Conference-Leatherwith-Adjustable/dp/B085246DCM/ref=sr_1_15?dchild=1&keywords=gaming+chair&qid=1631700250&sr=8-15
"Dripex Gaming Chair Ergonomic Office Chair Adjustable Swivel Leather Racing Computer Desk Chair with Lumbar Support and Headrest for Adult and Kid (Black, with footrest)",£129.99,4.4 out of 5 stars,877,https://www.amazon.co.uk//Dripex-Ergonomic-Adjustable-Computer-Headrest/dp/B08GH7CXLH/ref=sr_1_16?dchild=1&keywords=gaming+chair&qid=1631700250&sr=8-16
"Oversteel ULTIMET - Professional Gaming Chair, Blue",£109.89,4.3 out of 5 stars,205,https://www.amazon.co.uk//gp/slredirect/picassoRedirect.html/ref=pa_sp_mtf_aps_sr_pg1_1?ie=UTF8&adId=A0539602X340O03MOJL2&url=%2FOversteel-ULTIMET-Professional-Gaming-Chair%2Fdp%2FB083SY1JH8%2Fref%3Dsr_1_17_sspa%3Fdchild%3D1%26keywords%3Dgaming%2Bchair%26qid%3D1631700250%26sr%3D8-17-spons%26psc%3D1&qualifier=1631700250&id=1710312999678670&widgetName=sp_mtf
"AutoFull Gaming Chair Racing style Ergonomic High-Back office chair with Pu Leather，Adjustable Height and arms,Headrest and Lumbar Support，red (3 Year Warranty)",£229.99,4.6 out of 5 stars,105,https://www.amazon.co.uk//gp/slredirect/picassoRedirect.html/ref=pa_sp_mtf_aps_sr_pg1_1?ie=UTF8&adId=A02307862BAUTM4PSJZZ&url=%2FAutoFull-Ergonomic-High-Back-Leather%25EF%25BC%258CAdjustable-Support%25EF%25BC%258Cred%2Fdp%2FB08RDBTYG7%2Fref%3Dsr_1_18_sspa%3Fdchild%3D1%26keywords%3Dgaming%2Bchair%26qid%3D1631700250%26sr%3D8-18-spons%26psc%3D1%26smid%3DA33NRNS81HOO45&qualifier=1631700250&id=1710312999678670&widgetName=sp_mtf
KILLABEE Massage Gaming Chair High Back PU Leather PC Racing Computer Desk Office Swivel Recliner with Retractable Footrest and Adjustable Lumbar Support (Red),£101.14,4.3 out of 5 stars,45,https://www.amazon.co.uk//gp/slredirect/picassoRedirect.html/ref=pa_sp_mtf_aps_sr_pg1_1?ie=UTF8&adId=A04922491VK0EI8PI66&url=%2FKILLABEE-Computer-Recliner-Retractable-Adjustable%2Fdp%2FB08T227ZY2%2Fref%3Dsr_1_19_sspa%3Fdchild%3D1%26keywords%3Dgaming%2Bchair%26qid%3D1631700250%26sr%3D8-19-spons%26psc%3D1&qualifier=1631700250&id=1710312999678670&widgetName=sp_mtf
"BASETBL Gaming Chair,Office Racing Chair With Footrest Pc Gamer Chair Ergonomic Computer Desk Chair With Adjustable Armrest, Height,Lumbar Support for Adult and Teenagers,150kg （White）",£135.99,4.5 out of 5 stars,172,https://www.amazon.co.uk//gp/slredirect/picassoRedirect.html/ref=pa_sp_mtf_aps_sr_pg1_1?ie=UTF8&adId=A00488361QIMKZJRBQY1B&url=%2FBASETBL-Footrest-Ergonomic-Adjustable-Teenagers%2Fdp%2FB08S3FMQ84%2Fref%3Dsr_1_20_sspa%3Fdchild%3D1%26keywords%3Dgaming%2Bchair%26qid%3D1631700250%26sr%3D8-20-spons%26psc%3D1&qualifier=1631700250&id=1710312999678670&widgetName=sp_mtf
Homall Gaming Chair Computer Desk Office Chair with Footrest Racing Gamer Chair Adjustable Swivel Ergonomic Chair High Back Reclining Chair (Black),£119.99,4.3 out of 5 stars,114,https://www.amazon.co.uk//Homall-Footrest-Adjustable-Ergonomic-Reclining/dp/B08Q8GW2GK/ref=sr_1_21?dchild=1&keywords=gaming+chair&qid=1631700250&sr=8-21
play haha. Gaming Chair Racing Style Office Swivel Computer Desk Chair Ergonomic Conference Chair Work Chair with Lumbar Support PU Leatherwith Adjustable Task Chair Gas lift SGS tested,£73.99,4.2 out of 5 stars,"11,628",https://www.amazon.co.uk//play-Ergonomic-Conference-Leatherwith-Adjustable/dp/B07S2XCK3P/ref=sr_1_22?dchild=1&keywords=gaming+chair&qid=1631700250&sr=8-22
bigzzia Gaming Chair Office Chair Desk Chair Swivel Heavy Duty Chair Ergonomic Design with Cushion and Reclining Back Support (Red and Black),£86.99,4.0 out of 5 stars,"1,066",https://www.amazon.co.uk//bigzzia-Ergonomic-Cushion-Reclining-Support/dp/B08D9MPDRH/ref=sr_1_23?dchild=1&keywords=gaming+chair&qid=1631700250&sr=8-23
"Corsair T3 Rush, Polyester Fabric Gaming Office Chair (Breathable Soft Fabric Exterior, Padded Neck Cushion, Memory Foam Lumbar Support, 4D Armrests, 180 Degree Recliner, Easy Assembly) Grey/White",,4.6 out of 5 stars,385,https://www.amazon.co.uk//Corsair-Polyester-Breathable-Exterior-Armrests/dp/B07YYPH4PX/ref=sr_1_24?dchild=1&keywords=gaming+chair&qid=1631700250&sr=8-24
"SHA XiaZhi Office Chair PU Leather Desk Gaming Chair, Ergonomically Adjustable Racing Chair, Tasks Swivel Executive Computer Chair (grey1)",£99.99,4.2 out of 5 stars,"2,304",https://www.amazon.co.uk//SHA-XiaZhi-Ergonomically-Adjustable-Executive/dp/B0828H9PK4/ref=sr_1_25?dchild=1&keywords=gaming+chair&qid=1631700250&sr=8-25
Amazon Brand - Umi Office Gaming Chair With Footrest Ergonomic Computer Desk Chair With High Back Lumbar Support 360 Degree Swivel Rocking Chair - Blue,£125.99,4.3 out of 5 stars,"2,391",https://www.amazon.co.uk//Essentials-Gaming-Ergonomic-Computer-Footrest/dp/B07DC15YRP/ref=sr_1_26?dchild=1&keywords=gaming+chair&qid=1631700250&sr=8-26
"IntimaTe WM Heart Gaming Chair Ergonomic Office Desk Chair Swivel Racing Computer Chair PC Gamer Chair Adjustable Task Chair, Red",£76.99,4.5 out of 5 stars,"8,071",https://www.amazon.co.uk//IntimaTe-WM-Heart-Reclining-Computer/dp/B01EIXO56O/ref=sr_1_27?dchild=1&keywords=gaming+chair&qid=1631700250&sr=8-27
Video Gaming Chair Racing Recliner with Massage Function- Ergonomic Adjustable Padded Armrest Swivel High Back Footrest with Headrest Lumbar Support Leather Breathable Bucket Seat Home Office Desk,£129.00,4.5 out of 5 stars,42,https://www.amazon.co.uk//Video-Gaming-Chair-Racing-Recliner/dp/B08P6YVF79/ref=sr_1_28?dchild=1&keywords=gaming+chair&qid=1631700250&sr=8-28
"Alltmy Gaming Office Chair, Ergonomic Office Computer Video Game Chair with Lumbar Support, Racing Style PU Leather Desk Chair High Back Computer Chair, Adjustable Swivel Task Chair (RED)",£85.99,5.0 out of 5 stars,9,https://www.amazon.co.uk//Alltmy-Ergonomic-Computer-Support-Adjustable/dp/B09BVFS2LK/ref=sr_1_29?dchild=1&keywords=gaming+chair&qid=1631700250&sr=8-29
"AutoFull Gaming Chair Ergonomic Office Chair High Back Swivel Chair Racing Pu Leather Computer Chair With Arms,Thicker Bucket Seat,Adjustable Height,Back Support And Footrest,Red (3 Year Warranty)",£186.99,4.5 out of 5 stars,768,https://www.amazon.co.uk//AutoFull-Ergonomic-Computer-Adjustable-Footrest/dp/B08CCWF8FV/ref=sr_1_30?dchild=1&keywords=gaming+chair&qid=1631700250&sr=8-30
Homall Gaming Chair Office Desk Chair Swivel Racing Computer Chair Pc Gamer Chair Ergonomic Design Heavy Duty Chair High Back Reclining Chair with Cushion and Back Support (Light white),£89.99,4.5 out of 5 stars,242,https://www.amazon.co.uk//Homall-Computer-Ergonomic-Reclining-Cushion/dp/B096XJ69HH/ref=sr_1_31?dchild=1&keywords=gaming+chair&qid=1631700250&sr=8-31
Olsen & Smith XTREME New and Improved 2021 Model Gaming Chair Ergonomic Office Desk PC Computer Recliner Swivel Chair Detachable Padded Head Rest Lumbar Support Cushion & Footrest (Black/White),£103.99,4.5 out of 5 stars,382,https://www.amazon.co.uk//Olsen-Smith-Ergonomic-Computer-Detachable/dp/B0897SHQD8/ref=sr_1_32?dchild=1&keywords=gaming+chair&qid=1631700250&sr=8-32
"AutoFull Gaming Chair Ergonomic Office Chair High Back Racing Computer Chair Pu Leather with back Support,Thicker Bucket Seat,Adjustable arms and Height,Footrest,Brown",£229.99,4.6 out of 5 stars,193,https://www.amazon.co.uk//gp/slredirect/picassoRedirect.html/ref=pa_sp_mtf_aps_sr_pg1_1?ie=UTF8&adId=A01436271VTB836XDGQF2&url=%2FAutoFull-Ergonomic-Computer-Adjustable-Footrest%2Fdp%2FB092DF433H%2Fref%3Dsr_1_33_sspa%3Fdchild%3D1%26keywords%3Dgaming%2Bchair%26qid%3D1631700250%26sr%3D8-33-spons%26psc%3D1&qualifier=1631700250&id=1710312999678670&widgetName=sp_mtf
"LUCKRACER Gaming Chair Ergonomic Desk Chair Racing Style Office Computer Chair With High Back Support 360° Swivel 150° Reclining Rocking Function For Children, Teenagers And Adults - Grey",£69.99,4.5 out of 5 stars,436,https://www.amazon.co.uk//gp/slredirect/picassoRedirect.html/ref=pa_sp_mtf_aps_sr_pg1_1?ie=UTF8&adId=A097578231QJ4GY07VO8P&url=%2FLUCKRACER-Ergonomic-Cushion-Reclining-Support%2Fdp%2FB085TCZ8NC%2Fref%3Dsr_1_34_sspa%3Fdchild%3D1%26keywords%3Dgaming%2Bchair%26qid%3D1631700250%26sr%3D8-34-spons%26psc%3D1&qualifier=1631700250&id=1710312999678670&widgetName=sp_mtf
"EUCO Office chair,Gaming Chair Racing Style Leather Computer Chair Ergonomics PC Chair High Back Reclining Executive Desk Chair with Adjustable Armrest and Lumbar Support",£66.99,4.3 out of 5 stars,323,https://www.amazon.co.uk//gp/slredirect/picassoRedirect.html/ref=pa_sp_mtf_aps_sr_pg1_1?ie=UTF8&adId=A0515326LUVPFKV3WTRO&url=%2FEUCO-Ergonomics-Reclining-Executive-Adjustable%2Fdp%2FB07TKSYXBD%2Fref%3Dsr_1_35_sspa%3Fdchild%3D1%26keywords%3Dgaming%2Bchair%26qid%3D1631700250%26sr%3D8-35-spons%26psc%3D1%26smid%3DAQHHMJY5GWYRK&qualifier=1631700250&id=1710312999678670&widgetName=sp_mtf
TIANSHU Gaming Chair Office Chair With Footrest Ergonomic Conference Executive Manager Work Chair Adjustable Height and Lumbar Support(Blue),£79.99,4.2 out of 5 stars,297,https://www.amazon.co.uk//gp/slredirect/picassoRedirect.html/ref=pa_sp_mtf_aps_sr_pg1_1?ie=UTF8&adId=A015867821ZUX2A8B18H2&url=%2FTIANSHU-Ergonomic-Conference-Executive-Adjustable%2Fdp%2FB082WXXVLK%2Fref%3Dsr_1_36_sspa%3Fdchild%3D1%26keywords%3Dgaming%2Bchair%26qid%3D1631700250%26sr%3D8-36-spons%26psc%3D1&qualifier=1631700250&id=1710312999678670&widgetName=sp_mtf
"STmeng Comfort X3 Ergonomic Gaming Chair, Home Office Chair with Back Support, Racing Computer Desk Chairs with Adjustable Height Headrest Footrest Flip-up Armrest PU Leather Padded Seat, Black",£162.99,4.2 out of 5 stars,47,https://www.amazon.co.uk//STmeng-Comfort-X3-Ergonomic-Adjustable/dp/B091YFPFYH/ref=sr_1_37?dchild=1&keywords=gaming+chair&qid=1631700250&sr=8-37
GTFORCE PRO GT Reclining Sports Racing Gaming Office Desk PC CAR Faux Leather Chair (Grey),£149.99,4.5 out of 5 stars,"1,497",https://www.amazon.co.uk//GTFORCE-Reclining-Sports-Racing-Leather/dp/B07BBSM5XS/ref=sr_1_38?dchild=1&keywords=gaming+chair&qid=1631700250&sr=8-38
GTFORCE PRO FX Reclining Sports Racing Gaming Office Desk PC CAR Faux Leather Chair (White),£149.99,4.5 out of 5 stars,696,https://www.amazon.co.uk//GTFORCE-Reclining-Sports-Racing-Leather/dp/B06WW6HNF4/ref=sr_1_39?dchild=1&keywords=gaming+chair&qid=1631700250&sr=8-39
AutoFull Pink Ergonomic Gaming Chair Cute Kawaii Style Office Chair PU Leather High Back Racing Chairs with Rabbit Ears and Tail (3-Years Warranty),£239.99,4.8 out of 5 stars,"2,265",https://www.amazon.co.uk//AutoFull-Computer-Customized-Armrest-Ergonomic/dp/B07QHW64BD/ref=sr_1_40?dchild=1&keywords=gaming+chair&qid=1631700250&sr=8-40
Yaheetech High Back Gaming Chair Lumbar Support Racing Chair Adjustable Ergonomic Office Reclining Chair Executive Swivel Chair,£69.99,4.3 out of 5 stars,778,https://www.amazon.co.uk//Yaheetech-Gaming-Ergonomic-Racing-Reclining/dp/B08D7MKHWT/ref=sr_1_41?dchild=1&keywords=gaming+chair&qid=1631700250&sr=8-41
VON RACER Gaming Chair Racing Computer Desk Office Chair Swivel Ergonomic Executive Bonded Leather Chair with Headrest Lumbar Support and Adjustable Armrests (Grey),,4.2 out of 5 stars,41,https://www.amazon.co.uk//FANTASYLAB-Computer-Ergonomic-Executive-Adjustable/dp/B08LD9GNFV/ref=sr_1_42?dchild=1&keywords=gaming+chair&qid=1631700250&sr=8-42
"XLLLL Gaming Chair Reclining High Back Racing Chairs,Ergonomic Cute Kawaii Style Office Computer Desk Chair With Rabbit Ears And Headrest,Max Weight Of 150 Kg,Yellow",,,,https://www.amazon.co.uk//XLLLL-Reclining-Ergonomic-Computer-Headrest/dp/B091TQG5JW/ref=sr_1_43?dchild=1&keywords=gaming+chair&qid=1631700250&sr=8-43
COMHOMA Desk Chair Office Chairs 90° Flip-up Armrest Ergonomic Computer Chair Lumbar Support Height Adjustable 360° Swivel Rocking Function Mesh Back Seat For Home Office - Black,£79.99,4.4 out of 5 stars,"1,887",https://www.amazon.co.uk//COMHOMA-Ergonomic-Flip-up-Armrest-Support/dp/B08BHT6PTZ/ref=sr_1_44?dchild=1&keywords=gaming+chair&qid=1631700250&sr=8-44
"LUCKRACER Gaming Chair Ergonomic Desk Chair Racing Style Office Computer Chair With High Back Support 360° Swivel 150° Reclining Rocking Function For Children, Teenagers And Adults - Grey",£69.99,4.5 out of 5 stars,436,https://www.amazon.co.uk//LUCKRACER-Ergonomic-Cushion-Reclining-Support/dp/B085TCZ8NC/ref=sr_1_45?dchild=1&keywords=gaming+chair&qid=1631700250&sr=8-45
"JR Knight Gaming Chair with Footrest, Home Office Desk Executive Chair, Adjustable Swivel PU Leather Reclining Ergonomic Computer Chair (Green)",£69.99,4.4 out of 5 stars,115,https://www.amazon.co.uk//JR-Knight-Executive-Adjustable-Reclining/dp/B08GX88J9C/ref=sr_1_46?dchild=1&keywords=gaming+chair&qid=1631700250&sr=8-46
Gaming Chair Armrest and Height Adjustable Swivel Reclining Racing Style Computer Chairs PU Leather High Back Support Ergonomic Design,£59.99,4.3 out of 5 stars,32,https://www.amazon.co.uk//DZ-Aimier-Adjustable-Reclining-Executive/dp/B08J3WHY2F/ref=sr_1_47?dchild=1&keywords=gaming+chair&qid=1631700250&sr=8-47
"Gaming Chair -YOLEO Ergonomic Computer Gaming Chair Adjustable Armrest High Back Office Chair Mute Casters Desk Chair with Lumbar Support and Headrest, Recliner Chair BIFMA Certified",£96.99,4.5 out of 5 stars,"1,163",https://www.amazon.co.uk//Ergonomic-Computer-Adjustable-Headrest-Certified/dp/B085W2TQNR/ref=sr_1_48?dchild=1&keywords=gaming+chair&qid=1631700250&sr=8-48
AMINITURE Gaming Chairs High Back Ergonomic Office Chair Racing Video Game Chair with Adjustable Armrests Headrest and Lumbar Pillow E-sports Chair (Black),£119.99,5.0 out of 5 stars,2,https://www.amazon.co.uk//AMINITURE-Ergonomic-Adjustable-Armrests-Headrest/dp/B095HGW157/ref=sr_1_49?dchild=1&keywords=gaming+chair&qid=1631700250&sr=8-49
"mfavour Ergonomic Gaming Chair Racing Style Leather Computer Chair with Height Adjustment, Adjustable Lumbar and Headrest (Red)",£109.99,4.4 out of 5 stars,331,https://www.amazon.co.uk//mfavour-Leather-Computer-Ergonomic-Adjustable/dp/B07NR7ZG38/ref=sr_1_50?dchild=1&keywords=gaming+chair&qid=1631700250&sr=8-50
"SONGMICS Gaming Chair, Office Racing Chair with Footrest, Ergonomic Design, Adjustable Headrest, Lumbar Support, 150 kg Weight Capacity, Black and Grey OBG77BGUK",£118.99,4.5 out of 5 stars,690,https://www.amazon.co.uk//SONGMICS-Footrest-Ergonomic-Adjustable-OBG77BGUK/dp/B07L5LVH8S/ref=sr_1_51?dchild=1&keywords=gaming+chair&qid=1631700250&sr=8-51
"IntimaTe WM Heart Gaming Chairs,Ergonomic Computer Office Chair for Adults and Kids,Adjustable Recliner Chair Pc Desk Swivel Leather Chair with Arms for Home,Black",£69.99,4.6 out of 5 stars,"5,814",https://www.amazon.co.uk//Gaming-Computer-Ergonomic-Office-Children/dp/B01I4GSEP4/ref=sr_1_52?dchild=1&keywords=gaming+chair&qid=1631700250&sr=8-52
"Dripex Gaming Chair Ergonomic Home Office Desk Chairs Adjustable High Back Swivel PU Leather Racing Computer Desk Chair with Lumbar Support and Headrest (White, without footrest)",£99.99,4.4 out of 5 stars,937,https://www.amazon.co.uk//Dripex-Ergonomic-Adjustable-Computer-Headrest/dp/B08GFY61PZ/ref=sr_1_53?dchild=1&keywords=gaming+chair&qid=1631700250&sr=8-53
"IntimaTe WM Heart Gaming Chair, Ergonomic High Back Office Racing Chair with Armrest, Swivel Leather Desk Chairs with Adjustable Headrest and Lumbar Cushion for Office and Home, Blue",£83.99,4.5 out of 5 stars,"2,264",https://www.amazon.co.uk//IntimaTe-WM-Heart-High-back-Adjustable/dp/B07V5YWG8H/ref=sr_1_54?dchild=1&keywords=gaming+chair&qid=1631700250&sr=8-54
FAYEAN Ergonomic Racing Gaming Chair Swivel PU Leather Home Desk Chair 06 (Green),£76.88,4.3 out of 5 stars,173,https://www.amazon.co.uk//FAYEAN-Ergonomic-Racing-Gaming-Leather/dp/B089GTXQTK/ref=sr_1_55?dchild=1&keywords=gaming+chair&qid=1631700250&sr=8-55
GTPLAYER Gaming Chair Ergonomic Triple Back Support Breatheable Mesh 360° Swivel 3D Armrest Height Adjustable 150° Reclining Rocking Computer Chair - Black,£149.99,4.3 out of 5 stars,156,https://www.amazon.co.uk//GTPLAYER-Ergonomic-Breatheable-Adjustable-Reclining/dp/B08ZMY357W/ref=sr_1_56?dchild=1&keywords=gaming+chair&qid=1631700250&sr=8-56
"JR Knight Ergonomic Gaming Chair with Footrest, Home Office Computer Executive Swivel Chair with Lumbar Support, PU Leather Desk Chair with Recliner (Black&Green)",£89.99,4.2 out of 5 stars,987,https://www.amazon.co.uk//JR-Knight-LC-04BKGN-Ergonomic-Professional/dp/B07GRQDQRR/ref=sr_1_57?dchild=1&keywords=gaming+chair&qid=1631700250&sr=8-57
GTFORCE Turbo Reclining Sports Racing Gaming Office Desk PC CAR Faux Leather Chair (Grey),£129.99,4.3 out of 5 stars,460,https://www.amazon.co.uk//GTFORCE-Reclining-Sports-Racing-Leather/dp/B07C1R8LN9/ref=sr_1_58?dchild=1&keywords=gaming+chair&qid=1631700250&sr=8-58
"BASETBL Office Gaming Chair PU Leather Ergonomic Swivel Computer Chair With Flip-up Armrest, Adjustable Height Executive Desk Chair (Grey)",£99.99,4.3 out of 5 stars,119,https://www.amazon.co.uk//BASETBL-Ergonomic-Computer-Adjustable-Executive/dp/B0932W2DGM/ref=sr_1_59?dchild=1&keywords=gaming+chair&qid=1631700250&sr=8-59
X Rocker Hydra 2.0 Floor Rocker Gaming Chair with 2.0 Audio System (Red),£74.99,4.2 out of 5 stars,44,https://www.amazon.co.uk//Rocker-Hydra-Floor-Gaming-Electronic/dp/B07FDYG7L7/ref=sr_1_60?dchild=1&keywords=gaming+chair&qid=1631700250&sr=8-60
"AutoFull Gaming Chair Racing style Ergonomic High-Back office chair with Pu Leather，Adjustable Height and arms,Headrest and Lumbar Support，blue(3 Year Warranty)",£239.99,4.6 out of 5 stars,105,https://www.amazon.co.uk//gp/slredirect/picassoRedirect.html/ref=pa_sp_atf_next_aps_sr_pg2_1?ie=UTF8&adId=A02309741FNV8LBL9LLI6&url=%2FAutoFull-Ergonomic-High-Back-Leather%25EF%25BC%258CAdjustable-Support%25EF%25BC%258Cblue%2Fdp%2FB08S6VMF9B%2Fref%3Dsr_1_49_sspa%3Fdchild%3D1%26keywords%3Dgaming%2Bchair%26qid%3D1631700252%26sr%3D8-49-spons%26psc%3D1%26smid%3DA33NRNS81HOO45&qualifier=1631700252&id=4653382100751640&widgetName=sp_atf_next
"AutoFull Gaming Chair Ergonomic Office Chair High Back Racing Computer Chair Pu Leather with Back Support,Thicker Bucket Seat,Adjustable arms and Height,Footrest,Gray",£229.99,4.6 out of 5 stars,193,https://www.amazon.co.uk//gp/slredirect/picassoRedirect.html/ref=pa_sp_atf_next_aps_sr_pg2_1?ie=UTF8&adId=A01439392VZ753YP9PUWN&url=%2FAutoFull-Ergonomic-Computer-Adjustable-Footrest%2Fdp%2FB092DCB92S%2Fref%3Dsr_1_50_sspa%3Fdchild%3D1%26keywords%3Dgaming%2Bchair%26qid%3D1631700252%26sr%3D8-50-spons%26psc%3D1&qualifier=1631700252&id=4653382100751640&widgetName=sp_atf_next
"BASETBL Gaming Chair,Office Racing Chair With Footrest Pc Gamer Chair Ergonomic Computer Desk Chair With Adjustable Armrest,High Back,Lumbar Support for Adult and Teenagers,150kg（Black）",£129.99,4.5 out of 5 stars,172,https://www.amazon.co.uk//gp/slredirect/picassoRedirect.html/ref=pa_sp_atf_next_aps_sr_pg2_1?ie=UTF8&adId=A00490802RYO6HW248HYB&url=%2FBASETBL-Ergonomic-Adjustable-Teenagers-150kg%25EF%25BC%2588Black%25EF%25BC%2589%2Fdp%2FB091TRFX4Z%2Fref%3Dsr_1_51_sspa%3Fdchild%3D1%26keywords%3Dgaming%2Bchair%26qid%3D1631700252%26sr%3D8-51-spons%26psc%3D1&qualifier=1631700252&id=4653382100751640&widgetName=sp_atf_next
KILLABEE Massage Gaming Chair High Back PU Leather PC Racing Computer Desk Office Swivel Recliner with Retractable Footrest and Adjustable Lumbar Support (Blue),£101.99,4.3 out of 5 stars,45,https://www.amazon.co.uk//gp/slredirect/picassoRedirect.html/ref=pa_sp_atf_next_aps_sr_pg2_1?ie=UTF8&adId=A04919053BK3MACAII98F&url=%2FKILLABEE-Computer-Recliner-Retractable-Adjustable%2Fdp%2FB08T1WV734%2Fref%3Dsr_1_52_sspa%3Fdchild%3D1%26keywords%3Dgaming%2Bchair%26qid%3D1631700252%26sr%3D8-52-spons%26psc%3D1&qualifier=1631700252&id=4653382100751640&widgetName=sp_atf_next
"UKing Gaming Chair, Sport Racing Chair Style, 90°-135° High Back Adjustable Office Chair Ergonomic Chair, Swivel Chair with Headrest Lumbar Cushion Retractable Footrest (Gray)",£59.99,,,https://www.amazon.co.uk//UKing-90%C2%B0-135%C2%B0-Adjustable-Ergonomic-Retractable/dp/B098S137BC/ref=sr_1_53?dchild=1&keywords=gaming+chair&qid=1631700252&sr=8-53
Millhouse New Designed Racing Sport Swivel with Back Support Office Gaming Chair X2710S (Black-Red),£64.99,4.3 out of 5 stars,"2,242",https://www.amazon.co.uk//Millhouse-Designed-Racing-Swivel-Black-Red/dp/B079Z9F7SS/ref=sr_1_54?dchild=1&keywords=gaming+chair&qid=1631700252&sr=8-54
