Description,Price,Ratings,Review Count,URL
"mfavour Ergonomic Office Chair with Back Support, Mesh Office Chair with Adjustable Headrest and Armrest, Home Office Chair with Tilt Function and Position Lock (Black)",£135.99,4.6 out of 5 stars,88,https://www.amazon.co.uk//mfavour-Ergonomic-Adjustable-Headrest-Function/dp/B094FS2612/ref=sr_1_222?dchild=1&keywords=gaming+chair&qid=1631700257&sr=8-222
"Twomaples Gaming Chair, Ergonomic Office Chair, Adjustable Armrest, Height, Angle, 360° Swivel, with Neck & Lumbar Support, Wheels, Home Games Racing Computer Desk Chairs for Teenagers, Adults",£109.99,4.3 out of 5 stars,157,https://www.amazon.co.uk//gp/slredirect/picassoRedirect.html/ref=pa_sp_mtf_aps_sr_pg5_1?ie=UTF8&adId=A073286718QD85C2QE6QH&url=%2FTwomaples-Computer-Ergonomic-Backrest-Sports%2Fdp%2FB08RJ13DXC%2Fref%3Dsr_1_223_sspa%3Fdchild%3D1%26keywords%3Dgaming%2Bchair%26qid%3D1631700257%26sr%3D8-223-spons%26psc%3D1&qualifier=1631700257&id=2022316104583142&widgetName=sp_mtf
TIANSHU Gaming Chair Office Chair With Footrest Ergonomic Conference Executive Manager Work Chair Adjustable Height and Lumbar Support(White),£79.99,4.2 out of 5 stars,297,https://www.amazon.co.uk//gp/slredirect/picassoRedirect.html/ref=pa_sp_mtf_aps_sr_pg5_1?ie=UTF8&adId=A060416324MWOXE8B4E2S&url=%2FTIANSHU-Ergonomic-Conference-Executive-Adjustable%2Fdp%2FB082WYH1H3%2Fref%3Dsr_1_224_sspa%3Fdchild%3D1%26keywords%3Dgaming%2Bchair%26qid%3D1631700257%26sr%3D8-224-spons%26psc%3D1&qualifier=1631700257&id=2022316104583142&widgetName=sp_mtf
bigzzia Gaming Chair Office Chair Desk Chair Swivel Heavy Duty Chair Ergonomic Design with Cushion and Reclining Back Support (Green and Black),£86.99,4.0 out of 5 stars,"1,066",https://www.amazon.co.uk//gp/slredirect/picassoRedirect.html/ref=pa_sp_mtf_aps_sr_pg5_1?ie=UTF8&adId=A07502413K0Y94WR7W76T&url=%2Fbigzzia-Ergonomic-Cushion-Reclining-Support%2Fdp%2FB08D9MWKFH%2Fref%3Dsr_1_225_sspa%3Fdchild%3D1%26keywords%3Dgaming%2Bchair%26qid%3D1631700257%26sr%3D8-225-spons%26psc%3D1&qualifier=1631700257&id=2022316104583142&widgetName=sp_mtf
play haha. Gaming Chair Racing Style Office Swivel Computer Desk Chair Ergonomic Conference Chair Work Chair with Lumbar Support PU Leatherwith Adjustable Task Chair Gas lift SGS tested,£75.99,4.2 out of 5 stars,"11,628",https://www.amazon.co.uk//gp/slredirect/picassoRedirect.html/ref=pa_sp_mtf_aps_sr_pg5_1?ie=UTF8&adId=A018439518U2ZCQH9O2BX&url=%2Fplay-Ergonomic-Conference-Leatherwith-Adjustable%2Fdp%2FB07RZTRZTB%2Fref%3Dsr_1_226_sspa%3Fdchild%3D1%26keywords%3Dgaming%2Bchair%26qid%3D1631700257%26sr%3D8-226-spons%26psc%3D1%26smid%3DA3T4YOKKT77LB6&qualifier=1631700257&id=2022316104583142&widgetName=sp_mtf
"IntimaTe WM Heart Gaming Chair for Adult,Gaming Chair with Footrest,High Black Ergonomic Racing Chair,Recliner Gaming Chair with Adjustable Height,Swivel Chair with Headrest and Back Support,Grey",£119.99,4.5 out of 5 stars,992,https://www.amazon.co.uk//IntimaTe-WM-Heart-Footrest-Adjustable/dp/B082VSZC86/ref=sr_1_227?dchild=1&keywords=gaming+chair&qid=1631700257&sr=8-227
"X-Rocker Evo Pro 4.1 Multi-Stereo Sound Gaming Chair with LED RGB Edge Lighting, Speakers Subwoofer, Vibration, Wireless and Bluetooth Console Chair, Black PU",,4.1 out of 5 stars,2019,https://www.amazon.co.uk//Rocker-Evo-Pro-Electronic-Games/dp/B07QJFTRKX/ref=sr_1_228?dchild=1&keywords=gaming+chair&qid=1631700257&sr=8-228
"SONGMICS Office Chair with Adjustable Headrest, High Back 81 cm, Racing Sport Swivel Chair, Flip-Up Armrest Executive Chair PU, Black OBG65BKUK",£155.99,4.4 out of 5 stars,578,https://www.amazon.co.uk//SONGMICS-Racing-Headrest-Adjustable-OBG65BKUK/dp/B07C2S6QGM/ref=sr_1_229?dchild=1&keywords=gaming+chair&qid=1631700257&sr=8-229
"IntimaTe WM Heart High Back Gaming Chair with Footrest, Ergonomic Racing Chair, Leatherette Office Chair (Pink)",£114.99,4.4 out of 5 stars,"1,173",https://www.amazon.co.uk//IntimaTe-WM-Heart-Ergonomic-Leatherette/dp/B08X4N6YD6/ref=sr_1_230?dchild=1&keywords=gaming+chair&qid=1631700257&sr=8-230
EUREKA ERGONOMIC Office Chair Swiveling Computer Desk Chair High Back Mesh Desk Chair GE300 Gaming Chair with Adjustable Armrests Lumbar Support and Padded Seat Black and Blue,£132.99,4.7 out of 5 stars,6,https://www.amazon.co.uk//EUREKA-ERGONOMIC-Gaming-Chair-ONEX/dp/B08LPKGH9G/ref=sr_1_231?dchild=1&keywords=gaming+chair&qid=1631700257&sr=8-231
"Komene Ergonomic Office Chair, 360 ° Rotatable Office Chair With Breathable Mesh Back, Adjustable Headrest, Backrest and Liftable 3D Armrest, Black Executive Chair (Black)",£269.99,4.3 out of 5 stars,207,https://www.amazon.co.uk//Komene-Ergonomic-Breathable-Adjustable-Executive/dp/B08BRHY4NX/ref=sr_1_232?dchild=1&keywords=gaming+chair&qid=1631700257&sr=8-232
CHIITEK Gaming Chair with Footrest Ergonomic Office Computer Game Chair Adjustable Swivel Desk Chair Leather High Back Headrest and Lumbar Support E-Sports Chair Black & Red,£109.59,3.5 out of 5 stars,18,https://www.amazon.co.uk//CHIITEK-Footrest-Ergonomic-Computer-Adjustable/dp/B08LL28Q8X/ref=sr_1_233?dchild=1&keywords=gaming+chair&qid=1631700257&sr=8-233
"Dripex Ergonomic Office Chair with Footrest, 140° Adjustable Desk Chair Reclining Computer Chair with Headrest and Lumbar Support- Black, Max Capacity 285lbs",£69.24,4.2 out of 5 stars,108,https://www.amazon.co.uk//Dripex-Ergonomic-Footrest-Adjustable-Reclining/dp/B08FBXGTRH/ref=sr_1_234?dchild=1&keywords=gaming+chair&qid=1631700257&sr=8-234
SONGMICS Executive Office and Lounge Chair with Gravity Casters and Foldable Headrest Ergonomic Swivel Gaming Chair PU Black Extra Large Size OBG76BUKV1,£204.07,3.9 out of 5 stars,34,https://www.amazon.co.uk//SONGMICS-Executive-Foldable-Ergonomic-OBG76BUKV1/dp/B07RQKDWJF/ref=sr_1_235?dchild=1&keywords=gaming+chair&qid=1631700257&sr=8-235
ELFORDSON Gaming Chair Ergonomic Computer Office Chair with Footrest for Adults Kids Home Racing Sport Game PU Leather Armrest Headrest (Blue Colour),£99.99,4.5 out of 5 stars,10,https://www.amazon.co.uk//ELFORDSON-Footrest-Armrest-Headrest-Executive/dp/B084M17GGH/ref=sr_1_236?dchild=1&keywords=gaming+chair&qid=1631700257&sr=8-236
JL Comfurni Gaming Chair Desk Chairs with footrest Racing Swivel Leather Chair Office Computer Reclining Chair High Back with Lumbar Support Pink,£92.99,4.5 out of 5 stars,420,https://www.amazon.co.uk//JL-Comfurni-Executive-Ergonomic-Headrest/dp/B07M7SY4BV/ref=sr_1_237?dchild=1&keywords=gaming+chair&qid=1631700257&sr=8-237
"Ergonomic Office Chair for Home,High-Back Reclining Computer Mesh Chair with Arms and Headrest Swivel PC Gaming chair Desk Chair for Bedroom(Grey)",£72.99,3.9 out of 5 stars,55,https://www.amazon.co.uk//Ergonomic-High-Back-Reclining-Computer-Headrest/dp/B08J3KSWLP/ref=sr_1_238?dchild=1&keywords=gaming+chair&qid=1631700257&sr=8-238
"EUREKA ERGONOMIC Gaming Chair Racing Style Computer Desk Chair Ergonomic Office Chair Swivel PC Gamer Chair Conference Chair With Padded Armrest and Reclining Back Support, Black",£81.99,4.3 out of 5 stars,3,https://www.amazon.co.uk//EUREKA-ERGONOMIC-Computer-Ergonomic-Adjustable/dp/B08LPP899D/ref=sr_1_239?dchild=1&keywords=gaming+chair&qid=1631700257&sr=8-239
"Cougar Armor S Gaming Chair with Reclining and Height Adjustment, Black and Orange",£214.98,4.7 out of 5 stars,9,https://www.amazon.co.uk//Cougar-Gaming-Reclining-Height-Adjustment/dp/B08LH2423X/ref=sr_1_240?dchild=1&keywords=gaming+chair&qid=1631700257&sr=8-240
"X-Rocker Agility Junior eSports PC Gaming Chair, Adjustable with Neck and Lumbar Support – Blue",£149.99,4.8 out of 5 stars,20,https://www.amazon.co.uk//X-Rocker-Agility-eSports-Adjustable-Support/dp/B08B1KJJVQ/ref=sr_1_241?dchild=1&keywords=gaming+chair&qid=1631700257&sr=8-241
"UKing Gaming Chair, Office Chair Desk Chair Swivel Heavy Duty Chair Ergonomic Design with Cushion and Reclining Back Support, Gaming Chair for Adult (Red+Black) (Grey)",£59.99,,,https://www.amazon.co.uk//UKing-Ergonomic-Cushion-Reclining-Support/dp/B09DG9GBKJ/ref=sr_1_242?dchild=1&keywords=gaming+chair&qid=1631700257&sr=8-242
"Gaming Racing Desk Chair Adjustable Racing Breathable Fabric Computer Game Chair with Lumbar Support and Head Pillow PC Chair, Ergonomic Design, Black",£105.99,5.0 out of 5 stars,2,https://www.amazon.co.uk//Adjustable-Breathable-Computer-Support-Ergonomic/dp/B08V1B716N/ref=sr_1_243?dchild=1&keywords=gaming+chair&qid=1631700257&sr=8-243
GTFORCE PRO FX Reclining Sports Racing Gaming Office Desk PC CAR Faux Leather Chair (White with Footrest),£189.99,4.5 out of 5 stars,40,https://www.amazon.co.uk//GTFORCE-Reclining-Sports-Leather-Footrest/dp/B084Z373YS/ref=sr_1_244?dchild=1&keywords=gaming+chair&qid=1631700257&sr=8-244
BraZen Puma Pc Gaming Chairs for Adults Height Adjustable Ergonomic Pu Leather Seat with Armrest - Grey,£135.02,4.3 out of 5 stars,185,https://www.amazon.co.uk//BraZen-18069-Puma-Gaming-Chair-Grey/dp/B07PB3PPWY/ref=sr_1_245?dchild=1&keywords=gaming+chair&qid=1631700257&sr=8-245
"Hadwin Office Gaming Chair,Racing Sports Swivel PC Chair Leather Desk Chair with Padded Armrests,Ergonomic Design Computer Chair for Adults and Kids",£64.99,4.5 out of 5 stars,488,https://www.amazon.co.uk//Hadwin-Leather-Armrests-Ergonomic-Computer/dp/B08FHXQ2J6/ref=sr_1_246?dchild=1&keywords=gaming+chair&qid=1631700257&sr=8-246
"SIHOO Ergonomic Office Desk Chair, Swivel Computer Chair Height Adjustable Mesh Back Executive Home Chair with Lumbar Support, 90° Flip-up Armrest (Grey)",£119.99,4.3 out of 5 stars,"1,398",https://www.amazon.co.uk//SIHOO-Ergonomic-Excutive-Armrests-Adjustable/dp/B0899LSG8X/ref=sr_1_247?dchild=1&keywords=gaming+chair&qid=1631700257&sr=8-247
PLAYSEAT Challenge - Black (EU),£199.00,4.7 out of 5 stars,2015,https://www.amazon.co.uk//Playseat-Challenge-PS4-PS3-Xbox/dp/B009ZELZDS/ref=sr_1_248?dchild=1&keywords=gaming+chair&qid=1631700257&sr=8-248
"X-Rocker Evo Elite 4.1 RGB Gaming Chair with Neo Motion LED Lights, Wireless/Bluetooth Multi-Stereo Speakers, Subwoofer, Vibration, Ergonomic, Faux Leather, Black",£359.99,,,https://www.amazon.co.uk//X-Rocker-Multi-Stereo-Gaming-Vibrant-Lighting/dp/B08BS3TCPC/ref=sr_1_249?dchild=1&keywords=gaming+chair&qid=1631700257&sr=8-249
GTPLAYER Gaming Chair With Bluetooth Speaker Music Video Game Chair Audio Heavy Duty Ergonomic Office Computer Desk Chair GTRACING Series (Blue),£116.99,4.5 out of 5 stars,"2,008",https://www.amazon.co.uk//GTPLAYER-Speakers-Bluetooth-Ergonomic-Multi-Function/dp/B07XSZFRQ4/ref=sr_1_250?dchild=1&keywords=gaming+chair&qid=1631700257&sr=8-250
Homall Gaming Chair Office Desk Chair Swivel Racing Computer Chair Pc Gamer Chair Ergonomic Design Heavy Duty Chair High Back Reclining Chair with Cushion and Back Support (Black),£89.99,4.5 out of 5 stars,242,https://www.amazon.co.uk//gp/slredirect/picassoRedirect.html/ref=pa_sp_btf_aps_sr_pg5_1?ie=UTF8&adId=A0276022390KVW0X0MBDD&url=%2FHomall-Computer-Ergonomic-Reclining-Cushion%2Fdp%2FB08RCQB5K9%2Fref%3Dsr_1_251_sspa%3Fdchild%3D1%26keywords%3Dgaming%2Bchair%26qid%3D1631700257%26sr%3D8-251-spons%26psc%3D1&qualifier=1631700257&id=2022316104583142&widgetName=sp_btf
"mfavour Ergonomic Gaming Chair with Height Adjustment, Headrest Lumbar Support, E-Sports Swivel Chair for Game Playing and Working",£109.99,4.4 out of 5 stars,843,https://www.amazon.co.uk//gp/slredirect/picassoRedirect.html/ref=pa_sp_btf_aps_sr_pg5_1?ie=UTF8&adId=A0821211AD7565V1QAQ8&url=%2Fmfavour-Ergonomic-Adjustment-Headrest-Support%2Fdp%2FB096RKWLB2%2Fref%3Dsr_1_252_sspa%3Fdchild%3D1%26keywords%3Dgaming%2Bchair%26qid%3D1631700257%26sr%3D8-252-spons%26psc%3D1&qualifier=1631700257&id=2022316104583142&widgetName=sp_btf
"AutoFull Gaming Chair Ergonomic Office Chair High Back Racing Computer Chair Pu Leather with Back Support,Thicker Bucket Seat,Adjustable arms and Height,Footrest,Red",£229.99,4.6 out of 5 stars,193,https://www.amazon.co.uk//gp/slredirect/picassoRedirect.html/ref=pa_sp_atf_next_aps_sr_pg6_1?ie=UTF8&adId=A0143727341XD1V1U0501&url=%2FAutoFull-Ergonomic-Computer-Adjustable-Footrest%2Fdp%2FB092DCQW4M%2Fref%3Dsr_1_241_sspa%3Fdchild%3D1%26keywords%3Dgaming%2Bchair%26qid%3D1631700259%26sr%3D8-241-spons%26psc%3D1&qualifier=1631700259&id=5000960392807913&widgetName=sp_atf_next
MARTUNIS Gaming Chair 3D Armrest - Cold Cure Foam Game Chair Seat And Backrest - Rocking Tilt And Recline Mechanism Sports Gaming Seat - PU Leather Office Chair (Black-Blue),£169.99,4.6 out of 5 stars,51,https://www.amazon.co.uk//gp/slredirect/picassoRedirect.html/ref=pa_sp_atf_next_aps_sr_pg6_1?ie=UTF8&adId=A01491192LGNUVIINAGWU&url=%2FMARTUNIS-Gaming-Chair-Armrest-Black-Blue%2Fdp%2FB08PC76V61%2Fref%3Dsr_1_242_sspa%3Fdchild%3D1%26keywords%3Dgaming%2Bchair%26qid%3D1631700259%26sr%3D8-242-spons%26psc%3D1&qualifier=1631700259&id=5000960392807913&widgetName=sp_atf_next
"Wahson Fabric Gaming Chair, Office Chair Ergonomic 2D Armrest PC Computer Game Chair with Headrest and Back Support Racing Style Desk Chair for Adults Executive Chair, 180° Reclining (Pink+Black)",£139.99,4.3 out of 5 stars,29,https://www.amazon.co.uk//Wahson-Computer-Ergonomic-Reclining-Cat-Shape/dp/B07WDHGYYN/ref=sr_1_243?dchild=1&keywords=gaming+chair&qid=1631700259&sr=8-243
"YOURLITEAMZ Racing Gaming Chair with Massage, Office Ergonomic Computer Desk Chair with Padded Footrest Support, Swivel High Back Recliner, High-Adjustable Cushion, PU Leather for Home Office（White）",£145.00,4.4 out of 5 stars,37,https://www.amazon.co.uk//YOURLITEAMZ-Footrest-Ergonomic-Reclining-Computer/dp/B07MZTWYQ4/ref=sr_1_244?dchild=1&keywords=gaming+chair&qid=1631700259&sr=8-244
"IntimaTe WM Heart Fabric Gaming Chair Racing Chair, Computer Chair for Adults, High Office Chair,PU Gaming PC Chair with Headrest&Lumbar Cushion Blue",£89.99,4.3 out of 5 stars,737,https://www.amazon.co.uk//IntimaTe-WM-Heart-Computer-Reclining/dp/B07MD5DMB5/ref=sr_1_245?dchild=1&keywords=gaming+chair&qid=1631700259&sr=8-245
"Mesh Office Chair, Ergonomic Swivel Chair with Adjustable Height, Headrest Wasitrest and Footrest, Tilting Backrest up to 135° (Gray)",£44.99,2.0 out of 5 stars,1,https://www.amazon.co.uk//Ergonomic-Adjustable-Headrest-Wasitrest-Footrest/dp/B097SPLQXL/ref=sr_1_246?dchild=1&keywords=gaming+chair&qid=1631700259&sr=8-246
Vinsetto 6 Point Massage Office Chair Computer Swivel Rolling Task Chair with Retractable Footrest with Heat and Height Adjustable Comfortable with Armrests,£155.99,3.9 out of 5 stars,31,https://www.amazon.co.uk//Vinsetto-Computer-Retractable-Adjustable-Comfortable/dp/B08PP18YWQ/ref=sr_1_247?dchild=1&keywords=gaming+chair&qid=1631700259&sr=8-247
Vinsetto Massage Office Chair 130° Recliner Ergonomic Gaming Seven Point Heated Home Office Padded Linen Fabric & Swivel Base Black,£119.99,4.1 out of 5 stars,157,https://www.amazon.co.uk//Vinsetto-Massage-Office-Recliner-Ergonomic/dp/B07XR6QXD4/ref=sr_1_248?dchild=1&keywords=gaming+chair&qid=1631700259&sr=8-248
"Gaming Chair, Ergonomic Home Office Desk Chairs with Footrest, Games Computer Chairs for Adults & Teenagers, PU Ergonomic Swivel Gaming Chairs with Headrest Cushion and Reclining Back Support",£139.99,4.1 out of 5 stars,8,https://www.amazon.co.uk//Ergonomic-Footrest-Computer-Teenagers-Reclining/dp/B092PRBQNH/ref=sr_1_249?dchild=1&keywords=gaming+chair&qid=1631700259&sr=8-249
"LED Light Chair,Gaming Chair with RGB Light, Ergonomic Design Reclining Swivel chair, PU Leather High Back Office PC Desk Chair with Lumbar Cushion and headrest, Adjustable Armrest (Red)",,1.0 out of 5 stars,1,https://www.amazon.co.uk//Ergonomic-Reclining-Leather-headrest-Adjustable/dp/B0928HXWFJ/ref=sr_1_250?dchild=1&keywords=gaming+chair&qid=1631700259&sr=8-250
JL Comfurni Computer Chair Office Chair Swivel Faux Leather Desk Chair Ergonomic Recliner with Padded Footrest and Lumbar Cushion Height Adjustable -Black,£95.99,3.9 out of 5 stars,387,https://www.amazon.co.uk//JL-Comfurni-Computer-Ergonomic-Adjustable/dp/B07MZSJPRD/ref=sr_1_251?dchild=1&keywords=gaming+chair&qid=1631700259&sr=8-251
"MARTUNIS Game Chair With 4D Armrest - Carbon Fibre Gaming Chair - Gaming Chairs - Desk Chair, Sports Gaming Seat - Reclining PU Leather Office Chair - Swivel Chair with Lumbar and Headrest Pillow",£179.00,4.5 out of 5 stars,70,https://www.amazon.co.uk//MARTUNIS-Game-Chair-Armrest-Reclining/dp/B08MQTH1NT/ref=sr_1_252?dchild=1&keywords=gaming+chair&qid=1631700259&sr=8-252
"eclife Ergonomic Ribbed Leather Office Chair with Tiltable back support, Height adjustment Seat and Comfortable Armrest，Executive Modern Conference Chrome Caster wheel Computer chair",£159.98,3.9 out of 5 stars,58,https://www.amazon.co.uk//eclife-Ergonomic-Office-Ribbed-Leather/dp/B08P6YX7BD/ref=sr_1_253?dchild=1&keywords=gaming+chair&qid=1631700259&sr=8-253
BraZen Stag 2.1 Bluetooth Surround Sound Gaming Chair – White/Black,£179.95,,,https://www.amazon.co.uk//BraZen-Bluetooth-Surround-Sound-Gaming-White/dp/B08WHJ4WQ4/ref=sr_1_254?dchild=1&keywords=gaming+chair&qid=1631700259&sr=8-254
"mfavour Ergonomic Home Office Chair with Unique Mesh Seat, High Back Mesh Office Chair with 3D Armrest and Adjustable Headrest, Elastic S-shaped Lumbar Support",£189.99,4.4 out of 5 stars,183,https://www.amazon.co.uk//gp/slredirect/picassoRedirect.html/ref=pa_sp_mtf_aps_sr_pg6_1?ie=UTF8&adId=A04680002M7HNIFVBD4L2&url=%2Fmfavour-Ergonomic-Computer-Adjustable-Headrest%2Fdp%2FB085WPS75M%2Fref%3Dsr_1_255_sspa%3Fdchild%3D1%26keywords%3Dgaming%2Bchair%26qid%3D1631700259%26sr%3D8-255-spons%26psc%3D1&qualifier=1631700259&id=5000960392807913&widgetName=sp_mtf
"STmeng Liberty T1 Ergonomic Gaming Chair, Computer Office Chair with Back Support, Home Work Desk Chairs with 360° Swivel Adjustable Height PU Leather Armrest Breathable Mesh Padded Seat, Blue",£89.99,4.3 out of 5 stars,"1,918",https://www.amazon.co.uk//gp/slredirect/picassoRedirect.html/ref=pa_sp_mtf_aps_sr_pg6_1?ie=UTF8&adId=A09580542Y03JPE2FVSUM&url=%2FSTmeng-Revolving-Furniture-Adjustable-Essentials%2Fdp%2FB087RCD6CH%2Fref%3Dsr_1_256_sspa%3Fdchild%3D1%26keywords%3Dgaming%2Bchair%26qid%3D1631700259%26sr%3D8-256-spons%26psc%3D1%26smid%3DAZS9IBEDXILR5&qualifier=1631700259&id=5000960392807913&widgetName=sp_mtf
"SNOVIAY Ergonomic Office Chair, Executive Task Mesh Chair High Back Desk Chair with Flip-Up Armrest, Adjustable Headrest, Tilt Function, Lumbar Support and PU Wheels, Swivel Computer Chair (Black)",£145.99,4.3 out of 5 stars,133,https://www.amazon.co.uk//gp/slredirect/picassoRedirect.html/ref=pa_sp_mtf_aps_sr_pg6_1?ie=UTF8&adId=A03793033E0OVKWA0PEGX&url=%2FSNOVIAY-Ergonomic-Executive-Adjustable-Headrest%2Fdp%2FB08DKGWGCX%2Fref%3Dsr_1_257_sspa%3Fdchild%3D1%26keywords%3Dgaming%2Bchair%26qid%3D1631700259%26sr%3D8-257-spons%26psc%3D1&qualifier=1631700259&id=5000960392807913&widgetName=sp_mtf
TIANSHU Gaming Chair Office Chair With Footrest Ergonomic Conference Executive Manager Work Chair Adjustable Height and Lumbar Support(Blue),£79.99,4.2 out of 5 stars,297,https://www.amazon.co.uk//TIANSHU-Ergonomic-Conference-Executive-Adjustable/dp/B082WXXVLK/ref=sr_1_258?dchild=1&keywords=gaming+chair&qid=1631700259&sr=8-258
"Amoiu Office Chair, Ergonomic Computer Chair, Gaming Chair with Swivel Function, Black-Grey",£89.99,4.4 out of 5 stars,354,https://www.amazon.co.uk//Amoiu-Ergonomic-Computer-Function-Black-Grey/dp/B07T65152B/ref=sr_1_259?dchild=1&keywords=gaming+chair&qid=1631700259&sr=8-259
"Trust Gaming GXT 707R Resto Gaming Chair, Full 360 Degrees Rotatable Ergonomic Chair with Removable Cushions, Height Adjustable, Red/Black",£199.00,4.8 out of 5 stars,19,https://www.amazon.co.uk//Trust-Gaming-Resto-Chair-Black/dp/B079FWGHXQ/ref=sr_1_260?dchild=1&keywords=gaming+chair&qid=1631700259&sr=8-260
"HWIN Gaming Chair with Footrest,Ergonomic Office Chair with Arms Reclining Executive Computer Desk Chair with Back and Lumbar Support Comfy PC Swivel Chair (Red)",£69.99,4.4 out of 5 stars,144,https://www.amazon.co.uk//HWIN-Footrest-Ergonomic-Reclining-Executive/dp/B08NVCSJN3/ref=sr_1_261?dchild=1&keywords=gaming+chair&qid=1631700259&sr=8-261
Newskill Takamikura Gaming Chair Blue white,£146.05,4.2 out of 5 stars,"1,390",https://www.amazon.co.uk//Newskill-Takamikura-Gaming-Chair-white/dp/B019HAU9L8/ref=sr_1_262?dchild=1&keywords=gaming+chair&qid=1631700259&sr=8-262
"Hottoby Racing Simulator Stand with Real Seat Adjustable Cockpit Fit for Logitech G25 G27 G29 G920 Gaming Chair Driving Simulator Steering Wheel Fame Gear Shifter Mount, Wheel and Pedals Not Included",,,,https://www.amazon.co.uk//Hottoby-Simulator-Adjustable-Logitech-Steering/dp/B093WQ6VCK/ref=sr_1_263?dchild=1&keywords=gaming+chair&qid=1631700259&sr=8-263
"Vinsetto Office Chair Computer Swivel Rolling Task Recliner for Home with Retractable Footrest, Arm, Grey",£93.49,4.5 out of 5 stars,39,https://www.amazon.co.uk//Vinsetto-Computer-Retractable-Adjustable-Comfortable/dp/B08MVXGQ9K/ref=sr_1_264?dchild=1&keywords=gaming+chair&qid=1631700259&sr=8-264
Gaming Chair 24/7 Seating Ergonomic PC Gamer Racing Chair for Home Office Computer Desk Red & Black - Suitable for Adults and Kids with Swivel Height Adjustment Tilt & Lock PLUS x5 A4 Gaming Prints,,,,https://www.amazon.co.uk//Gaming-Seating-Ergonomic-Racing-Computer/dp/B09CRF1CKT/ref=sr_1_265?dchild=1&keywords=gaming+chair&qid=1631700259&sr=8-265
"Office Chair, FelixKing Ergonomic Desk Chair with Adjustable Height, Swivel Computer Mesh Chair with Lumbar Support and Flip-up Arms, Backrest with Breathable Mesh (Black)",£79.99,4.3 out of 5 stars,644,https://www.amazon.co.uk//FelixKing-Ergonomic-Adjustable-Computer-Breathable/dp/B08MDSQJZL/ref=sr_1_266?dchild=1&keywords=gaming+chair&qid=1631700259&sr=8-266
"Hadwi Racing Style Gaming Chair, Swivel Computer Desk Chair with Adjustable Armrests, PU Leather Ergonomic Adult Office Chair with Headrest & Lumbar Support, Red+Black",£64.99,4.6 out of 5 stars,3,https://www.amazon.co.uk//Hadwi-Computer-Adjustable-Armrests-Ergonomic/dp/B098B4QDB6/ref=sr_1_267?dchild=1&keywords=gaming+chair&qid=1631700259&sr=8-267
SOUTHERN WOLF Racing Gaming Chair Massage Footrest Leather Chairs with Lumbar Support Adjustable Swivel Bluetooth Stereo Surround Speakers,£179.00,4.4 out of 5 stars,17,https://www.amazon.co.uk//SOUTHERN-WOLF-Footrest-Adjustable-Bluetooth/dp/B08YYYL1WH/ref=sr_1_268?dchild=1&keywords=gaming+chair&qid=1631700259&sr=8-268
Yaheetech Ergonomic Gaming Chair Racing Style Office Chair High Back PU Leather Desk Chair Executive Computer Chairs with Lumbar Support,£83.99,4.1 out of 5 stars,533,https://www.amazon.co.uk//Yaheetech-Ergonomic-Leather-Executive-Computer/dp/B088636LDG/ref=sr_1_269?dchild=1&keywords=gaming+chair&qid=1631700259&sr=8-269
"Cedric Office Chair, Breathable Mesh Computer Chair with Ergonomic Adjustable Lumbar Support, White Swivel Desk Chair with Adjustable Armrest and Headrest, Soft Cushion Seat",£212.38,4.2 out of 5 stars,520,https://www.amazon.co.uk//gp/slredirect/picassoRedirect.html/ref=pa_sp_mtf_aps_sr_pg6_1?ie=UTF8&adId=A03247412TV6KR06WK11E&url=%2FCedric-Breathable-Computer-Ergonomic-Adjustable%2Fdp%2FB07SRYBJ6L%2Fref%3Dsr_1_270_sspa%3Fdchild%3D1%26keywords%3Dgaming%2Bchair%26qid%3D1631700259%26sr%3D8-270-spons%26psc%3D1%26smid%3DA30GZKYJJZTB3H&qualifier=1631700259&id=5000960392807913&widgetName=sp_mtf
Von racer Massage Gaming Chair Racing Computer Desk Office Chair Swivel Ergonomic Executive Bonded Leather Chair with Headrest Footrest and Adjustable Armrests (Black),£110.99,4.1 out of 5 stars,39,https://www.amazon.co.uk//gp/slredirect/picassoRedirect.html/ref=pa_sp_mtf_aps_sr_pg6_1?ie=UTF8&adId=A0235918ZRG2GMNVGN9A&url=%2FComputer-Ergonomic-Executive-Headrest-Adjustable%2Fdp%2FB08SW6T5BY%2Fref%3Dsr_1_271_sspa%3Fdchild%3D1%26keywords%3Dgaming%2Bchair%26qid%3D1631700259%26sr%3D8-271-spons%26psc%3D1&qualifier=1631700259&id=5000960392807913&widgetName=sp_mtf
HOMCOM PU Leather Gaming Chair Racing Chair Office Swivel Recliner Ergonomic High Back Executive Seat with Footrest - Red,£106.99,4.2 out of 5 stars,37,https://www.amazon.co.uk//gp/slredirect/picassoRedirect.html/ref=pa_sp_mtf_aps_sr_pg6_1?ie=UTF8&adId=A0790985U69A9X769VFQ&url=%2FHOMCOM-Recliner-Ergonomic-Executive-Footrest%2Fdp%2FB00R14THR0%2Fref%3Dsr_1_272_sspa%3Fdchild%3D1%26keywords%3Dgaming%2Bchair%26qid%3D1631700259%26sr%3D8-272-spons%26psc%3D1&qualifier=1631700259&id=5000960392807913&widgetName=sp_mtf
"VON RACER Gaming Chair with Massager Lumbar Support and Retractible Footrest, High Back Ergonomic Racing Style Computer Leather Executive Office Swivel Chairs Adjustable Armrests and Backrest (Blue)",£120.99,4.5 out of 5 stars,46,https://www.amazon.co.uk//gp/slredirect/picassoRedirect.html/ref=pa_sp_mtf_aps_sr_pg6_1?ie=UTF8&adId=A0996902NWQ4MVMC3I02&url=%2FMassager-Retractible-Ergonomic-Executive-Adjustable%2Fdp%2FB08K8MKHGL%2Fref%3Dsr_1_273_sspa%3Fdchild%3D1%26keywords%3Dgaming%2Bchair%26qid%3D1631700259%26sr%3D8-273-spons%26psc%3D1&qualifier=1631700259&id=5000960392807913&widgetName=sp_mtf
"Mastery Mart Office Chair Base Replacement for Office/Desk/Swivel Chair with Cap, Universal Gas Cylinder Socket and Caster Sockets, 28""(70 cm) Heavy Duty 2200 Lbs/1000 Kg (Matte Black)",,4.7 out of 5 stars,351,https://www.amazon.co.uk//Mastery-Mart-Office-Replacement-Diameter/dp/B07ZY36NJ1/ref=sr_1_274?dchild=1&keywords=gaming+chair&qid=1631700259&sr=8-274
Gaming Chair 24/7 Seating Ergonomic PC Gamer Racing Chair for Home Office Computer Desk Blue & White - Suitable for Adults and Kids with Swivel Height Adjustment Tilt & Lock PLUS x5 A4 Gaming Prints,£134.99,,,https://www.amazon.co.uk//Gaming-Seating-Ergonomic-Racing-Computer/dp/B09CQG3DBL/ref=sr_1_275?dchild=1&keywords=gaming+chair&qid=1631700259&sr=8-275
Amazon Brand - Umi Fabric Gaming Chair Office Desk Computer Chairs Ergonomic Reclining Swivel Rocker High Back Chair with Adjustable headrest and Lumbar Support - White,£109.99,4.1 out of 5 stars,"2,091",https://www.amazon.co.uk//Essentials-Ergonomic-Computer-Adjustable-Headrest/dp/B07DC168ZT/ref=sr_1_276?dchild=1&keywords=gaming+chair&qid=1631700259&sr=8-276
