Description,Price,Ratings,Review Count,URL
FAYEAN Gaming Chair Ergonomic Design Office Chair Adjustable Swivel PU Leather Home Office Computer Desk Chair (05 White),£83.69,4.3 out of 5 stars,506,https://www.amazon.co.uk//FAYEAN-Ergonomic-Racing-Leather-Computer/dp/B07WXG932Y/ref=sr_1_55?dchild=1&keywords=gaming+chair&qid=1631700252&sr=8-55
Hadwin Gaming Chair PC Computer Office Racing Chair with Padded Armrests Ergonomics Desk Chair High Back Leather PC Chair Swivel Office Chair,£66.99,4.3 out of 5 stars,194,https://www.amazon.co.uk//Hadwin-Computer-Armrests-Ergonomics-Leather/dp/B081Z29XBL/ref=sr_1_56?dchild=1&keywords=gaming+chair&qid=1631700252&sr=8-56
"AMINITURE Gaming Chair Racing Style High Back Computer Game Chair Adjustable Reclining Office Chair with Adjustment Recliner, Headrest and Lumbar Support",£76.49,4.5 out of 5 stars,201,https://www.amazon.co.uk//AMINITURE-Computer-Adjustable-Reclining-Adjustment/dp/B08MW73RLD/ref=sr_1_57?dchild=1&keywords=gaming+chair&qid=1631700252&sr=8-57
"Corsair T2 Road Warrior, Faux Leather Gaming Office Chair, Easy Assembly, Ergonomic Swivel, Adjustable Height and 4D Armrests, Comfortable Wide Seat with High Recliner, Black",£306.96,4.3 out of 5 stars,871,https://www.amazon.co.uk//Corsair-Assembly-Ergonomic-Adjustable-Comfortable/dp/B077H83G6C/ref=sr_1_58?dchild=1&keywords=gaming+chair&qid=1631700252&sr=8-58
BraZen Serpent 2.1 Bluetooth Surround Sound Gaming Chair Foldable Pu Leather Seat with Pedestal Base - Red,£163.98,4.4 out of 5 stars,163,https://www.amazon.co.uk//BraZen-Serpent-Bluetooth-Surround-Gaming/dp/B07FWGN5CY/ref=sr_1_59?dchild=1&keywords=gaming+chair&qid=1631700252&sr=8-59
"Office Gaming Chair, NIPEECO Computer Desk Chair With Footrest Ergonomic, With High Back Lumbar Support 360 Degree Swivel Rocking Chair for Home Office Game - Dark Gray",£59.99,,,https://www.amazon.co.uk//NIPEECO-Computer-Footrest-Ergonomic-Support/dp/B099MY6RC9/ref=sr_1_60?dchild=1&keywords=gaming+chair&qid=1631700252&sr=8-60
"AutoFull Gaming Chair Ergonomic Office Chair High Back Racing Computer Chair Pu Leather with back Support,Thicker Bucket Seat,Adjustable arms and Height,Footrest,Brown",£229.99,4.6 out of 5 stars,193,https://www.amazon.co.uk//AutoFull-Ergonomic-Computer-Adjustable-Footrest/dp/B092DF433H/ref=sr_1_61?dchild=1&keywords=gaming+chair&qid=1631700252&sr=8-61
Furmax Gaming Chair Ergonomic Office Chair Racing Style Computer Gamer Chair High-Back Desk Chair Professional Swivel Task Chair Adjustable Height Reclining with Lumbar Support and Headrest (Black),£99.99,4.2 out of 5 stars,58,https://www.amazon.co.uk//Furmax-Ergonomic-High-Back-Professional-Adjustable/dp/B08XY34YMJ/ref=sr_1_62?dchild=1&keywords=gaming+chair&qid=1631700252&sr=8-62
COMHOMA Office Desk Chair with Armrest Office Computer Chairs Ergonomic Conference Executive Manager Work Chair (Black),£75.99,4.2 out of 5 stars,"7,369",https://www.amazon.co.uk//COMHOMA-Computer-Ergonomic-Conference-Executive/dp/B0829R19YZ/ref=sr_1_63?dchild=1&keywords=gaming+chair&qid=1631700252&sr=8-63
"Hbada Ergonomic Desk Chair, Computer Office Chair with Flip-up Armrest&Lumbar Support, Adjustable Height, Black",£119.99,4.1 out of 5 stars,"3,267",https://www.amazon.co.uk//Hbada-Ergonomic-Computer-Flip-up-Adjustable/dp/B084RK941C/ref=sr_1_64?dchild=1&keywords=gaming+chair&qid=1631700252&sr=8-64
Gaming Chair Home Office Chair with Footrest Executive Leather Computer Desk Chair for Bedroom High Back Sport Racing Chair with Armrest&Headrest (Green),£79.99,4.5 out of 5 stars,80,https://www.amazon.co.uk//gp/slredirect/picassoRedirect.html/ref=pa_sp_mtf_aps_sr_pg2_1?ie=UTF8&adId=A049498684CVWCBYH9X3&url=%2FFootrest-Executive-Leather-Computer-Headrest%2Fdp%2FB08L6WC3HD%2Fref%3Dsr_1_65_sspa%3Fdchild%3D1%26keywords%3Dgaming%2Bchair%26qid%3D1631700252%26sr%3D8-65-spons%26psc%3D1&qualifier=1631700252&id=4653382100751640&widgetName=sp_mtf
Yaheetech Gaming Chair High Back Office Computer Chair Adjustable PU Leather Racing Chair with Lumbar Support,£75.99,4.1 out of 5 stars,83,https://www.amazon.co.uk//gp/slredirect/picassoRedirect.html/ref=pa_sp_mtf_aps_sr_pg2_1?ie=UTF8&adId=A05328322PDZVFYKYNTHJ&url=%2FYaheetech-Executive-Adjustable-Ergonomic-Computer%2Fdp%2FB08DCZKPRM%2Fref%3Dsr_1_66_sspa%3Fdchild%3D1%26keywords%3Dgaming%2Bchair%26qid%3D1631700252%26sr%3D8-66-spons%26psc%3D1%26smid%3DA1G7SAFZ32IVOE&qualifier=1631700252&id=4653382100751640&widgetName=sp_mtf
"VON RACER Gaming Chair with Massager Lumbar Support and Retractible Footrest, High Back Ergonomic Racing Style Computer Leather Executive Office Swivel Chairs Adjustable Armrests and Backrest (Grey)",£120.99,4.5 out of 5 stars,46,https://www.amazon.co.uk//gp/slredirect/picassoRedirect.html/ref=pa_sp_mtf_aps_sr_pg2_1?ie=UTF8&adId=A099705824YTLQSG9R8FE&url=%2FMassager-Retractible-Ergonomic-Executive-Adjustable%2Fdp%2FB08K8M9J4N%2Fref%3Dsr_1_67_sspa%3Fdchild%3D1%26keywords%3Dgaming%2Bchair%26qid%3D1631700252%26sr%3D8-67-spons%26psc%3D1&qualifier=1631700252&id=4653382100751640&widgetName=sp_mtf
"Vinsetto Ergonomic Racing Gaming Chair Office Desk Chair Adjustable Height Recliner with Wheels, Headrest,Lumbar Support Retractable Footrest Home Office, White",£90.09,4.6 out of 5 stars,91,https://www.amazon.co.uk//Vinsetto-Ergonomic-Adjustable-Recliner-Retractable/dp/B08BFNBM3V/ref=sr_1_68?dchild=1&keywords=gaming+chair&qid=1631700252&sr=8-68
"EasySMX Gaming Chair Racing Style Armchair Breathable Fabric E-Sports Gamer Chairs, 300Lbs Reclining Adjustable Ergonomic Swivel Waist Tilting Office Desk Chair with Headrest and Retractable Footrest",£139.99,4.0 out of 5 stars,267,https://www.amazon.co.uk//EasySMX-Breathable-Reclining-Adjustable-Retractable/dp/B08K3DSLM4/ref=sr_1_69?dchild=1&keywords=gaming+chair&qid=1631700252&sr=8-69
"X-Rocker Torque 2.1 Gaming Chair with Speakers and Subwoofer, Wireless and Bluetooth Audio with Vibration for PS4, Xbox & Switch, Ergonomic Seat, PU Leather, Black/White/Orange",£199.99,3.9 out of 5 stars,27,https://www.amazon.co.uk//X-Rocker-Pedestal-Vibration-Bluetooth-Wireless/dp/B08FRM36R1/ref=sr_1_70?dchild=1&keywords=gaming+chair&qid=1631700252&sr=8-70
KILLABEE Massage Gaming Chair High Back PU Leather PC Racing Computer Desk Office Swivel Recliner with Retractable Footrest and Adjustable Lumbar Support (Red),£101.14,4.3 out of 5 stars,45,https://www.amazon.co.uk//KILLABEE-Computer-Recliner-Retractable-Adjustable/dp/B08T227ZY2/ref=sr_1_71?dchild=1&keywords=gaming+chair&qid=1631700252&sr=8-71
Millhouse Gaming Racing Desk Chair Adjustable Computer Office Chair Lumbar and Head Pillow Chairs X3681 (Black),£89.99,4.5 out of 5 stars,604,https://www.amazon.co.uk//Millhouse-Gaming-Racing-Adjustable-Computer/dp/B07XJQ2HWH/ref=sr_1_72?dchild=1&keywords=gaming+chair&qid=1631700252&sr=8-72
"BASETBL Gaming Chair,Office Racing Chair With Footrest Pc Gamer Chair Ergonomic Computer Desk Chair With Adjustable Armrest,High Back,Lumbar Support for Adult and Teenagers,150kg（Black）",£129.99,4.5 out of 5 stars,172,https://www.amazon.co.uk//BASETBL-Ergonomic-Adjustable-Teenagers-150kg%EF%BC%88Black%EF%BC%89/dp/B091TRFX4Z/ref=sr_1_73?dchild=1&keywords=gaming+chair&qid=1631700252&sr=8-73
Yaheetech Video Gaming Chairs Ergonomics Computer Game Chair Functional Racing Office Chair High Back Gamer Chairs with Headrest and Lumbar Support,£83.99,4.2 out of 5 stars,299,https://www.amazon.co.uk//Yaheetech-Ergonomics-Computer-Functional-Headrest/dp/B08SW2R68H/ref=sr_1_74?dchild=1&keywords=gaming+chair&qid=1631700252&sr=8-74
"play haha. Ergonomic Gaming Chair Racing Style Office Chair with Bigger High Backrest and cushion Larger armrest (red, With footrest)",£109.99,4.5 out of 5 stars,"1,779",https://www.amazon.co.uk//play-Ergonomic-Backrest-cushion-footrest/dp/B07XXP3FQS/ref=sr_1_75?dchild=1&keywords=gaming+chair&qid=1631700252&sr=8-75
SONGMICS Office Executive Swivel Chair with 76 cm High Back Large Seat and Tilt Function Computer Chair PU Black OBG24BUK,£103.75,4.3 out of 5 stars,862,https://www.amazon.co.uk//SONGMICS-Executive-Function-Computer-OBG24BUK/dp/B0744GQWB3/ref=sr_1_76?dchild=1&keywords=gaming+chair&qid=1631700252&sr=8-76
"Corsair Chair, Black, One",£219.99,,,https://www.amazon.co.uk//Corsair-CF-9010042-UK-Chair-Black-One/dp/B08W1Z13XD/ref=sr_1_77?dchild=1&keywords=gaming+chair&qid=1631700252&sr=8-77
Vinsetto LED Light Racing Chair Ergonomic PU Leather Thick Padding High Back w/Removable Pillows Adjustable Height 5 Wheels 360° Swivel Rocking Gaming Chair White Blue,£110.49,4.4 out of 5 stars,72,https://www.amazon.co.uk//Vinsetto-Ergonomic-Leather-Removable-Adjustable/dp/B08B12MXK8/ref=sr_1_78?dchild=1&keywords=gaming+chair&qid=1631700252&sr=8-78
"SIHOO Ergonomic Office Chair, High back Mesh Chair, Swivel Computer Chair with Adjustable Lumbar Support, Armrests, Head Support, Padded Seat, Black",£129.99,4.2 out of 5 stars,363,https://www.amazon.co.uk//SIHOO-Ergonomic-Adjustable-Breathable-Executive/dp/B08CZQ7DHP/ref=sr_1_79?dchild=1&keywords=gaming+chair&qid=1631700252&sr=8-79
"Gaming Chair - Yoleo Ergonomic Office Gamer Chair High Back, Computer Gaming Chair Backrest & Seat Height Adjustment, Executive Racing Swivel Desk Chair with Lumbar Support & Headrest - Black/Grey",£98.99,4.5 out of 5 stars,525,https://www.amazon.co.uk//gp/slredirect/picassoRedirect.html/ref=pa_sp_mtf_aps_sr_pg2_1?ie=UTF8&adId=A06931311RDOQTSB1ZDJB&url=%2FGaming-Chair-Ergonomic-Adjustment-Executive%2Fdp%2FB08GC23VCM%2Fref%3Dsr_1_80_sspa%3Fdchild%3D1%26keywords%3Dgaming%2Bchair%26qid%3D1631700252%26sr%3D8-80-spons%26psc%3D1%26smid%3DA19X1S4P1KT4Y&qualifier=1631700252&id=4653382100751640&widgetName=sp_mtf
"LUCKRACER Gaming Chair Ergonomic Desk Chair Racing Style Office Computer Chair With High Back Support 360° Swivel 150° Reclining Rocking Function For Children, Teenagers And Adults - BLUE",£79.99,4.5 out of 5 stars,436,https://www.amazon.co.uk//gp/slredirect/picassoRedirect.html/ref=pa_sp_mtf_aps_sr_pg2_1?ie=UTF8&adId=A01680151QGEHOI3BFMKM&url=%2FLUCKRACER-Ergonomic-Cushion-Reclining-Support%2Fdp%2FB085T2JVL5%2Fref%3Dsr_1_81_sspa%3Fdchild%3D1%26keywords%3Dgaming%2Bchair%26qid%3D1631700252%26sr%3D8-81-spons%26psc%3D1&qualifier=1631700252&id=4653382100751640&widgetName=sp_mtf
Furmax Gaming Chair Ergonomic Office Chair Racing Style Computer Gamer Chair High-Back Desk Chair Professional Swivel Task Chair Adjustable Height Reclining with Lumbar Support and Headrest (Black),£99.99,4.2 out of 5 stars,58,https://www.amazon.co.uk//gp/slredirect/picassoRedirect.html/ref=pa_sp_mtf_aps_sr_pg2_1?ie=UTF8&adId=A10085522ZF8TMNWJ43H0&url=%2FFurmax-Ergonomic-High-Back-Professional-Adjustable%2Fdp%2FB08XY34YMJ%2Fref%3Dsr_1_82_sspa%3Fdchild%3D1%26keywords%3Dgaming%2Bchair%26qid%3D1631700252%26sr%3D8-82-spons%26psc%3D1&qualifier=1631700252&id=4653382100751640&widgetName=sp_mtf
play haha. Gaming Chair Racing Style Office Swivel Computer Desk Chair Ergonomic Conference Chair Work Chair with Lumbar Support PU Leatherwith Adjustable Task Chair ，Gas lift SGS tested (Black),£59.99,4.3 out of 5 stars,354,https://www.amazon.co.uk//play-Ergonomic-Conference-Leatherwith-Adjustable/dp/B08FC5LD8B/ref=sr_1_83?dchild=1&keywords=gaming+chair&qid=1631700252&sr=8-83
Furious Gaming Chair Office Desk Chair Ergonomic Swivel Chair Adjustable Computer Chair with Built-in Lumbar Support and Swivel Castors Mesh Chairs Blue,£94.99,4.0 out of 5 stars,17,https://www.amazon.co.uk//Furious-Ergonomic-Adjustable-Computer-Support/dp/B09138ZJ2L/ref=sr_1_84?dchild=1&keywords=gaming+chair&qid=1631700252&sr=8-84
"JR Knight Ergonomic Gaming Chair, Home Office Computer with Lumbar Support, Executive PU Leather Swivel Office Chair with Adjustable Armrests (Black&Blue)",£69.99,4.2 out of 5 stars,400,https://www.amazon.co.uk//JR-Knight-Ergonomic-Executive-Adjustable/dp/B08GX6DLMY/ref=sr_1_85?dchild=1&keywords=gaming+chair&qid=1631700252&sr=8-85
GTFORCE EVO CT Reclining Sports Racing Gaming Office Desk PC CAR Fabric Chair (White),£149.99,4.5 out of 5 stars,184,https://www.amazon.co.uk//GTFORCE-Reclining-Sports-Racing-Gaming/dp/B075XMRP92/ref=sr_1_86?dchild=1&keywords=gaming+chair&qid=1631700252&sr=8-86
Vinsetto Piped PU Leather Padded High-Back Computer Office Gaming Chair Swivel Desk Seat Ergonomic Recliner w/Armrests Adjustable Seat Height Black,£155.99,4.6 out of 5 stars,14,https://www.amazon.co.uk//Vinsetto-High-Back-Computer-Ergonomic-Adjustable/dp/B08MZP32TG/ref=sr_1_87?dchild=1&keywords=gaming+chair&qid=1631700252&sr=8-87
"COMHOMA Executive Office Chair, PU Leather Computer Chair 30° Rocking Chair with Ergonomic Back Support Height Adjustable Comfy Chair with Armrest - Black",£84.99,4.3 out of 5 stars,55,https://www.amazon.co.uk//COMHOMA-Office-Chair-Swivel-Reclining/dp/B086BKMS6Z/ref=sr_1_88?dchild=1&keywords=gaming+chair&qid=1631700252&sr=8-88
"mfavour Gaming Chair High Back, Swivel Racing Style Chair with Lumbar Support and Headrest, Ergonomic Design with Mesh Seat and Reclining Back, Gray",,4.3 out of 5 stars,549,https://www.amazon.co.uk//mfavour-Ergonomic-Reclining-Adjustment-Adjustable/dp/B08DF946NY/ref=sr_1_89?dchild=1&keywords=gaming+chair&qid=1631700252&sr=8-89
KLIM eSports Gaming Chair + Back & Head Support + Ergonomic Computer Chair with Adjustable Armrests + PU Leather + Very Robust Desk Chair + NEW 2021 VERSION Office Chair + Black,£349.97,4.5 out of 5 stars,"1,548",https://www.amazon.co.uk//KLIMTM-Esports-Gaming-Synthetic-Leather/dp/B07F38CB8N/ref=sr_1_90?dchild=1&keywords=gaming+chair&qid=1631700252&sr=8-90
"Vinsetto Gaming Chair with RGB LED Light, 2D Arm, Lumbar Support, Swivel Office Computer Recliner Racing Gamer Desk Chair for Home, White",£159.99,4.8 out of 5 stars,13,https://www.amazon.co.uk//Vinsetto-Gaming-Support-Computer-Recliner/dp/B0967QY5P1/ref=sr_1_91?dchild=1&keywords=gaming+chair&qid=1631700252&sr=8-91
GTRACING Gaming Chair ACE-S1 Series Ergonomic Office Desk Chair With High Back Support And Fully Adjustable 4D Armrest 360° Swivel Rocking Chair (Gray),£149.99,4.3 out of 5 stars,186,https://www.amazon.co.uk//GTRACING-Gaming-Office-Ergonomic-Computer/dp/B08MFM4L5P/ref=sr_1_92?dchild=1&keywords=gaming+chair&qid=1631700252&sr=8-92
"Corsair T1 Race, Faux Leather Racing Gaming Office Chair, Easy Assembly, Ergonomic Swivel, Adjustable Height and 4D Armrests, Comfortable with Recliner, Black/Blue",£249.99,4.4 out of 5 stars,"1,203",https://www.amazon.co.uk//Corsair-Assembly-Ergonomic-Adjustable-Comfortable/dp/B077HCFYRG/ref=sr_1_93?dchild=1&keywords=gaming+chair&qid=1631700252&sr=8-93
"SHA XiaZhi Gaming Chair Racing Style PU Leather High Back Computer Office Chair Ergonomic Design,More advanced 3D Armrest Swivel Recliner with Lumbar Support，Wider Cushions",£129.99,4.4 out of 5 stars,218,https://www.amazon.co.uk//SHA-XiaZhi-Leather-Ergonomic-Adjustable/dp/B088CTF5ZJ/ref=sr_1_94?dchild=1&keywords=gaming+chair&qid=1631700252&sr=8-94
"Reclining Desk Chair Grey,Ergonomic Office Gaming Chair with Armrest&Headrest High Back Computer Chair Comfy Padded Swivel Home Work Chair,Home/Office Furniture.",£48.99,4.0 out of 5 stars,174,https://www.amazon.co.uk//Reclining-Ergonomic-Headrest-Computer-Furniture/dp/B08DFSCMGY/ref=sr_1_95?dchild=1&keywords=gaming+chair&qid=1631700252&sr=8-95
"X-Rocker G-Force Sport Rocker Gaming Chair, 2.1 Audio with Subwoofer, Foldable Floor Seat – Black",£139.99,4.5 out of 5 stars,2020,https://www.amazon.co.uk//X-Rocker-G-Force-Rocker-Subwoofer-Foldable/dp/B08FRLPGGK/ref=sr_1_96?dchild=1&keywords=gaming+chair&qid=1631700252&sr=8-96
"BASETBL Executive Office Chair, Ergonomic Computer Desk Chair, Padded Comfy Gaming Chair, Breathable Manager Work PC Chair, Max Capacity 308lbs (Grey Fabric)",£119.99,4.4 out of 5 stars,23,https://www.amazon.co.uk//BASETBL-Executive-Ergonomic-Computer-Breathable/dp/B095VVSCGY/ref=sr_1_97?dchild=1&keywords=gaming+chair&qid=1631700252&sr=8-97
"Trust Gaming GXT 707 Resto Gaming Chair, Full 360 Degrees Rotatable Ergonomic Chair with Removable Cushions, Height Adjustable, Black",£199.00,4.1 out of 5 stars,335,https://www.amazon.co.uk//Trust-Gaming-GXT-Resto-Chair-Black/dp/B07RZ6PWJ5/ref=sr_1_98?dchild=1&keywords=gaming+chair&qid=1631700252&sr=8-98
"BASETBL Office Desk Chair Racing Style Home Ergonomic Executive Swivel Gaming Computer Chair, Lumbar Support High Back PU Leather Adjustable Height Comfortable Chair Black",£101.99,4.6 out of 5 stars,149,https://www.amazon.co.uk//BASETBL-Ergonomic-Executive-Adjustable-Comfortable/dp/B08S765SGV/ref=sr_1_99?dchild=1&keywords=gaming+chair&qid=1631700252&smid=A1M9MRBED00T8H&sr=8-99
"Trust Gaming GXT 707G Resto Gaming Chair, Full 360 Degrees Rotatable Ergonomic Chair with Removable Cushions, Height Adjustable, Grey/Black",£197.79,4.2 out of 5 stars,354,https://www.amazon.co.uk//Trust-Gaming-22525-Resto-Chair/dp/B079FQJYHH/ref=sr_1_100?dchild=1&keywords=gaming+chair&qid=1631700252&sr=8-100
"Gaming Chair, Ergonomic High Back Racing Chair, Home Office Desk Chair, Adjustable PU Leather Mesh, Computer Chair for Teenagers and Adults (Blue)",£59.99,,,https://www.amazon.co.uk//Ergonomic-Adjustable-Leather-Computer-Teenagers/dp/B09B1SHN2D/ref=sr_1_101?dchild=1&keywords=gaming+chair&qid=1631700252&sr=8-101
JL Comfurni Gaming Chair Racing Computer Chair Office Desk Chair High-Back Gaming Recliner with Footrest Ergonomic Video Chair for adults PU Leather Swivel E-sports Chair Purple,£89.99,4.3 out of 5 stars,905,https://www.amazon.co.uk//JL-Comfurni-Computer-High-Back-Ergonomic/dp/B07WHRS5NS/ref=sr_1_102?dchild=1&keywords=gaming+chair&qid=1631700252&sr=8-102
GT OMEGA PRO Racing Gaming Chair with Lumbar Support - Ergonomic PVC Leather Office Chair with 4D Adjustable Armrest & Recliner - Esport Seat for Ultimate Gaming Experience - Black,£179.95,4.6 out of 5 stars,"1,946",https://www.amazon.co.uk//GT-OMEGA-RACING-OFFICE-LEATHER/dp/B00F1LXXL6/ref=sr_1_103?dchild=1&keywords=gaming+chair&qid=1631700252&sr=8-103
Anda Seat Fnatic Edition Pro Gaming Chair Black & Orange - Premium Ergonomic Office Desk Chairs Leather with Neck and Lumbar Back Support Pillow Gaming Seat - Gaming Chairs for Adults and Teenagers,£349.99,4.4 out of 5 stars,38,https://www.amazon.co.uk//Anda-Seat-Fnatic-Gaming-Orange/dp/B089W7CZ24/ref=sr_1_104?dchild=1&keywords=gaming+chair&qid=1631700252&sr=8-104
TOPSKY All Molded Foam Video Gaming Chair for Home and Office (Black and Gray),£139.99,4.5 out of 5 stars,47,https://www.amazon.co.uk//TOPSKY-Molded-Video-Gaming-Office/dp/B08TH5GBJQ/ref=sr_1_105?dchild=1&keywords=gaming+chair&qid=1631700252&sr=8-105
BraZen Pride 2.1 Bluetooth Gaming Chair Foldable Pu Leather Seat with Speaker and Pedestal Base - Blue,£145.99,4.4 out of 5 stars,394,https://www.amazon.co.uk//BraZen-Soun-Pride-Bluetooth-Surround/dp/B07P9ZVZ33/ref=sr_1_106?dchild=1&keywords=gaming+chair&qid=1631700252&sr=8-106
"Gaming Chair, Adjustable Computer Chair Swivel Racing Computer Chair, Office Chair Pc Gamer Chair Ergonomic Design Heavy Duty Chair High Back Reclining Chair with Cushion and Back Support (Blue)",£59.99,,,https://www.amazon.co.uk//gp/slredirect/picassoRedirect.html/ref=pa_sp_btf_aps_sr_pg2_1?ie=UTF8&adId=A01038962FUVBV78FUK4E&url=%2FAdjustable-Computer-Ergonomic-Reclining-Cushion%2Fdp%2FB09D7PYQQZ%2Fref%3Dsr_1_107_sspa%3Fdchild%3D1%26keywords%3Dgaming%2Bchair%26qid%3D1631700252%26sr%3D8-107-spons%26psc%3D1&qualifier=1631700252&id=4653382100751640&widgetName=sp_btf
"AutoFull Gaming Chair Ergonomic Office Chair High Back Swivel Chair Racing Pu Leather Computer Chair With Arms,Thicker Bucket Seat,Adjustable Height,Headrest And Back Support,Black (3 Year Warranty)",£169.99,4.5 out of 5 stars,768,https://www.amazon.co.uk//gp/slredirect/picassoRedirect.html/ref=pa_sp_btf_aps_sr_pg2_1?ie=UTF8&adId=A0039321382JCQ5FBNOAV&url=%2FAutoFull-Ergonomic-Computer-Adjustable-Headrest%2Fdp%2FB08CCXH4M6%2Fref%3Dsr_1_108_sspa%3Fdchild%3D1%26keywords%3Dgaming%2Bchair%26qid%3D1631700252%26sr%3D8-108-spons%26psc%3D1&qualifier=1631700252&id=4653382100751640&widgetName=sp_btf
"AutoFull Gaming Chair Racing style Ergonomic High-Back office chair with Pu Leather，Adjustable Height and arms,Headrest and Lumbar Support，cyan (3 Year Warranty)",£229.99,4.6 out of 5 stars,105,https://www.amazon.co.uk//gp/slredirect/picassoRedirect.html/ref=pa_sp_atf_next_aps_sr_pg3_1?ie=UTF8&adId=A06461951334Z503EHI5&url=%2FAutoFull-Ergonomic-High-Back-Leather%25EF%25BC%258CAdjustable-Support%25EF%25BC%258Ccyan%2Fdp%2FB08YD81PNV%2Fref%3Dsr_1_97_sspa%3Fdchild%3D1%26keywords%3Dgaming%2Bchair%26qid%3D1631700253%26sr%3D8-97-spons%26psc%3D1%26smid%3DA33NRNS81HOO45&qualifier=1631700253&id=6247904176169027&widgetName=sp_atf_next
"AutoFull Gaming Chair Ergonomic Office Chair High Back Racing Computer Chair Pu Leather with Back Support,Thicker Bucket Seat,Adjustable arms and Height,Footrest,Blue",£229.99,4.6 out of 5 stars,193,https://www.amazon.co.uk//gp/slredirect/picassoRedirect.html/ref=pa_sp_atf_next_aps_sr_pg3_1?ie=UTF8&adId=A01441272J26RSUBT1XIM&url=%2FAutoFull-Ergonomic-Computer-Adjustable-Footrest%2Fdp%2FB092DDKLN3%2Fref%3Dsr_1_98_sspa%3Fdchild%3D1%26keywords%3Dgaming%2Bchair%26qid%3D1631700253%26sr%3D8-98-spons%26psc%3D1&qualifier=1631700253&id=6247904176169027&widgetName=sp_atf_next
KILLABEE Massage Gaming Chair High Back PU Leather PC Racing Computer Desk Office Swivel Recliner with Retractable Footrest and Adjustable Lumbar Support (Grey),£159.99,4.3 out of 5 stars,45,https://www.amazon.co.uk//gp/slredirect/picassoRedirect.html/ref=pa_sp_atf_next_aps_sr_pg3_1?ie=UTF8&adId=A0492093BPSK3TTP70R4&url=%2FKILLABEE-Computer-Recliner-Retractable-Adjustable%2Fdp%2FB08T19VSPQ%2Fref%3Dsr_1_99_sspa%3Fdchild%3D1%26keywords%3Dgaming%2Bchair%26qid%3D1631700253%26sr%3D8-99-spons%26psc%3D1&qualifier=1631700253&id=6247904176169027&widgetName=sp_atf_next
"CO-Z Ergonomic Office Chair with Adjustable Arms and Mesh Back Support, High Back Home Office Desk Chair with Headrest, Reclining Computer Chair with Wheels, PC Gaming Chair for Adults & Teens, Grey",£129.99,,,https://www.amazon.co.uk//gp/slredirect/picassoRedirect.html/ref=pa_sp_atf_next_aps_sr_pg3_1?ie=UTF8&adId=A0470425WRE2SHC5MYTW&url=%2FCO-Z-Ergonomic-Adjustable-Headrest-Reclining%2Fdp%2FB099MXG46Z%2Fref%3Dsr_1_100_sspa%3Fdchild%3D1%26keywords%3Dgaming%2Bchair%26qid%3D1631700253%26sr%3D8-100-spons%26psc%3D1&qualifier=1631700253&id=6247904176169027&widgetName=sp_atf_next
TOPSKY All Molded Foam Video Gaming Chair for Home and Office (Black and Gray),£139.99,4.5 out of 5 stars,47,https://www.amazon.co.uk//TOPSKY-Molded-Video-Gaming-Office/dp/B08TH5GBJQ/ref=sr_1_101?dchild=1&keywords=gaming+chair&qid=1631700253&sr=8-101
BraZen Pride 2.1 Bluetooth Gaming Chair Foldable Pu Leather Seat with Speaker and Pedestal Base - Blue,£145.99,4.4 out of 5 stars,394,https://www.amazon.co.uk//BraZen-Soun-Pride-Bluetooth-Surround/dp/B07P9ZVZ33/ref=sr_1_102?dchild=1&keywords=gaming+chair&qid=1631700253&sr=8-102
Qulomvs Big and Tall Gaming Chair for Adults 400LBS Heavy Duty Computer Massage Video Game Chair Ergonomic PC Racing Gamer Chair Headrest and Lumbar Support (Blue),£169.99,4.1 out of 5 stars,13,https://www.amazon.co.uk//Qulomvs-Massage-Ergonomic-Computer-Headrest/dp/B08FM4YYXW/ref=sr_1_103?dchild=1&keywords=gaming+chair&qid=1631700253&sr=8-103
"Newskill Gaming Chair, Black, 1",£144.95,4.2 out of 5 stars,404,https://www.amazon.co.uk//Newskill-NS1014-Kitsune-Gaming-Chair-Black/dp/B073TYR8QQ/ref=sr_1_104?dchild=1&keywords=gaming+chair&qid=1631700253&sr=8-104
"Zeanus Gaming Chair with Massage Purple, Big and Tall Computer Chair, Gaming Chair for Adults, Ergonomic Gaming Chair with Footrest, Reclining Desk Chair, High Back Racing Chair,E-Sports Gamer Chair",£189.99,4.6 out of 5 stars,286,https://www.amazon.co.uk//Zeanus-Computer-Ergonomic-Footrest-Reclining/dp/B08GK6VYPJ/ref=sr_1_105?dchild=1&keywords=gaming+chair&qid=1631700253&sr=8-105
JL Comfurni Gaming Chair Racing Chair Ergonomic Recliner PC Computer Chair High-Back PU Swivel Office Desk Chair with Adjustable Headrest and Lumbar Support White,£80.99,4.2 out of 5 stars,345,https://www.amazon.co.uk//JL-Comfurni-Ergonomic-High-Back-Adjustable/dp/B07WHWB37M/ref=sr_1_106?dchild=1&keywords=gaming+chair&qid=1631700253&sr=8-106
Yaheetech Gaming Chair High Back Office Computer Chair Adjustable PU Leather Racing Chair with Lumbar Support,£75.99,4.1 out of 5 stars,83,https://www.amazon.co.uk//Yaheetech-Executive-Adjustable-Ergonomic-Computer/dp/B08DCZKPRM/ref=sr_1_107?dchild=1&keywords=gaming+chair&qid=1631700253&sr=8-107
Gaming Chair with Foot Stool Office Executive PU Leather PC Work Seat for E-Sports Comfortable Reclining Seat (Black/Blue),£79.99,4.4 out of 5 stars,32,https://www.amazon.co.uk//Executive-Leather-Sports-Comfortable-Reclining/dp/B08WWH69JQ/ref=sr_1_108?dchild=1&keywords=gaming+chair&qid=1631700253&sr=8-108
"Requena Gaming Chair with Flip-up Armrest, Ergonomic Racing Chair Swivel Office Chair BOC713L (Red-)",£69.99,3.9 out of 5 stars,51,https://www.amazon.co.uk//Requena-Flip-up-Armrest-Ergonomic-BOC713L/dp/B098KBJ2QK/ref=sr_1_109?dchild=1&keywords=gaming+chair&qid=1631700253&sr=8-109
OWAY HOMELIVING Ergonomic Office Chair High Back with Lumber Support Adjustable Desk Chair with Flip-Armrest and Mesh Back for Home Computer Chairs for Adult Black,£84.99,3.9 out of 5 stars,11,https://www.amazon.co.uk//OWAY-HOMELIVING-Ergonomic-Adjustable-Flip-Armrest/dp/B0937G37W1/ref=sr_1_110?dchild=1&keywords=gaming+chair&qid=1631700253&sr=8-110
Yaheetech High Back Gaming Chair PU Leather Ergonomic Office Gaming Chair Adjustable Racing Chair with Headrest and Lumbar Support Neon Blue,£75.99,4.2 out of 5 stars,79,https://www.amazon.co.uk//Yaheetech-Leather-Ergonomic-Headrest-Support/dp/B08SWC1X4S/ref=sr_1_111?dchild=1&keywords=gaming+chair&qid=1631700253&sr=8-111
