Description,Price,Ratings,Review Count,URL
"Razer Iskur-Premium Gaming Integrated Lumbar Support (Desk Office Chair, Multi-Layer Synthetic Leather, Foam, Head Pad, Height Adjustable) Black, one",£349.99,4.3 out of 5 stars,16,https://www.amazon.co.uk//Razer-Iskur-Integrated-Multi-layer-Adjustable/dp/B08WRLRTC5/ref=sr_1_112?dchild=1&keywords=gaming+chair&qid=1631700253&sr=8-112
Gaming Chair Home Office Chair with Footrest Executive Leather Computer Desk Chair for Bedroom High Back Sport Racing Chair with Armrest&Headrest (Blue),£99.99,4.5 out of 5 stars,80,https://www.amazon.co.uk//gp/slredirect/picassoRedirect.html/ref=pa_sp_mtf_aps_sr_pg3_1?ie=UTF8&adId=A049508619N8XJSISS741&url=%2FFootrest-Executive-Leather-Computer-Headrest%2Fdp%2FB08L6HNHG1%2Fref%3Dsr_1_113_sspa%3Fdchild%3D1%26keywords%3Dgaming%2Bchair%26qid%3D1631700253%26sr%3D8-113-spons%26psc%3D1&qualifier=1631700253&id=6247904176169027&widgetName=sp_mtf
"mfavour Ergonomic Gaming Chair Racing Style Leather Computer Chair with Height Adjustment, Adjustable Lumbar and Headrest (Red)",£109.99,4.4 out of 5 stars,331,https://www.amazon.co.uk//gp/slredirect/picassoRedirect.html/ref=pa_sp_mtf_aps_sr_pg3_1?ie=UTF8&adId=A00051112V8LZNUNNUAHJ&url=%2Fmfavour-Leather-Computer-Ergonomic-Adjustable%2Fdp%2FB07NR7ZG38%2Fref%3Dsr_1_114_sspa%3Fdchild%3D1%26keywords%3Dgaming%2Bchair%26qid%3D1631700253%26sr%3D8-114-spons%26psc%3D1&qualifier=1631700253&id=6247904176169027&widgetName=sp_mtf
"EUCO Computer chair,Racing Style Gaming Chair High Back Executive Office Chair Reclining PC Chair with Adjustable Armrest and Lumbar Support Well Padded Ergonomics Desk Chair",£69.99,4.3 out of 5 stars,323,https://www.amazon.co.uk//gp/slredirect/picassoRedirect.html/ref=pa_sp_mtf_aps_sr_pg3_1?ie=UTF8&adId=A0515226B48AHNLQBZCT&url=%2FEUCO-Executive-Reclining-Adjustable-Ergonomics%2Fdp%2FB07TKS4486%2Fref%3Dsr_1_115_sspa%3Fdchild%3D1%26keywords%3Dgaming%2Bchair%26qid%3D1631700253%26sr%3D8-115-spons%26psc%3D1&qualifier=1631700253&id=6247904176169027&widgetName=sp_mtf
"IntimaTe WM Heart Gaming Chair, Fabric Gaming Chair Breathable Racing Office Chair for Bedroom, Ergonomic Swivel High Back Recliner Computer Desk Chair",£88.99,4.2 out of 5 stars,"2,694",https://www.amazon.co.uk//IntimaTe-WM-Heart-Ergonomic-Recliner/dp/B07DK8JC3F/ref=sr_1_116?dchild=1&keywords=gaming+chair&qid=1631700253&sr=8-116
"STmeng Comfort X2P Racing Gaming Chair, Ergonomic Computer Chair, PC Gamer Office Chairs with Back Support, Heavy Duty Footrest Flip-up Armrest Leather for Adults, Capacity 300Kg, Blue",£99.99,4.4 out of 5 stars,11,https://www.amazon.co.uk//STmeng-Footrest-Ergonomic-Recliner-Computer/dp/B087BY36RF/ref=sr_1_117?dchild=1&keywords=gaming+chair&qid=1631700253&sr=8-117
"Vinsetto Racing Gaming Chair with RGB LED Light, Lumbar Support, Swivel Home Office Computer Recliner High Back Gamer Desk Chair, Black Grey",£132.99,,,https://www.amazon.co.uk//Vinsetto-Racing-Support-Computer-Recliner/dp/B09BBM4HTP/ref=sr_1_118?dchild=1&keywords=gaming+chair&qid=1631700253&sr=8-118
Magic Life Desk Chair Ergonomic Office Chair With Adjustable Headrest Filp-up Armrest and Skin-Friendly Mesh Locking 360°Rotation Computer Chair High Back,£89.99,3.8 out of 5 stars,233,https://www.amazon.co.uk//Magic-Life-Adjustable-Skin-Friendly-360%C2%B0Rotation/dp/B08HHXPLYB/ref=sr_1_119?dchild=1&keywords=gaming+chair&qid=1631700253&sr=8-119
"BASETBL Executive Office Chair, Ergonomic Computer Desk Chair, Padded Comfy Gaming Chair, Manager Work PC Chair with Lumbar Support PU Leather, Max Capacity 308lbs",£93.49,4.4 out of 5 stars,152,https://www.amazon.co.uk//BASETBL-Executive-Ergonomic-Computer-Capacity/dp/B08S6ZP8SL/ref=sr_1_120?dchild=1&keywords=gaming+chair&qid=1631700253&sr=8-120
SOUTHERN WOLF Gaming Chair with Bluetooth Speakers Ergonomic Reclining Home Office Chair with Footrest Racing Video Game Chair with Lumbar Massage Support PC Computer Desk Chair for Adult Teens White,£163.00,4.4 out of 5 stars,218,https://www.amazon.co.uk//SOUTHERN-WOLF-Bluetooth-Ergonomic-Reclining/dp/B08SQ1FQFS/ref=sr_1_121?dchild=1&keywords=gaming+chair&qid=1631700253&sr=8-121
"AutoFull Gaming Chair Racing style Ergonomic High-Back office chair with Pu Leather，Adjustable Height and arms,Headrest and Lumbar Support，blue(3 Year Warranty)",£239.99,4.6 out of 5 stars,105,https://www.amazon.co.uk//AutoFull-Ergonomic-High-Back-Leather%EF%BC%8CAdjustable-Support%EF%BC%8Cblue/dp/B08S6VMF9B/ref=sr_1_122?dchild=1&keywords=gaming+chair&qid=1631700253&sr=8-122
Von racer Massage Gaming Chair Racing Computer Desk Office Chair Swivel Ergonomic Executive Bonded Leather Chair with Headrest Footrest and Adjustable Armrests (Black),£110.99,4.1 out of 5 stars,39,https://www.amazon.co.uk//Computer-Ergonomic-Executive-Headrest-Adjustable/dp/B08SW6T5BY/ref=sr_1_123?dchild=1&keywords=gaming+chair&qid=1631700253&sr=8-123
"VON RACER Gaming Chair with Massager Lumbar Support and Retractible Footrest, High Back Ergonomic Racing Style Computer Leather Executive Office Swivel Chairs Adjustable Armrests and Backrest (Black)",£115.99,4.5 out of 5 stars,46,https://www.amazon.co.uk//Massager-Retractible-Ergonomic-Executive-Adjustable/dp/B08K8M93J5/ref=sr_1_124?dchild=1&keywords=gaming+chair&qid=1631700253&sr=8-124
"Hbada Office Chair Desk Chair Flip-up Armrest Ergonomic Task Chair Compact 120° Locking 360° Rotation Seat Surface Lift Reinforced Nylon Resin Base, White",£99.99,4.2 out of 5 stars,"7,353",https://www.amazon.co.uk//Hbada-Flip-up-Ergonomic-Rotation-Reinforced/dp/B07V5184HD/ref=sr_1_125?dchild=1&keywords=gaming+chair&qid=1631700253&sr=8-125
"Gaming Chair, Racing Style Office High Back Ergonomic Conference Work Chair Reclining Computer PC Swivel Desk Chair with Headrest&Lumbar Cushion 170 Degree Reclining Angle (Black2)",£49.99,4.3 out of 5 stars,332,https://www.amazon.co.uk//Ergonomic-Conference-Reclining-Computer-Headrest/dp/B08P1YPQ9Y/ref=sr_1_126?dchild=1&keywords=gaming+chair&qid=1631700253&sr=8-126
"Twomaples Gaming Chair, Ergonomic Office Chairs, Home Games Racing Computer Desk Chairs for Adults & Teenagers, Adjustable Armrest, Height, Angle, 360° Swivel (Black/Blue)",£84.99,4.3 out of 5 stars,291,https://www.amazon.co.uk//Twomaples-Computer-Ergonomic-Backrest-Adjustment/dp/B08LCJYL3R/ref=sr_1_127?dchild=1&keywords=gaming+chair&qid=1631700253&sr=8-127
"REFICCER Office Computer Desk Chairs Comfortable Chaise Bureau- Ergonomic High Back Home Leather Work Swivel Chair with Flip-up Arms, Adjustable Reclining Angle, Lumbar Support and Easy to Assemble",£121.55,4.5 out of 5 stars,59,https://www.amazon.co.uk//gp/slredirect/picassoRedirect.html/ref=pa_sp_mtf_aps_sr_pg3_1?ie=UTF8&adId=A0734758SB1CETJAUOJS&url=%2FREFICCER-Comfortable-Ergonomic-Adjustable-Reclining%2Fdp%2FB0937453T8%2Fref%3Dsr_1_128_sspa%3Fdchild%3D1%26keywords%3Dgaming%2Bchair%26qid%3D1631700253%26sr%3D8-128-spons%26psc%3D1&qualifier=1631700253&id=6247904176169027&widgetName=sp_mtf
"VON RACER Gaming Chair with Massager Lumbar Support and Retractible Footrest, High Back Ergonomic Racing Style Computer Leather Executive Office Swivel Chairs Adjustable Armrests and Backrest (Red)",£120.99,4.5 out of 5 stars,46,https://www.amazon.co.uk//gp/slredirect/picassoRedirect.html/ref=pa_sp_mtf_aps_sr_pg3_1?ie=UTF8&adId=A09968461C80SR7W42ZI6&url=%2FMassager-Retractible-Ergonomic-Executive-Adjustable%2Fdp%2FB08K8JPNJP%2Fref%3Dsr_1_129_sspa%3Fdchild%3D1%26keywords%3Dgaming%2Bchair%26qid%3D1631700253%26sr%3D8-129-spons%26psc%3D1&qualifier=1631700253&id=6247904176169027&widgetName=sp_mtf
"Mastery Mart Ergonomic Office Chair, High Back Mesh Desk Chair with Adjustable Headrest and Backrest, Lumbar Support, Thick Seat Cushion, Swivel Executive Task Computer Chair for Work, Home, Gaming",£149.99,4.0 out of 5 stars,17,https://www.amazon.co.uk//gp/slredirect/picassoRedirect.html/ref=pa_sp_mtf_aps_sr_pg3_1?ie=UTF8&adId=A04848261VDFAYMR450CG&url=%2FErgonomic-Adjustable-Headrest-Backrest-Executive%2Fdp%2FB093PYJF1W%2Fref%3Dsr_1_130_sspa%3Fdchild%3D1%26keywords%3Dgaming%2Bchair%26qid%3D1631700253%26sr%3D8-130-spons%26psc%3D1&qualifier=1631700253&id=6247904176169027&widgetName=sp_mtf
"mfavour Ergonomic Office Chair Computer Mesh Chair with 3D Armrest Office Chair with Lumbar Support Adjustable Headrest Home Office Chair for Study, Work and Gaming",£139.99,4.3 out of 5 stars,79,https://www.amazon.co.uk//mfavour-Ergonomic-Computer-Adjustable-Headrest/dp/B098L5P7JG/ref=sr_1_131?dchild=1&keywords=gaming+chair&qid=1631700253&sr=8-131
"BASETBL Gaming Chair Ergonomic Office Chair, PC Racing Desk Chair with Lumbar Support Adjustable Backrest Headrest and Height, Ideal Swivel Chair for Playing Working-Grey",£108.99,4.5 out of 5 stars,148,https://www.amazon.co.uk//BASETBL-Ergonomic-Adjustable-Backrest-Working-Grey/dp/B08S3W91S1/ref=sr_1_132?dchild=1&keywords=gaming+chair&qid=1631700253&sr=8-132
"Gaming Chair, Adjustable Computer Chair Swivel Racing Computer Chair, Office Chair Pc Gamer Chair Ergonomic Design Heavy Duty Chair High Back Reclining Chair with Cushion and Back Support (Blue)",£59.99,,,https://www.amazon.co.uk//Adjustable-Computer-Ergonomic-Reclining-Cushion/dp/B09D7PYQQZ/ref=sr_1_133?dchild=1&keywords=gaming+chair&qid=1631700253&sr=8-133
LUCKRACER Gaming Chair Massage with footrest Office Chair with Massage Lumbar Support Swivel Chair with Racing Style Armrest PU Leather High Back (Black),£131.99,4.2 out of 5 stars,"2,755",https://www.amazon.co.uk//LUCKRACER-Massage-footrest-Support-Armrest/dp/B084JN259F/ref=sr_1_134?dchild=1&keywords=gaming+chair&qid=1631700253&sr=8-134
"iHaushalt Gaming Chair Racing Style Ergonomic Office Chair Executive Swivel Computer Desk chair with Lumbar Support High Back PU Leather,Adjustable Height Task Armchair",£49.99,3.9 out of 5 stars,13,https://www.amazon.co.uk//iHaushalt-Ergonomic-Executive-Computer-Adjustable/dp/B097MKMYSF/ref=sr_1_135?dchild=1&keywords=gaming+chair&qid=1631700253&sr=8-135
Swivel Office Chair Faux Leather Gaming Racing Computer Desk Chair Model-B (Blue),£49.99,4.5 out of 5 stars,7,https://www.amazon.co.uk//Swivel-Office-Leather-Computer-Model-B/dp/B093TP8Q5Y/ref=sr_1_136?dchild=1&keywords=gaming+chair&qid=1631700253&sr=8-136
"GTPLAYER Gaming Chair,Heavy Duty Gaming Chair with 3D Armrests,Height of Seat Adjustable,Chair with Tiltable High Back,with Headrest and Lumbar Pillow Support(Red)",£109.99,4.6 out of 5 stars,"7,283",https://www.amazon.co.uk//GTPLAYER-Computer-Ergonomic-Adjustable-Warranty/dp/B083BM9BS6/ref=sr_1_137?dchild=1&keywords=gaming+chair&qid=1631700253&sr=8-137
"YITAHOME Executive Office Chair, Ergonomic Desk Chair High Back, Hydrolysis resistant PU Leather Swivel Gaming Computer Chair with Padded Armrest, Adjustable Height for Home Office Desk",£159.99,3.4 out of 5 stars,6,https://www.amazon.co.uk//YITAHOME-Ergonomic-Executive-Computer-Adjustable/dp/B08TBXVFJV/ref=sr_1_138?dchild=1&keywords=gaming+chair&qid=1631700253&sr=8-138
"High Back Recline Gaming Chair Swivel Racing Chair Ergonomic Leather Computer Desk Office Chair Linked Armrest, Adjustable Height, Silent Wheel",£69.99,4.4 out of 5 stars,100,https://www.amazon.co.uk//Recline-Ergonomic-Leather-Computer-Adjustable/dp/B089GSP32X/ref=sr_1_139?dchild=1&keywords=gaming+chair&qid=1631700253&sr=8-139
"SONGMICS Office Chair, Swivel Ergonomic Gaming Chair, Racing Chair with Flip-Up Armrests, Max. Load Capacity 150 kg, for Office, Study, Black and Grey OBG63BGUK",£119.99,4.4 out of 5 stars,398,https://www.amazon.co.uk//SONGMICS-Ergonomic-Foldable-Capacity-150-OBG63BGUK/dp/B07C2S9LFM/ref=sr_1_140?dchild=1&keywords=gaming+chair&qid=1631700253&sr=8-140
"mfavour Ergonomic Office Chair Mesh Office Chair with Adjustable Back Support 3D Armrest, High Back Office Chair with Adjustable Headrest, Ergonomic Chair for Home&Office",£159.99,4.2 out of 5 stars,"1,019",https://www.amazon.co.uk//mfavour-Ergonomic-Adjustable-Headrest-Function/dp/B07P6HYSZR/ref=sr_1_141?dchild=1&keywords=gaming+chair&qid=1631700253&sr=8-141
"PULUOMIS Gaming Chair Office Desk Chair for Adults, Swivel Ergonomic Computer Chair with Footrest, Pillows Lumbar Reclining High Back Support Racing Chair(White)",£135.00,4.4 out of 5 stars,"2,004",https://www.amazon.co.uk//Leather-Ergonomic-Computer-Adjustable-Footrest/dp/B07GNFVXQG/ref=sr_1_142?dchild=1&keywords=gaming+chair&qid=1631700253&sr=8-142
SIHOO Ergonomic Home Office Chair Adjustable Lumbar Support 3D Armrests Computer Desk Chair Breathable Mesh Executive High Back Chair(Black),£229.99,4.5 out of 5 stars,"2,893",https://www.amazon.co.uk//SIHOO-Ergonomic-Skin-Friendly-Breathable-Adjustable/dp/B07GN4H96T/ref=sr_1_143?dchild=1&keywords=gaming+chair&qid=1631700253&sr=8-143
"X-Rocker Stinger eSports RGB LED PC Gaming Chair, Adjustable with Lumbar Support – Black",,3.5 out of 5 stars,2021,https://www.amazon.co.uk//X-Rocker-Stinger-eSports-Adjustable-Support/dp/B08BS5BM9N/ref=sr_1_144?dchild=1&keywords=gaming+chair&qid=1631700253&sr=8-144
"SONGMICS Racing Gaming Chair, Adjustable Office Chair with Footrest, Ergonomic Design, Tilt Mechanism, Headrest, Lumbar Support, 150 kg Weight Capacity, Black and Red OBG073B11",£84.99,4.3 out of 5 stars,22,https://www.amazon.co.uk//SONGMICS-Adjustable-Ergonomic-Mechanism-OBG073B11/dp/B08L917SJ2/ref=sr_1_145?dchild=1&keywords=gaming+chair&qid=1631700253&sr=8-145
"X Rocker Merlin PC Gaming Chair, Faux Leather Racing Seat, High Back Recliner Adjustable Computer Chair with Neck and Lumbar Support - Black/Blue",£199.99,5.0 out of 5 stars,2,https://www.amazon.co.uk//Leather-Recliner-Adjustable-Computer-Support/dp/B07TDVWFZ1/ref=sr_1_146?dchild=1&keywords=gaming+chair&qid=1631700253&sr=8-146
BraZen Stag 2.1 Bluetooth Surround Sound Gaming Chair with Speaker Subwoofer and Pedestal base - White,£111.01,4.3 out of 5 stars,"1,011",https://www.amazon.co.uk//BraZen-Bluetooth-Surround-Sound-Gaming/dp/B07DT27KSD/ref=sr_1_147?dchild=1&keywords=gaming+chair&qid=1631700253&sr=8-147
GTFORCE PRO ST Reclining Sports Racing Gaming Office Desk PC CAR Faux Leather Chair (Grey),£149.99,4.5 out of 5 stars,359,https://www.amazon.co.uk//GTFORCE-Reclining-Sports-Racing-Leather/dp/B075JGPNZN/ref=sr_1_148?dchild=1&keywords=gaming+chair&qid=1631700253&sr=8-148
"Hbada Ergonomic Gaming Chair with Height Adjustment Office Chair with Headrest Lumbar Support E-Sports Swivel Chair with Racing Style PU Leather High Back,GRAY",£139.99,4.3 out of 5 stars,620,https://www.amazon.co.uk//Hbada-Ergonomic-Adjustment-Headrest-Support/dp/B0897KW3TQ/ref=sr_1_149?dchild=1&keywords=gaming+chair&qid=1631700253&sr=8-149
"BraZen Video Game Chairs, Polyurethane, Blue, L x W x H (cm): 74 x 65 x 119",£159.95,4.3 out of 5 stars,75,https://www.amazon.co.uk//BraZen-18071-Puma-Gaming-Chair-Blue/dp/B07P8V1V1L/ref=sr_1_150?dchild=1&keywords=gaming+chair&qid=1631700253&sr=8-150
"Amazon Brand - Umi Ergonomic office chair, Swivelling Mesh Computer Chair with Adjustable Lumbar Support and PU Armrests, Breathable Mesh Back and Padded Seat Desk Chair for work, 150 kg Max Load",£229.99,4.3 out of 5 stars,"1,465",https://www.amazon.co.uk//Ergonomic-Executive-Adjustable-Headrest-Breathable/dp/B081HWKWN6/ref=sr_1_151?dchild=1&keywords=gaming+chair&qid=1631700253&sr=8-151
AKRacing Core Series EX BLACK/RED Gaming Chair,£281.82,4.5 out of 5 stars,138,https://www.amazon.co.uk//AKRACING-Gaming-Stuhl-Core-black-red/dp/B07B448Q6T/ref=sr_1_152?dchild=1&keywords=gaming+chair&qid=1631700253&sr=8-152
"Office Chair, NIPEECO Adjustable Racing Desk Chair Gaming Computer Office Swivel Tilt Chair Office Chair with Headrest and Waist Pad",£59.99,4.5 out of 5 stars,2,https://www.amazon.co.uk//Office-NIPEECO-Adjustable-Computer-Headrest/dp/B09DNX4BQK/ref=sr_1_153?dchild=1&keywords=gaming+chair&qid=1631700253&sr=8-153
YOURLITE Video Gaming Chair Massage with footrest Office Chair with Massage Lumbar Support Swivel Reclining Chair with Racing Style Armrest PU Leather High Back Adjustable Task Chair(Green),£139.00,4.6 out of 5 stars,23,https://www.amazon.co.uk//YOURLITE-Massage-footrest-Reclining-Adjustable/dp/B087RKRRGF/ref=sr_1_154?dchild=1&keywords=gaming+chair&qid=1631700253&sr=8-154
"Vinsetto Ergonomic Racing Gaming Chair Office Desk Chair Adjustable Height Recliner with Wheels, Headrest,Lumbar Support Retractable Footrest Home Office, White",£90.09,4.6 out of 5 stars,91,https://www.amazon.co.uk//gp/slredirect/picassoRedirect.html/ref=pa_sp_btf_aps_sr_pg3_1?ie=UTF8&adId=A04650662JLMRYI996572&url=%2FVinsetto-Ergonomic-Adjustable-Recliner-Retractable%2Fdp%2FB08BFNBM3V%2Fref%3Dsr_1_155_sspa%3Fdchild%3D1%26keywords%3Dgaming%2Bchair%26qid%3D1631700253%26sr%3D8-155-spons%26psc%3D1&qualifier=1631700253&id=6247904176169027&widgetName=sp_btf
"AMINITURE Gaming Chair Racing Style High Back Computer Game Chair Adjustable Reclining Office Chair with Adjustment Recliner, Headrest and Lumbar Support",£76.49,4.5 out of 5 stars,201,https://www.amazon.co.uk//gp/slredirect/picassoRedirect.html/ref=pa_sp_btf_aps_sr_pg3_1?ie=UTF8&adId=A071794521H67UBHMDAGG&url=%2FAMINITURE-Computer-Adjustable-Reclining-Adjustment%2Fdp%2FB08MW73RLD%2Fref%3Dsr_1_156_sspa%3Fdchild%3D1%26keywords%3Dgaming%2Bchair%26qid%3D1631700253%26sr%3D8-156-spons%26psc%3D1&qualifier=1631700253&id=6247904176169027&widgetName=sp_btf
"AutoFull Gaming Chair Ergonomic Office Chair High Back Racing Computer Chair Pu Leather with Back Support,Thicker Bucket Seat,Adjustable arms and Height,Footrest,Black",£229.99,4.6 out of 5 stars,193,https://www.amazon.co.uk//gp/slredirect/picassoRedirect.html/ref=pa_sp_atf_next_aps_sr_pg4_1?ie=UTF8&adId=A0143783PJXL2ANSSSJU&url=%2FAutoFull-Ergonomic-Computer-Adjustable-Footrest%2Fdp%2FB092DTS8CQ%2Fref%3Dsr_1_145_sspa%3Fdchild%3D1%26keywords%3Dgaming%2Bchair%26qid%3D1631700255%26sr%3D8-145-spons%26psc%3D1&qualifier=1631700255&id=5768697219917042&widgetName=sp_atf_next
"CO-Z Ergonomic Office Chair with Adjustable Arms and Mesh Back Support, High Back Home Office Desk Chair with Headrest, Reclining Computer Chair with Wheels, PC Gaming Chair for Adults & Teens, Black",£129.99,,,https://www.amazon.co.uk//gp/slredirect/picassoRedirect.html/ref=pa_sp_atf_next_aps_sr_pg4_1?ie=UTF8&adId=A0415562N5U4TAERREU8&url=%2FCO-Z-Ergonomic-Adjustable-Headrest-Reclining%2Fdp%2FB09B1RRVD2%2Fref%3Dsr_1_146_sspa%3Fdchild%3D1%26keywords%3Dgaming%2Bchair%26qid%3D1631700255%26sr%3D8-146-spons%26psc%3D1&qualifier=1631700255&id=5768697219917042&widgetName=sp_atf_next
"SNOVIAY Ergonomic Drafting Chair, Executive Task Mesh Chair High Back Desk Chair with Flip-Up Armrest, Adjustable Headrest, Tilt Function and Lumbar Support, Swivel Chair (Black-Drafting Chair)",£199.99,4.3 out of 5 stars,133,https://www.amazon.co.uk//gp/slredirect/picassoRedirect.html/ref=pa_sp_atf_next_aps_sr_pg4_1?ie=UTF8&adId=A0379647PHGQYBFDBGUF&url=%2FErgonomic-Drafting-Executive-Adjustable-Black-Drafting%2Fdp%2FB08M3DC4VG%2Fref%3Dsr_1_147_sspa%3Fdchild%3D1%26keywords%3Dgaming%2Bchair%26qid%3D1631700255%26sr%3D8-147-spons%26psc%3D1&qualifier=1631700255&id=5768697219917042&widgetName=sp_atf_next
"AutoFull Gaming Chair Ergonomic Office Chair High Back Swivel Chair Racing Pu Leather Computer Chair With Arms,Thicker Bucket Seat,Adjustable Height,Headrest And Back Support,Blue (3 Year Warranty)",£169.99,4.5 out of 5 stars,768,https://www.amazon.co.uk//gp/slredirect/picassoRedirect.html/ref=pa_sp_atf_next_aps_sr_pg4_1?ie=UTF8&adId=A02219463NCEK49OGJWVE&url=%2FAutoFull-Ergonomic-Computer-Adjustable-Headrest%2Fdp%2FB08DTXS8PG%2Fref%3Dsr_1_148_sspa%3Fdchild%3D1%26keywords%3Dgaming%2Bchair%26qid%3D1631700255%26sr%3D8-148-spons%26psc%3D1&qualifier=1631700255&id=5768697219917042&widgetName=sp_atf_next
"Gaming Chair for Adults with LED/RGB Light,180° Reclining,PU Leather High Back Office PC Computer Chairs with Massage Waist Pillow and Headrest, Adjustable Armrest,Ergonomic Design (Black-Red)",£199.90,5.0 out of 5 stars,1,https://www.amazon.co.uk//Reclining-Computer-Adjustable-Ergonomic-Black-Red/dp/B08ZCT13NG/ref=sr_1_149?dchild=1&keywords=gaming+chair&qid=1631700255&sr=8-149
"X-Rocker Officially Licensed Nintendo Super Mario Gaming Chair, Pedestal Folding Chair with 2.1 Audio Built-In – Mario",£169.99,4.1 out of 5 stars,2010,https://www.amazon.co.uk//X-Rocker-Officially-Licensed-Nintendo-Pedestal/dp/B08FRL1K5Z/ref=sr_1_150?dchild=1&keywords=gaming+chair&qid=1631700255&sr=8-150
"Newskill Gaming Chair, Red, 1",£144.95,4.3 out of 5 stars,273,https://www.amazon.co.uk//Newskill-NS1012-Kitsune-Gaming-Chair-Red/dp/B073TXML63/ref=sr_1_151?dchild=1&keywords=gaming+chair&qid=1631700255&sr=8-151
"STmeng Liberty T1 [Upgraded] Ergonomic Gaming Chair, Office Chair with Back Support, Desk Chairs with Adjustable Height, Breathable PU Leather Padded Seat Armrest for Home Work Computer, Grey",£109.99,4.5 out of 5 stars,16,https://www.amazon.co.uk//STmeng-Liberty-Ergonomic-Gaming-Office/dp/B096X59N8Q/ref=sr_1_152?dchild=1&keywords=gaming+chair&qid=1631700255&sr=8-152
"Office Chairs for Home,Desk Ergonomic Office Chair with Folding and breathable Mesh Back Adjustable Height Flip-up Arms Back Lumbar Support Comfortable Save Space for Office Home Bedroom, Black",£79.99,4.4 out of 5 stars,70,https://www.amazon.co.uk//Ergonomic-Folding-breathable-Adjustable-Comfortable/dp/B091SPVNYZ/ref=sr_1_153?dchild=1&keywords=gaming+chair&qid=1631700255&sr=8-153
mfavour Ergonomic Office Chair Back Support Desk Chair Adjustable Executive Mesh Chair Armrest Headrest Swivel Home Office Chair with Wheels for Work,£129.99,4.3 out of 5 stars,338,https://www.amazon.co.uk//mfavour-Ergonomic-Adjustable-Executive-Headrest/dp/B0922W1QFM/ref=sr_1_154?dchild=1&keywords=gaming+chair&qid=1631700255&sr=8-154
"YOURLITEAMZ Computer Gaming Chair with Footrest, High Back Swivel Office Desk Chairs with Lumbar Support, Ergonomic Design with Cushion, PU Leather Grey",£139.00,4.5 out of 5 stars,"1,283",https://www.amazon.co.uk//Video-Gaming-Chair-Racing-Office/dp/B07FDYHQNN/ref=sr_1_155?dchild=1&keywords=gaming+chair&qid=1631700255&sr=8-155
"Focuseat Gaming Chair Ergonomic Office Chair with Headrest and Lumbar Support, 3D Soft Arm Rest, PU Leather, Adjustable Height Swivel Computer Chairs with Seat Lock, Racing Gamer Chair for Adults",£179.99,4.6 out of 5 stars,3,https://www.amazon.co.uk//Focuseat-Ergonomic-Headrest-Adjustable-Computer/dp/B08X23N338/ref=sr_1_156?dchild=1&keywords=gaming+chair&qid=1631700255&sr=8-156
Tervo Ergonomic Office Chair | Foldable & Adjustable Height | Desk Chairs for Home Work or Gaming | Computer Chair with Back Support | Black & White Design,£144.99,,Only 15 left in stock.,https://www.amazon.co.uk//Tervo-Ergonomic-Foldable-Adjustable-Computer/dp/B0965KXRQF/ref=sr_1_157?dchild=1&keywords=gaming+chair&qid=1631700255&sr=8-157
YITAHOME Gaming Chair Big and Tall Computer Chair PU Leather Ergonomic High Back Swivel Desk Chair with Lumbar Support Adjustable Headrest Gamer Chair,£179.99,4.0 out of 5 stars,24,https://www.amazon.co.uk//YITAHOME-Computer-Ergonomic-Adjustable-Headrest/dp/B08N4N3XKH/ref=sr_1_158?dchild=1&keywords=gaming+chair&qid=1631700255&sr=8-158
"Centurion Black Fabric Gaming/Office Chair – Ergonomic design custom headrest pillow, integrated lumbar support, lumbar pillow, 4D adjustable armrests & recliner, steel base and class 4 gas lift",£199.99,3.9 out of 5 stars,31,https://www.amazon.co.uk//Centurion-Black-Fabric-Gaming-Office/dp/B08XM5ZTLW/ref=sr_1_159?dchild=1&keywords=gaming+chair&qid=1631700255&sr=8-159
"Gaming Chair, Racing Style Office High Back Ergonomic Conference Work Chair Reclining Computer PC Swivel Desk Chair with Lumbar Support&Adjustable Task Gas lift PU Leather (Red)",£45.99,4.5 out of 5 stars,602,https://www.amazon.co.uk//Ergonomic-Conference-Reclining-Computer-Adjustable/dp/B086GJKGJV/ref=sr_1_160?dchild=1&keywords=gaming+chair&qid=1631700255&sr=8-160
"AutoFull Gaming Chair Racing style Ergonomic High-Back office chair with Pu Leather，Adjustable Height and arms,Headrest and Lumbar Support，green (3 Year Warranty)",£229.99,4.6 out of 5 stars,105,https://www.amazon.co.uk//gp/slredirect/picassoRedirect.html/ref=pa_sp_mtf_aps_sr_pg4_1?ie=UTF8&adId=A023113028CIPHXJAY7K5&url=%2FAutoFull-Ergonomic-High-Back-Leather%25EF%25BC%258CAdjustable-Support%25EF%25BC%258Cgreen%2Fdp%2FB08YD54GRG%2Fref%3Dsr_1_161_sspa%3Fdchild%3D1%26keywords%3Dgaming%2Bchair%26qid%3D1631700255%26sr%3D8-161-spons%26psc%3D1%26smid%3DA33NRNS81HOO45&qualifier=1631700255&id=5768697219917042&widgetName=sp_mtf
AMINITURE Camouflage Gaming Chair Racing Style Ergonomic Computer Games Chairs Adjustable Armrest High Back PC Office Desk Chair Swivel Task Chair,£125.99,5.0 out of 5 stars,2,https://www.amazon.co.uk//gp/slredirect/picassoRedirect.html/ref=pa_sp_mtf_aps_sr_pg4_1?ie=UTF8&adId=A03999303PZF9B069H2IA&url=%2FAMINITURE-Camouflage-Ergonomic-Computer-Adjustable%2Fdp%2FB095HHRNM4%2Fref%3Dsr_1_162_sspa%3Fdchild%3D1%26keywords%3Dgaming%2Bchair%26qid%3D1631700255%26sr%3D8-162-spons%26psc%3D1&qualifier=1631700255&id=5768697219917042&widgetName=sp_mtf
bigzzia Gaming Chair Office Chair Desk Chair Swivel Heavy Duty Chair Ergonomic Design with Cushion and Reclining Back Support (Blue and Black),£86.99,4.0 out of 5 stars,"1,066",https://www.amazon.co.uk//gp/slredirect/picassoRedirect.html/ref=pa_sp_mtf_aps_sr_pg4_1?ie=UTF8&adId=A0408150RWAR2AI4KMHR&url=%2Fbigzzia-Ergonomic-Cushion-Reclining-Support%2Fdp%2FB08D9N9T59%2Fref%3Dsr_1_163_sspa%3Fdchild%3D1%26keywords%3Dgaming%2Bchair%26qid%3D1631700255%26sr%3D8-163-spons%26psc%3D1&qualifier=1631700255&id=5768697219917042&widgetName=sp_mtf
GTFORCE PRO FX Reclining Sports Racing Gaming Office Desk PC CAR Faux Leather Chair (Blue),£149.99,4.4 out of 5 stars,106,https://www.amazon.co.uk//JL-Video-Game-Chair-Leather/dp/B06WW6DT9F/ref=sr_1_164?dchild=1&keywords=gaming+chair&qid=1631700255&sr=8-164
