Description,Price,Ratings,Review Count,URL
"Wireless Headphones, Tiksounds Bluetooth Headphones with Microphone, IPX7 Waterproof, HI-FI Stereo earphones, 150H Playtime with Charging Case, LED Display for Work/Sports/Game",£25.99,4.2 out of 5 stars,"14,211",https://www.amazon.co.uk//gp/slredirect/picassoRedirect.html/ref=pa_sp_atf_aps_sr_pg1_1?ie=UTF8&adId=A07273173LQXV24UTRIU3&url=%2FWireless-Headphones-Charging-Immersive-Waterproof-Black%2Fdp%2FB08B3QSV16%2Fref%3Dsr_1_1_sspa%3Fdchild%3D1%26keywords%3Dheadphones%26qid%3D1631700189%26sr%3D8-1-spons%26psc%3D1&qualifier=1631700189&id=5538043244955493&widgetName=sp_atf
"JBL Tune 225 TWS In-Ear Earphones - True wireless headphones with up to 25 hours of battery life with charging case, feel the music with JBL Pure Bass sound, in black",£59.00,4.2 out of 5 stars,"1,583",https://www.amazon.co.uk//gp/slredirect/picassoRedirect.html/ref=pa_sp_atf_aps_sr_pg1_1?ie=UTF8&adId=A1007574KGD2Y361Q5H5&url=%2FJBL-Tune-225-Ear-Earphones-Black%2Fdp%2FB086WZWJMQ%2Fref%3Dsr_1_2_sspa%3Fdchild%3D1%26keywords%3Dheadphones%26qid%3D1631700189%26sr%3D8-2-spons%26psc%3D1&qualifier=1631700189&id=5538043244955493&widgetName=sp_atf
Sony MDR-ZX110 Overhead Headphones - Black,£12.65,4.5 out of 5 stars,"6,965",https://www.amazon.co.uk//Sony-MDRZX110B-AE-Headphones-Black/dp/B00NBR70DO/ref=sr_1_3?dchild=1&keywords=headphones&qid=1631700189&sr=8-3
"DOQAUS Bluetooth Headphones Over Ear, [52 Hrs Playtime] Wireless Headphones, 3 EQ Modes, Foldable Hi-Fi Stereo Bass Headphones, Soft Memory Protein Earmuffs, Built-in Mic ＆ Wired Mode for Phone/PC/TV",£28.04,4.5 out of 5 stars,"16,929",https://www.amazon.co.uk//DOQAUS-Bluetooth-Headphones-Playtime-Microphone-Black/dp/B07Q1YXVWH/ref=sr_1_4?dchild=1&keywords=headphones&qid=1631700189&smid=AC7NJ3WE5HQ1K&sr=8-4
"Sony WH-CH710N Noise Cancelling Wireless Headphones with 35 hours Battery Life, Quick Charge, Built-in Mic and Voice Assistant - Black",£79.00,4.4 out of 5 stars,"1,670",https://www.amazon.co.uk//Sony-WH-CH710N-Cancelling-Headphones-Assistant-Black/dp/B086LLYK4S/ref=sr_1_5?dchild=1&keywords=headphones&qid=1631700189&sr=8-5
"Sony ZX310AP On-Ear Headphones Compatible with Smartphones, Tablets and MP3 Devices - Metallic Black",£14.99,4.5 out of 5 stars,"7,365",https://www.amazon.co.uk//Sony-ZX310AP-Headphones-Compatible-Smartphones-Metallic-Black/dp/B00I3LV336/ref=sr_1_6?dchild=1&keywords=headphones&qid=1631700189&sr=8-6
"Amazon Brand – Umi Bluetooth 5.0 IPX7 W5s True Wireless Earbud Headphones for iPhone, Samsung, Huawei with Patented Intelligent Metal Charging Case (Grey)",£29.99,4.2 out of 5 stars,"21,697",https://www.amazon.co.uk//gp/slredirect/picassoRedirect.html/ref=pa_sp_mtf_aps_sr_pg1_1?ie=UTF8&adId=A06334213Q585C9837TC6&url=%2FUMI-Bluetooth-headphones-earphones-intelligent-GREY%2Fdp%2FB07N428SG9%2Fref%3Dsr_1_7_sspa%3Fdchild%3D1%26keywords%3Dheadphones%26qid%3D1631700189%26sr%3D8-7-spons%26psc%3D1&qualifier=1631700189&id=5538043244955493&widgetName=sp_mtf
"60 Hrs Wireless Headphones Over Ear, Hi-Fi Stereo Rechargeable Headset, Foldable Wired/Wireless USB Headset, Soft Memory Protein Earmuffs for Prolonged Wearing, Built-in Mic, Volume Control, Phone PC",£9.99,4.4 out of 5 stars,18,https://www.amazon.co.uk//gp/slredirect/picassoRedirect.html/ref=pa_sp_mtf_aps_sr_pg1_1?ie=UTF8&adId=A10111543FKP4GPJHUB7R&url=%2FWireless-Headphones-Rechargeable-Foldable-Prolonged-1-Black%2Fdp%2FB09985XQYJ%2Fref%3Dsr_1_8_sspa%3Fdchild%3D1%26keywords%3Dheadphones%26qid%3D1631700189%26sr%3D8-8-spons%26psc%3D1&qualifier=1631700189&id=5538043244955493&widgetName=sp_mtf
"Sony WH-CH510 Wireless Bluetooth Headphones with Mic, 35 Hours Battery Life with Quick Charge, On-ear Style, Hands-Free Call, Voice Assistant - Black",£32.84,4.6 out of 5 stars,"9,099",https://www.amazon.co.uk//Sony-Wh-CH510-Headphones-Hands-Free-Assistant-black/dp/B07WD58H6R/ref=sr_1_9?dchild=1&keywords=headphones&qid=1631700189&sr=8-9
OneOdio Wired Over Ear Headphones Hi-Fi Sound & Bass Boosted headphone with 50mm Neodymium Drivers and 1/4 to 3.5mm Audio Jack for Studio DJ AMP Recording Monitoring Phones Laptop (Red),£34.99,4.5 out of 5 stars,"31,392",https://www.amazon.co.uk//OneOdio-Headphones-Lightweight-Shareport-Monitoring-Red/dp/B07K776ZK6/ref=sr_1_10?dchild=1&keywords=headphones&qid=1631700189&sr=8-10
"6S Wireless Headphones Over Ear, [52 Hrs Playtime] Hi-Fi Stereo Foldable Wireless Stereo Headsets Earbuds with Built-in Mic,Volume Control, FM (Black & Gold)",£16.14,4.3 out of 5 stars,"18,712",https://www.amazon.co.uk//Wireless-Headphones-Foldable-Headsets-Earbuds-Black-Gold/dp/B07T1KZQV9/ref=sr_1_11?dchild=1&keywords=headphones&qid=1631700189&smid=ATS3YKW45E415&sr=8-11
"Anker Soundcore Life Q20 Hybrid Active Noise Cancelling Headphones, Wireless Over Ear Bluetooth Headphones, 40H Playtime, Hi-Res Audio, Deep Bass, Memory Foam Ear Cups, for Travel, Home Office",£39.99,4.5 out of 5 stars,"3,769",https://www.amazon.co.uk//Soundcore-Bluetooth-Headphones-Cancellation-Playtime-Black/dp/B07NM3RSRQ/ref=sr_1_12?dchild=1&keywords=headphones&qid=1631700189&sr=8-12
"Betron HD1000 Headphones, On Ear Headphones,Bass Driven Sound With Powerful Acoustics and Enhanced Clarity, Includes 3.5mm Gold Plated Connector",£19.99,4.3 out of 5 stars,"2,732",https://www.amazon.co.uk//gp/slredirect/picassoRedirect.html/ref=pa_sp_mtf_aps_sr_pg1_1?ie=UTF8&adId=A0822396R638ZMVXSBA4&url=%2FBetron-HD1000-Headphones-Driven-players-Black-Golden%2Fdp%2FB016LJ90AY%2Fref%3Dsr_1_13_sspa%3Fdchild%3D1%26keywords%3Dheadphones%26qid%3D1631700189%26sr%3D8-13-spons%26psc%3D1&qualifier=1631700189&id=5538043244955493&widgetName=sp_mtf
"Beats Studio3 Wireless Noise Cancelling Over-Ear Headphones - Apple W1 Headphone Chip, Class 1 Bluetooth, Active Noise Cancelling, 22 Hours Of Listening Time - Defiant Black-Red",£189.95,4.6 out of 5 stars,"4,964",https://www.amazon.co.uk//Beats-Studio3-Wireless-Cancelling-Headphones/dp/B085297N3J/ref=sr_1_14?dchild=1&keywords=headphones&qid=1631700189&sr=8-14
"Soundcore by Anker Life Q30 Hybrid Active Noise Cancelling Headphones with Multiple Modes, Hi-Res Sound, Custom EQ via App, 40H Playtime, Comfortable Fit, Bluetooth Headphones, Connect to 2 Devices",£79.31,4.6 out of 5 stars,"2,788",https://www.amazon.co.uk//Soundcore-Cancelling-Headphones-Multiple-Bluetooth-Black/dp/B08HMWZBXC/ref=sr_1_15?dchild=1&keywords=headphones&qid=1631700189&sr=8-15
"OneOdio A70 Bluetooth Headphones Over Ear, 50 Hrs Playtime, Stereo Wireless＆Wired Headset with CVC6.0 Mic, Professional Studio Monitor Mixing Headphones for TV/PC/Phone",£35.99,4.5 out of 5 stars,"2,742",https://www.amazon.co.uk//OneOdio-Bluetooth-Headphones-Professional-Monitoring/dp/B07MQSFW9R/ref=sr_1_16?dchild=1&keywords=headphones&qid=1631700189&sr=8-16
"Beats Solo3 Wireless On-Ear Headphones - Apple W1 Headphone Chip, Class 1 Bluetooth, 40 Hours Of Listening Time - Rose Gold (Latest Model)",£134.99,4.7 out of 5 stars,"8,895",https://www.amazon.co.uk//Beats-Solo3-Wireless-Ear-Headphones/dp/B07YVXR5ML/ref=sr_1_17?dchild=1&keywords=headphones&qid=1631700189&sr=8-17
"Artix CL750 Foldable Noise Isolating On Ear Headphones Wired with Microphone and Volume Control, Stereo Head Phones Corded with Adjustable Headband for Computer, Laptop and Cell Phone (Turquoise)",£23.99,4.4 out of 5 stars,"5,726",https://www.amazon.co.uk//gp/slredirect/picassoRedirect.html/ref=pa_sp_mtf_aps_sr_pg1_1?ie=UTF8&adId=A07852641IEI2CAAQW7YH&url=%2FIsolating-Headphones-Microphone-Adjustable-Turquoise%2Fdp%2FB087JWTWF9%2Fref%3Dsr_1_18_sspa%3Fdchild%3D1%26keywords%3Dheadphones%26qid%3D1631700189%26sr%3D8-18-spons%26psc%3D1&qualifier=1631700189&id=5538043244955493&widgetName=sp_mtf
"Bluetooth Headphones Over-Ear, Zihnic Foldable Wireless and Wired Stereo Headset Micro SD/TF, FM for Phones/Samsung/Pads/PC,Comfortable Earmuffs &Light weight for Prolonged Wearing (Rose Gold)",£19.99,4.5 out of 5 stars,"13,351",https://www.amazon.co.uk//zihnic-Bluetooth-Over-Ear-Headphones-Prolonged/dp/B07K1T1WWF/ref=sr_1_19?dchild=1&keywords=headphones&qid=1631700189&sr=8-19
"Bose 741158-0020 SoundLink Around-Ear Wireless Bluetooth Headphones II - White, 19.1 cm*3.8 cm*15.2 cm",£158.50,4.7 out of 5 stars,"6,458",https://www.amazon.co.uk//Bose-SoundLink-Around-Ear-Bluetooth-Headphones/dp/B0117RGD0K/ref=sr_1_20?dchild=1&keywords=headphones&qid=1631700189&sr=8-20
"Sony WH-XB900N Extra Bass Noise Cancelling Wireless Bluetooth Headphones with Mic, 30 Hours Battery Life and Quick Charge - Optimized For Google Assistant and Alexa – Black",£123.82,4.6 out of 5 stars,"3,723",https://www.amazon.co.uk//Sony-Wh-XB900N-Wireless-Cancelling-Headphones-Black/dp/B07RVC23SG/ref=sr_1_21?dchild=1&keywords=headphones&qid=1631700189&sr=8-21
"Prtukyt Wireless Headphones Over Ear, [52 Hrs Playtime] Bluetooth Headphones, 6EQ Modes, Foldable Bluetooth Headset Built-in Mic, Soft Memory Earmuffs for TV/PC/Phones",£18.99,4.5 out of 5 stars,"3,182",https://www.amazon.co.uk//Wireless-Headphones-Playtime-Bluetooth-Foldable-Grey/dp/B08ND51MX8/ref=sr_1_22?dchild=1&keywords=headphones&qid=1631700189&sr=8-22
GRADO SR225x Prestige Series Wired Open-Back Stereo Headphones,£249.00,4.9 out of 5 stars,11,https://www.amazon.co.uk//gp/slredirect/picassoRedirect.html/ref=pa_sp_atf_next_aps_sr_pg2_1?ie=UTF8&adId=A02980653DD7WX1WOP91J&url=%2FGRADO-SR225x-Prestige-Open-Back-Headphones%2Fdp%2FB091G6N36N%2Fref%3Dsr_1_17_sspa%3Fdchild%3D1%26keywords%3Dheadphones%26qid%3D1631700190%26sr%3D8-17-spons%26psc%3D1%26smid%3DAVNA8R0KZ1BC&qualifier=1631700190&id=3891270511219960&widgetName=sp_atf_next
"zihnic Wireless Over-Ear Headset with Deep Bass, Bluetooth and Wired Stereo Headphones Buit in Mic for Cell Phone, TV, PC,Soft Earmuffs &Light Weight for Prolonged Wearing (Black/Blue)",£19.99,4.5 out of 5 stars,"13,351",https://www.amazon.co.uk//gp/slredirect/picassoRedirect.html/ref=pa_sp_atf_next_aps_sr_pg2_1?ie=UTF8&adId=A08896508LLKT13GJDQO&url=%2Fzihnic-Wireless-Bluetooth-Headphones-Prolonged%2Fdp%2FB07K1TSSVK%2Fref%3Dsr_1_18_sspa%3Fdchild%3D1%26keywords%3Dheadphones%26qid%3D1631700190%26sr%3D8-18-spons%26psc%3D1&qualifier=1631700190&id=3891270511219960&widgetName=sp_atf_next
"Sennheiser HD 560S, Open back reference-grade headphones for audio enthusiasts, Over Ear , Black",£169.00,4.7 out of 5 stars,349,https://www.amazon.co.uk//Sennheiser-HD-560S-reference-grade-enthusiasts-Black/dp/B08HNFV61M/ref=sr_1_19?dchild=1&keywords=headphones&qid=1631700190&sr=8-19
"Wireless Headphones, Tiksounds Bluetooth Headphones with Microphone, IPX7 Waterproof, HI-FI Stereo earphones, 150H Playtime with Charging Case, LED Display for Work/Sports/Game",£25.99,4.2 out of 5 stars,"14,211",https://www.amazon.co.uk//Wireless-Headphones-Charging-Immersive-Waterproof-Black/dp/B08B3QSV16/ref=sr_1_20?dchild=1&keywords=headphones&qid=1631700190&sr=8-20
JBL T500BT in Black – Over Ear Bluetooth Wireless Headphones with Pure Bass Sound – Headset with Built-In Remote / Microphone,£29.99,4.6 out of 5 stars,"37,274",https://www.amazon.co.uk//JBL-T500BT-Black-Headphones-Built/dp/B07HGG85HL/ref=sr_1_21?dchild=1&keywords=headphones&qid=1631700190&sr=8-21
"Blukar Earphones, In-Ear Headphones Earphones High Sensitivity Microphone – Noise Isolating, High Definition, Pure Sound for iPhone, iPad, Smartphone, MP3 Players etc.",£8.99,4.3 out of 5 stars,"17,782",https://www.amazon.co.uk//Earphones-Blukar-Headphones-Sensitivity-Microphone-Silver/dp/B07QLWMDLC/ref=sr_1_22?dchild=1&keywords=headphones&qid=1631700190&sr=8-22
"Artix CL750 Foldable Noise Isolating On Ear Headphones Wired with Microphone and Volume Control, Stereo Head Phones Corded with Adjustable Headband for Computer, Laptop and Cell Phone (Black/Red)",£23.99,4.4 out of 5 stars,"5,726",https://www.amazon.co.uk//gp/slredirect/picassoRedirect.html/ref=pa_sp_mtf_aps_sr_pg2_1?ie=UTF8&adId=A09883362FII5Q85QKHN9&url=%2FFoldable-Isolating-Headphones-Microphone-Adjustable-Black-Red%2Fdp%2FB087JW59FX%2Fref%3Dsr_1_23_sspa%3Fdchild%3D1%26keywords%3Dheadphones%26qid%3D1631700190%26sr%3D8-23-spons%26psc%3D1&qualifier=1631700190&id=3891270511219960&widgetName=sp_mtf
"Judneer Wireless Headphones, Bluetooth Earbuds Sport 5.0 In-Ear with HD Mic, Wireless Earbuds 56H Playtime, HiFi Stereo Sound, Charging Case with LED Display, IPX7, CVC8.0 Noise Cancelling for Gym",£24.99,4.1 out of 5 stars,"1,857",https://www.amazon.co.uk//Judneer-Wireless-Headphones-Bluetooth-Cancelling-New-Model/dp/B08GCKNQFR/ref=sr_1_24?dchild=1&keywords=headphones&qid=1631700190&sr=8-24
"Hi-Res Extra Bass Earbuds Noise Isolating In-Ear Headphones Wired Earbuds with Microphone for iPhone, iPod, iPad, MP3, HUAWEI, Samsung, Lightweight Earphones with Volume Control 3.5mm Jack Headphones",£10.99,4.3 out of 5 stars,"5,265",https://www.amazon.co.uk//Isolating-Headphones-Microphone-Lightweight-Earphones/dp/B083J88QRS/ref=sr_1_25?dchild=1&keywords=headphones&qid=1631700190&sr=8-25
Apple EarPods with 3.5mm Headphone Plug - White,£17.91,4.5 out of 5 stars,"13,133",https://www.amazon.co.uk//Apple-EarPods-3-5mm-Headphone-Plug/dp/B06XDLJL26/ref=sr_1_26?dchild=1&keywords=headphones&qid=1631700190&sr=8-26
"[2021 Enhancement] Coioc Wireless Headphones, Bluetooth Headphones 120Hrs Playtime with 2600mAh Charging Case, Enhances Bass, Comfort Fit, CVC8.0 Wireless Earbuds, IPX7 Waterproof Running Headphones",£29.99,4.4 out of 5 stars,"1,207",https://www.amazon.co.uk//Enhancement-Wireless-Headphones-Bluetooth-Waterproof-Black/dp/B091GHBXWG/ref=sr_1_27?dchild=1&keywords=headphones&qid=1631700190&sr=8-27
Wraps Wristband Core Headphones with In Line Microphone - Silver,£14.50,,,https://www.amazon.co.uk//gp/slredirect/picassoRedirect.html/ref=pa_sp_mtf_aps_sr_pg2_1?ie=UTF8&adId=A08623771HZ65MJL0NMOW&url=%2FWraps-Wristband-Core-Headphones-Microphone-Silver%2Fdp%2FB01LYBJVU2%2Fref%3Dsr_1_28_sspa%3Fdchild%3D1%26keywords%3Dheadphones%26qid%3D1631700190%26sr%3D8-28-spons%26psc%3D1%26smid%3DA3BR79ZN9LL2G4&qualifier=1631700190&id=3891270511219960&widgetName=sp_mtf
"Earphones, JKSWT Wired Earbuds with Microphone and Volume Control, High Definition,Powerful Bass Sound, In-Ear Headphones Compatible with 3.5mm Headphones Devices",£5.99,4.4 out of 5 stars,"1,772",https://www.amazon.co.uk//JKSWT-Microphone-Definition-Headphones-Compatible-Black/dp/B0919BBRB2/ref=sr_1_29?dchild=1&keywords=headphones&qid=1631700190&sr=8-29
"Powerbeats High-Performance Wireless Earphones - Apple H1 Headphone Chip, Class 1 Bluetooth, 15 Hours Of Listening Time, Sweat Resistant Earbuds, Built-in Microphone - Black (Latest Model)",£129.00,4.6 out of 5 stars,"1,464",https://www.amazon.co.uk//Powerbeats-High-Performance-Wireless-Earphones-Headphone/dp/B0858KXXSC/ref=sr_1_30?dchild=1&keywords=headphones&qid=1631700190&sr=8-30
"AfterShokz Aeropex Sport Running Headphones, Wireless Bone Conduction Bluetooth Earphones with Mic, IP67 Waterproof for Cycling, Workout (Cosmic Black)",£149.95,4.6 out of 5 stars,"17,573",https://www.amazon.co.uk//AfterShokz-Open-Ear-Waterproof-Conduction-Headphones-Cosmic-Black/dp/B07RRQ59JR/ref=sr_1_31?dchild=1&keywords=headphones&qid=1631700190&sr=8-31
"Wireless Earbuds Running Headphones,Bluetooth 5.0 Sports Headphones with Ear Earphones Bluetooth Earphones IPX65 Waterproof with 6D Stereo HiFi Sound Noise Cancelling Headphones for Workout",£32.98,4.3 out of 5 stars,533,https://www.amazon.co.uk//Headphones-Bluetooth-Earphones-Waterproof-Cancelling-Black/dp/B092RZLT3Z/ref=sr_1_32?dchild=1&keywords=headphones&qid=1631700190&sr=8-32
"OneOdio Over Ear Headphone Studio Wired Bass Headsets with 50mm Driver, Foldable Lightweight Headphones with Shareport and Mic for DJ Recording Monitoring Mixing Podcast Guitar PC TV (Black)",£34.99,4.5 out of 5 stars,"31,392",https://www.amazon.co.uk//gp/slredirect/picassoRedirect.html/ref=pa_sp_mtf_aps_sr_pg2_1?ie=UTF8&adId=A0480160LVC5ZF1OVEA9&url=%2FOneOdio-Headphones-Monitoring-Neodymium-Headsets-Standard-Version%2Fdp%2FB01MZHAX5S%2Fref%3Dsr_1_33_sspa%3Fdchild%3D1%26keywords%3Dheadphones%26qid%3D1631700190%26sr%3D8-33-spons%26psc%3D1&qualifier=1631700190&id=3891270511219960&widgetName=sp_mtf
"Wireless Earbuds, Anker Soundcore Life P2 Wireless Headphones with cVc 8.0 Noise Reduction, Bluetooth Earbuds with Clear Sound, 40H Playtime, IPX7 Waterproof, Wireless Earphones for Work, Home Office",£41.99,4.3 out of 5 stars,"85,504",https://www.amazon.co.uk//Soundcore-Microphones-Reduction-Waterproof-Earphones-Black/dp/B07SJR6HL3/ref=sr_1_34?dchild=1&keywords=headphones&qid=1631700190&sr=8-34
Apple EarPods with Lightning Connector - White,£17.20,4.5 out of 5 stars,"15,287",https://www.amazon.co.uk//Apple-EarPods-with-Lightning-Connector/dp/B01M1EEPOB/ref=sr_1_35?dchild=1&keywords=headphones&qid=1631700190&sr=8-35
"Bose QuietComfort Noise Cancelling Earbuds, True Wireless Bluetooth Earphones, Triple Black",£249.00,4.4 out of 5 stars,"10,111",https://www.amazon.co.uk//Bose-QuietComfort-Cancelling-Earbuds-True-Earphones-Triple-Triple-Black/dp/B08C4KWM9T/ref=sr_1_36?dchild=1&keywords=headphones&qid=1631700190&sr=8-36
Apple AirPods with Charging Case (Wired),£109.00,4.8 out of 5 stars,"106,511",https://www.amazon.co.uk//Apple-Airpods-Charging-latest-Model/dp/B07PZR3PVB/ref=sr_1_37?dchild=1&keywords=headphones&qid=1631700190&sr=8-37
"Betron B25 Earphones, Noise Isolating In-Ear Wired Headphones with Strong Bass, Tangle-Free Cord, Lightweight, Carry Case and Soft Earbud Tips, Black",£9.99,4.2 out of 5 stars,"19,095",https://www.amazon.co.uk//gp/slredirect/picassoRedirect.html/ref=pa_sp_btf_aps_sr_pg2_1?ie=UTF8&adId=A08182092WN6XREB7Z00K&url=%2FBetron-Headphones-Earphones-Smartphones-Microphone-Black%2Fdp%2FB00P89DXYI%2Fref%3Dsr_1_38_sspa%3Fdchild%3D1%26keywords%3Dheadphones%26qid%3D1631700190%26sr%3D8-38-spons%26psc%3D1&qualifier=1631700190&id=3891270511219960&widgetName=sp_btf
"Betron BS10 Earphones, In Ear Headphone, Noise Isolating Earbuds, Powerful Bass Sound, 3.5mm Jack, Gold",£10.99,4.3 out of 5 stars,"1,443",https://www.amazon.co.uk//gp/slredirect/picassoRedirect.html/ref=pa_sp_atf_next_aps_sr_pg3_1?ie=UTF8&adId=A0686871N1BM8VHFM18X&url=%2FBetron-Earphones-Headphones-Powerful-Ergonomic-Gold%2Fdp%2FB074P677HT%2Fref%3Dsr_1_33_sspa%3Fdchild%3D1%26keywords%3Dheadphones%26qid%3D1631700192%26sr%3D8-33-spons%26psc%3D1&qualifier=1631700192&id=6258216287828217&widgetName=sp_atf_next
"Betron B25 Earphones, Noise Isolating In-Ear Wired Headphones with Strong Bass, Tangle-Free Cord, Lightweight, Carry Case and Soft Earbud Tips, Red",£9.99,4.3 out of 5 stars,"1,980",https://www.amazon.co.uk//gp/slredirect/picassoRedirect.html/ref=pa_sp_atf_next_aps_sr_pg3_1?ie=UTF8&adId=A08180533ODR7JDUJA04J&url=%2FBetron-Isolating-Headphones-Earphones-Raspberry-REd%2Fdp%2FB00P89DY74%2Fref%3Dsr_1_34_sspa%3Fdchild%3D1%26keywords%3Dheadphones%26qid%3D1631700192%26sr%3D8-34-spons%26psc%3D1&qualifier=1631700192&id=6258216287828217&widgetName=sp_atf_next
"Philips Fidelio X2HR/00 Over-Ear Headphones, High-Resolution Headphones (50-mm Neodymium Driver, High Res Audio, Deluxe Memory Foam Ear Pads, Cable Clip) Black [Amazon Exclusive]",£124.99,4.7 out of 5 stars,"4,122",https://www.amazon.co.uk//Philips-X2HR-Resolution-Headphones-Isolation-Black/dp/B01N5VHLUG/ref=sr_1_35?dchild=1&keywords=headphones&qid=1631700192&sr=8-35
"Wireless Earbuds, yobola Wireless Headphones, IPX5 Waterproof Wireless Earphones Touch Control, Bluetooth 5.1 Earbuds, 25 Hrs with USB-C Charging with Running/Fitness",£22.99,4.1 out of 5 stars,"6,345",https://www.amazon.co.uk//yobola-Headphones-Waterproof-Earphones-Bluetooth-T2-Pro-White/dp/B08K4Y4RMB/ref=sr_1_36?dchild=1&keywords=headphones&qid=1631700192&sr=8-36
"Bose QuietComfort 35 II Noise Cancelling Bluetooth Headphones - Wireless, Over Ear Headphones with Built in Microphone and Alexa Voice Control, Black, Standard Headphone Size",£299.95,4.7 out of 5 stars,"37,748",https://www.amazon.co.uk//Bose-QuietComfort-Wireless-Headphones-Cancelling-Black/dp/B0756CYWWD/ref=sr_1_37?dchild=1&keywords=headphones&qid=1631700192&sr=8-37
"Sony MDR-7506/1 Professional Headphone, Black",£85.00,4.7 out of 5 stars,"15,018",https://www.amazon.co.uk//Sony-MDR-7506-Professional-Headphone-Black/dp/B000AJIF4E/ref=sr_1_38?dchild=1&keywords=headphones&qid=1631700192&sr=8-38
"Artix CL750 Foldable Noise Isolating On Ear Headphones Wired with Microphone and Volume Control, Stereo Head Phones Corded with Adjustable Headband for Computer, Laptop and Cell Phone (Black)",£25.99,4.4 out of 5 stars,"5,726",https://www.amazon.co.uk//gp/slredirect/picassoRedirect.html/ref=pa_sp_mtf_aps_sr_pg3_1?ie=UTF8&adId=A0998372FL73C6BPC018&url=%2FFoldable-Isolating-Headphones-Microphone-Adjustable-Black1%2Fdp%2FB087JVV8FK%2Fref%3Dsr_1_39_sspa%3Fdchild%3D1%26keywords%3Dheadphones%26qid%3D1631700192%26sr%3D8-39-spons%26psc%3D1&qualifier=1631700192&id=6258216287828217&widgetName=sp_mtf
"Sennheiser HD 300 Around-Ear Lightweight Foldable Headphones - Black, One Size",£44.00,4.6 out of 5 stars,"1,015",https://www.amazon.co.uk//Sennheiser-Around-Ear-Lightweight-Foldable-Headphones-Black/dp/B07N22BN3K/ref=sr_1_40?dchild=1&keywords=headphones&qid=1631700192&sr=8-40
"Bluetooth Headphones, Otium Wireless Headphones IPX7 Waterproof Earphones Sport Earbuds With Bluetooth 5.1 CSR Chip 7-9 Hrs Battery,Noise Cancelling Mic Earbuds for Gym Running Outdoor Sports Workout",£19.99,4.3 out of 5 stars,"6,280",https://www.amazon.co.uk//Bluetooth-Headphones-Otium-Waterproof-Cancelling-black/dp/B07JJN35Z2/ref=sr_1_41?dchild=1&keywords=headphones&qid=1631700192&sr=8-41
Sony WH-1000XM4 Noise Cancelling Wireless Headphones - 30 hours battery life - Over Ear style - Optimised for Alexa and the Google Assistant - with built-in mic for phone calls - Black,£279.00,4.7 out of 5 stars,"6,269",https://www.amazon.co.uk//Sony-WH-1000XM4-Cancelling-Wireless-Headphones-Black/dp/B08C7KG5LP/ref=sr_1_42?dchild=1&keywords=headphones&qid=1631700192&sr=8-42
osloon Wired Earphones Stereo Sound in-Ear Earbuds with 3.5mm Headphones Plug Microphone Volume Control for Sports Workout Compatible with Cell Phones Tablets Laptops,£9.99,4.2 out of 5 stars,"4,992",https://www.amazon.co.uk//MASOMRUN-Earphones-Headphones-Microphone-Compatible-White/dp/B085F3HKHK/ref=sr_1_43?dchild=1&keywords=headphones&qid=1631700192&sr=8-43
"ZIHNIC Bluetooth Headphones Over-Ear, Foldable Wireless and Wired Stereo Headset Micro SD/TF, FM for Cell Phone,PC,Soft Earmuffs &Light Weight for Prolonged Waring(Black/Green)",£19.99,4.5 out of 5 stars,"13,351",https://www.amazon.co.uk//gp/slredirect/picassoRedirect.html/ref=pa_sp_mtf_aps_sr_pg3_1?ie=UTF8&adId=A08759272QQ4ZUR33ID65&url=%2Fzihnic-Bluetooth-Headphones-Prolonged-Black-Green%2Fdp%2FB082PPFRRG%2Fref%3Dsr_1_44_sspa%3Fdchild%3D1%26keywords%3Dheadphones%26qid%3D1631700192%26sr%3D8-44-spons%26psc%3D1&qualifier=1631700192&id=6258216287828217&widgetName=sp_mtf
"Bang & Olufsen Beoplay H9 3rd Gen Wireless Bluetooth Over-Ear Headphones (Amazon Exclusive Edition) - Active Noise Cancellation, Transparency Mode, Voice Assistant Button and Mic, Matte Black",£450.00,4.2 out of 5 stars,173,https://www.amazon.co.uk//Bang-Olufsen-Beoplay-H9-3rd-Matte-Black/dp/B086NG9YN2/ref=sr_1_45?dchild=1&keywords=headphones&qid=1631700192&sr=8-45
"Bose Noise Cancelling Headphones 700 — Over Ear, Wireless Bluetooth Headphones with Built-In Microphone for Clear Calls & Alexa Voice Control, Black",£299.00,4.5 out of 5 stars,"14,588",https://www.amazon.co.uk//Bose-Noise-Cancelling-Headphones-Black/dp/B07Q9MJKBV/ref=sr_1_46?dchild=1&keywords=headphones&qid=1631700192&sr=8-46
"OneOdio DJ Headphones, Over Ear Headphones for Studio Monitoring and Mixing, Professional Headset with Stereo Bass Sound, Foldable Headphones Suitable for Electric Drum Keyboard Guitar Amplifier",£31.99,4.5 out of 5 stars,"2,558",https://www.amazon.co.uk//Over-Ear-Headphones-Wired-Professional-Red/dp/B07XRV1XWX/ref=sr_1_47?dchild=1&keywords=headphones&qid=1631700192&sr=8-47
"Kids Headphones, Riwbox CT-7S Cat Ear Bluetooth Headphones Volume Limiting 85dB,LED Light Up Kids Wireless Headphones Over Ear with Microphone for iPhone/iPad/Laptop/PC/TV (Purple&Green)",£24.98,4.6 out of 5 stars,"3,134",https://www.amazon.co.uk//Headphones-Riwbox-Bluetooth-Limiting-Microphone-Purple-Green/dp/B07HL29N3N/ref=sr_1_48?dchild=1&keywords=headphones&qid=1631700192&sr=8-48
"Betron B25 Earphones, Noise Isolating In-Ear Wired Headphones with Strong Bass, Tangle-Free Cord, Lightweight, Carry Case and Soft Earbud Tips, Silver",£9.99,4.2 out of 5 stars,"2,544",https://www.amazon.co.uk//gp/slredirect/picassoRedirect.html/ref=pa_sp_mtf_aps_sr_pg3_1?ie=UTF8&adId=A0982947PABHJO3QXGOK&url=%2FBetron-Isolating-Headphones-Earphones-Silver-Black-Black-Silver%2Fdp%2FB00P89DY6K%2Fref%3Dsr_1_49_sspa%3Fdchild%3D1%26keywords%3Dheadphones%26qid%3D1631700192%26sr%3D8-49-spons%26psc%3D1&qualifier=1631700192&id=6258216287828217&widgetName=sp_mtf
"Tiksounds Bluetooth Headphones, True Wireless Headphones 150 Hrs Playtime with Charging Case, Deep Bass Sports Earphones, IPX7 Waterproof, Built-in Mic, LED Display for Running/Gaming/Workout",£28.99,4.2 out of 5 stars,"3,636",https://www.amazon.co.uk//Tiksounds-Bluetooth-Headphones-Earphones-Waterproof-black/dp/B08MJPGPKZ/ref=sr_1_50?dchild=1&keywords=headphones&qid=1631700192&sr=8-50
"New Beats Flex Wireless Earphones – Apple W1 Headphone Chip, Magnetic Earbuds, Class 1 Bluetooth, 12 Hours of Listening Time, Built-in Microphone - Black (Latest Model)",£40.39,4.4 out of 5 stars,"1,614",https://www.amazon.co.uk//Beats-Flex-Wireless-Earphones-Built/dp/B08L6YRFDC/ref=sr_1_51?dchild=1&keywords=headphones&qid=1631700192&sr=8-51
"DPS Deep Noise Reduction Earphones,Sport Headphones Bluetooth 5.0 EDR Wireless Stereo HiFi in-Ear Earbuds for Gym Running Outdoor Sports Workout (Black 13) (C7)",£59.99,,,https://www.amazon.co.uk//Reduction-Earphones-Headphones-Bluetooth-Wireless-C7/dp/B09D3MF3BY/ref=sr_1_52?dchild=1&keywords=headphones&qid=1631700192&sr=8-52
