Description,Price,Ratings,Review Count,URL
"Sony WF-1000XM4 True Wireless Noise Cancelling Headphones - with Charging Case - Optimised for Alexa and the Google Assistant - with Built-in Mic for Phone Calls - Reliable Bluetooth Connection, Black",£249.00,4.4 out of 5 stars,715,https://www.amazon.co.uk//Sony-WF-1000XM4-Wireless-Cancelling-Headphones-Black/dp/B095DNPH4R/ref=sr_1_144?dchild=1&keywords=headphones&qid=1631700201&sr=8-144
"Wireless Bluetooth 5.0 Earbuds Headphones,Hi-Fi Stereo Sound Wireless Earphones,Sport Earbuds with Built-in Mic/Noise Cancelling,30H Playtime Touch Control Bluetooth Earbuds in-Ear,for iphone/Android",£69.95,4.8 out of 5 stars,"1,273",https://www.amazon.co.uk//Wireless-Bluetooth-Headphones-Earphones-Cancelling-White-New/dp/B09F9FKFY9/ref=sr_1_145?dchild=1&keywords=headphones&qid=1631700201&sr=8-145
"Bluetooth Kids Headphones over ear ,iClever BTH12,Colorful LED Lights, Kids Wireless Headphones Over Ear with 74/85/94dB Volume Limited, 40H Playtime, Bluetooth 5.0, Built-in Mic for School/Tablet/PC",£26.99,4.6 out of 5 stars,721,https://www.amazon.co.uk//iClever-Bluetooth-Headphones-Colorful-Wireless-Blue/dp/B0895PBJCQ/ref=sr_1_146?dchild=1&keywords=headphones&qid=1631700201&sr=8-146
"Wireless Headphones Bluetooth Earbuds, In Ear Mini Bluetooth 5.0 Earphones IP7 Waterproof CVC 8.0 Noise Cancelling Headphones 32H Playtime with USB-C LCD Display, Touch Control Wireless Headset Black",£29.99,5.0 out of 5 stars,114,https://www.amazon.co.uk//Headphones-Bluetooth-Earphones-Waterproof-Cancelling-Black/dp/B099YZTKCK/ref=sr_1_147?dchild=1&keywords=headphones&qid=1631700201&sr=8-147
"P26 Bluetooth Headphones Over Ear, Girl's Fashion Headphones 80H Playtime Wireless Hi-Fi Stereo Noise Cancelling Cordless Headset with Deep Bass and Mic, Support FM/TF for TV/Smart Phone/PC/Pad Rose",£26.99,4.4 out of 5 stars,513,https://www.amazon.co.uk//gp/slredirect/picassoRedirect.html/ref=pa_sp_btf_aps_sr_pg9_1?ie=UTF8&adId=A01595461CMO0YEI2XS3M&url=%2FBluetooth-Headphones-Playtime-Wireless-Cancelling-Pink%2Fdp%2FB08P4TDRSH%2Fref%3Dsr_1_148_sspa%3Fdchild%3D1%26keywords%3Dheadphones%26qid%3D1631700201%26sr%3D8-148-spons%26psc%3D1&qualifier=1631700201&id=2121731759068464&widgetName=sp_btf
"Kids Headphones Unicorn,Childrens Headphones for Girl,85dB Volume Limited Wired Headphone,Foldable Over Ear Headphones for iPhone/iPad/Smartphones/Laptop/PC,3.5mm Jack for On-line learning Travel",£16.99,4.3 out of 5 stars,66,https://www.amazon.co.uk//gp/slredirect/picassoRedirect.html/ref=pa_sp_btf_aps_sr_pg9_1?ie=UTF8&adId=A05271718Y3Q5I6Q1X2D&url=%2FHeadphones-Childrens-Headphone-Foldable-Smartphones-Purple%2Fdp%2FB08TW7HB52%2Fref%3Dsr_1_149_sspa%3Fdchild%3D1%26keywords%3Dheadphones%26qid%3D1631700201%26sr%3D8-149-spons%26psc%3D1%26smid%3DAT6B0EN5BNVMI&qualifier=1631700201&id=2121731759068464&widgetName=sp_btf
"REETEC Bluetooth Headphones, Led Light Up Headphones with Mic, Wireless and Wired Mode, Hi-Fi Stereo Sound Foldable Headsets TF Card Slot Compatible for iPhone iPad Laptop Kindle Laptop TV (Gold)",£24.89,4.6 out of 5 stars,684,https://www.amazon.co.uk//gp/slredirect/picassoRedirect.html/ref=pa_sp_btf_aps_sr_pg9_1?ie=UTF8&adId=A072916113NHARQE3VD8&url=%2FREETEC-Headphones-Bluetooth-Microphone-Earphones%2Fdp%2FB07DS4WR2V%2Fref%3Dsr_1_150_sspa%3Fdchild%3D1%26keywords%3Dheadphones%26qid%3D1631700201%26sr%3D8-150-spons%26psc%3D1&qualifier=1631700201&id=2121731759068464&widgetName=sp_btf
"UGREEN HiTune Wireless Earbuds, Bluetooth Earphones cVc 8 Noise Reduction Microphones, aptX Codec Hifi Stereo, 27H Playtime Bluetooth 5.0 Earbuds, Comfort Fit In-Ear Wireless Earphones for Work Sport",£35.99,4.3 out of 5 stars,"8,035",https://www.amazon.co.uk//UGREEN-Earphones-Cancelling-Headphones-Waterproof/dp/B0851C5KLV/ref=sr_1_145?dchild=1&keywords=headphones&qid=1631700203&sr=8-145
"Wireless Earphones Bluetooth Earbuds for Running, Bluetooth Earphones with Microphone, True Wireless Noise Cancelling Earbuds, IPX7 Waterproof Sport Earphones for Gym and Workout",£21.99,4.6 out of 5 stars,81,https://www.amazon.co.uk//Wireless-Earphones-Microphone-Cancelling-Waterproof-Black/dp/B099MY9WF7/ref=sr_1_146?dchild=1&keywords=headphones&qid=1631700203&sr=8-146
"Betron BS10 Earphones, In Ear Headphones Earphones with Microphone and Volume Control, Powerful Bass Driven Sound, 12mm Large Drivers, Ergonomic Design, Black",£12.99,4.3 out of 5 stars,"12,951",https://www.amazon.co.uk//Betron-Earphones-Headphones-Microphone-Ergonomic-Black/dp/B01MA1MJ6H/ref=sr_1_147?dchild=1&keywords=headphones&qid=1631700203&sr=8-147
"OneOdio Hi-Res Over Ear Headphone Wired Closed-Back DJ Studio Headphones for Monitoring and Mixing, Soft Protein Leather Earcups, Noise Isolation, 90° Rotatable Housing, Portable (Upgraded Version)",£45.98,4.5 out of 5 stars,"3,182",https://www.amazon.co.uk//OneOdio-Adapter-free-Closed-Back-Headphones-Monitoring-Black/dp/B01F59T4HU/ref=sr_1_148?dchild=1&keywords=headphones&qid=1631700203&sr=8-148
"Betron B650 Earphones, In Ear Headphones Earphones, Noise Isolating, Enhanced Bass and Tangle-Free Wire, Black",£9.99,4.1 out of 5 stars,"4,764",https://www.amazon.co.uk//gp/slredirect/picassoRedirect.html/ref=pa_sp_mtf_aps_sr_pg10_1?ie=UTF8&adId=A089913229UD85AJZ2NX7&url=%2FBetron-Isolating-Earphones-Headphones-Powerful-Black-Silver%2Fdp%2FB00T27N540%2Fref%3Dsr_1_149_sspa%3Fdchild%3D1%26keywords%3Dheadphones%26qid%3D1631700203%26sr%3D8-149-spons%26psc%3D1&qualifier=1631700203&id=5431338563727682&widgetName=sp_mtf
Koss KPH7 On-Ear Stereo Headphones for (3.5 mm Jack) iMac/Laptop/DJ/MP3 Players - Black,£11.29,4.1 out of 5 stars,"1,010",https://www.amazon.co.uk//Koss-KPH7-Stereo-Headphones-Players-Black/dp/B006T9ZKAQ/ref=sr_1_150?dchild=1&keywords=headphones&qid=1631700203&sr=8-150
"Logitech G432 Wired Gaming Headset, 7.1 Surround Sound, DTS Headphone:X 2.0, 50 mm Audio Drivers, USB and 3.5 mm Audio Jack, Flip-to-Mute Mic, Lightweight, PC/Mac/Xbox One/PS4/Nintendo Switch - Black",£43.99,4.4 out of 5 stars,940,https://www.amazon.co.uk//Logitech-Surround-Sound-Gaming-Headset-Leatherette/dp/B07MTXLFXV/ref=sr_1_151?dchild=1&keywords=headphones&qid=1631700203&sr=8-151
"beyerdynamic DT 240 PRO Monitoring Headphones, Black",£62.00,4.5 out of 5 stars,"1,114",https://www.amazon.co.uk//beyerdynamic-DT-240-PRO-Monitoring/dp/B075MRW285/ref=sr_1_152?dchild=1&keywords=headphones&qid=1631700203&sr=8-152
PALOVUE Lightning Headphones Earphones Earbuds Compatible iPhone 12 11 Pro Max iPhone X XS Max XR iPhone 8 Plus iPhone 7 Plus MFi Certified with Microphone Controller SweetFlow (Black),£19.99,4.2 out of 5 stars,"9,257",https://www.amazon.co.uk//PALOVUE-Headphones-Compatible-Microphone-SweetFlow-Black/dp/B083BT3VXZ/ref=sr_1_153?dchild=1&keywords=headphones&qid=1631700203&sr=8-153
"Wireless Earbuds, E90 Bluetooth Earbuds Built-in Dual-Mic Stereo/Deep Bass/Type-C Fast Charge/Touch Control/IPX8 Waterproof/Low Latency/White In-Ear Wireless Earphones for Business, Travels, Sports",£21.98,4.7 out of 5 stars,163,https://www.amazon.co.uk//gp/slredirect/picassoRedirect.html/ref=pa_sp_mtf_aps_sr_pg10_1?ie=UTF8&adId=A03887023OXOETZFS7KAU&url=%2FWireless-Bluetooth-Dual-Mic-Waterproof-Earphones-White%2Fdp%2FB098FC876Y%2Fref%3Dsr_1_154_sspa%3Fdchild%3D1%26keywords%3Dheadphones%26qid%3D1631700203%26sr%3D8-154-spons%26psc%3D1%26smid%3DA25BCTV6W6Z78N&qualifier=1631700203&id=5431338563727682&widgetName=sp_mtf
"Sleep Headphones Bluetooth Headband 3-en-1 Wireless Music Sport Headband Sleeping Headphones Earbuds IPX6 Waterproof with Mic Ultra-Thin HD Speakers for Sleep Sideways Running Sport,Gift for Woman Man",£19.89,3.9 out of 5 stars,31,https://www.amazon.co.uk//Headphones-Bluetooth-Headband-Ultra-Thin-Relaxation-Gray/dp/B085L1XG7V/ref=sr_1_155?dchild=1&keywords=headphones&qid=1631700203&sr=8-155
"Sony WH-H910N Noise Cancelling Wireless Headphones with Mic, 35 Hours Battery Life with Quick Charge, Hi-Res Audio, Touch Control, Google Assistant and Alexa Built-in - Black",£179.00,4.4 out of 5 stars,758,https://www.amazon.co.uk//Sony-Wireless-Cancelling-Headphones-Compatible-black/dp/B07X3XN352/ref=sr_1_156?dchild=1&keywords=headphones&qid=1631700203&sr=8-156
SOUNDPEATS TrueAir2 Wireless Earbuds Bluetooth V5.2 Headphones Wireless Earphones with Qualcomm QCC3040 TrueWireless Mirroring 4-Mic cVc 8.0 Total 25 Hours (Black),£35.99,4.3 out of 5 stars,"1,828",https://www.amazon.co.uk//SOUNDPEATS-Bluetooth-Headphones-Earphones-TrueWireless-Black/dp/B08GCMSZ74/ref=sr_1_157?dchild=1&keywords=headphones&qid=1631700203&sr=8-157
"Betron YSM1000 Earphones, In-Ear Wired Headphones with Bass Driven Sound, Tangle-Free Wire, Noise Isolating",£15.99,4.2 out of 5 stars,"13,229",https://www.amazon.co.uk//Betron-Earphones-Headphones-Definition-Microphone-gold-black/dp/B00S2P0M1C/ref=sr_1_158?dchild=1&keywords=headphones&qid=1631700203&sr=8-158
"Headphone Heavy Bass Stereo Earphones Earbuds Noise Isolating Tangle Free Headsets CBGGQ in Ear Headphones with Remote & Microphone,for iOS and Android,Laptops,Gaming(Black+White+Pink+Green 4 Pack)",£7.99,4.2 out of 5 stars,"6,524",https://www.amazon.co.uk//gp/slredirect/picassoRedirect.html/ref=pa_sp_mtf_aps_sr_pg10_1?ie=UTF8&adId=A0475108JUTPMJCEFPUK&url=%2FHeadphones-Earphones-Isolating-CBGGQ-Microphone-4-Pairs-Color%2Fdp%2FB07XRXHHMP%2Fref%3Dsr_1_159_sspa%3Fdchild%3D1%26keywords%3Dheadphones%26qid%3D1631700203%26sr%3D8-159-spons%26psc%3D1&qualifier=1631700203&id=5431338563727682&widgetName=sp_mtf
"Sennheiser HD 25 Basic Edition, Closed Headphone for ENG/DJ use with split headband",£148.55,4.8 out of 5 stars,"1,545",https://www.amazon.co.uk//Sennheiser-HD-Closed-Headphone-headband-Black/dp/B00009ZSYG/ref=sr_1_160?dchild=1&keywords=headphones&qid=1631700203&sr=8-160
"DPS Deep Noise Reduction Earphones,Sport Headphones Bluetooth 5.0 EDR Wireless Stereo HiFi in-Ear Earbuds for Gym Running Outdoor Sports Workout (Black 13) (C8)",£59.99,,,https://www.amazon.co.uk//Reduction-Earphones-Headphones-Bluetooth-Wireless-C8/dp/B09D3N97QP/ref=sr_1_161?dchild=1&keywords=headphones&qid=1631700203&sr=8-161
"Jaybird Vista 2 True Wireless Sport Bluetooth Headphones With Charging Case - ANC, Sport Fit, 24 Hour Battery, Waterproof Earbuds with Military-grade Durability - Black",£189.99,4.4 out of 5 stars,"1,806",https://www.amazon.co.uk//Jaybird-Wireless-Bluetooth-Headphones-Charging-Black/dp/B07W5JKNB5/ref=sr_1_162?dchild=1&keywords=headphones&qid=1631700203&sr=8-162
"AFTERSHOKZ Trekz Titanium Wireless Bone Conduction Headphones Bluetooth Sweatproof Earphones with Mic for Sports, Black Normal Size",£55.96,4.5 out of 5 stars,"22,122",https://www.amazon.co.uk//Aftershokz-Titanium-Bluetooth-whiteresistent-Wasserabweisend/dp/B07DMDD776/ref=sr_1_163?dchild=1&keywords=headphones&qid=1631700203&sr=8-163
"Baseman Wired Foldable Headphones with Mic, Stereo Heavy Bass Over Ear Headset for iPhone Cell Phones Laptop Tablet Mp4 Mp3 Macbook PC (Black)",£15.89,4.3 out of 5 stars,434,https://www.amazon.co.uk//gp/slredirect/picassoRedirect.html/ref=pa_sp_btf_aps_sr_pg10_1?ie=UTF8&adId=A0283028247E5H14H8F4I&url=%2FBaseman-Folding-Headphones-Lightweight-Microphone-Black%2Fdp%2FB07CLNDJRH%2Fref%3Dsr_1_164_sspa%3Fdchild%3D1%26keywords%3Dheadphones%26qid%3D1631700203%26sr%3D8-164-spons%26psc%3D1&qualifier=1631700203&id=5431338563727682&widgetName=sp_btf
"Betron YSM1000 Earphones, In-Ear Wired Earphones Headphones with Microphone, Deep Bass, Tangle-Free Wire, Noise Isolating Eartips",£16.99,4.2 out of 5 stars,"1,994",https://www.amazon.co.uk//gp/slredirect/picassoRedirect.html/ref=pa_sp_btf_aps_sr_pg10_1?ie=UTF8&adId=A09695302HGKDBYXQNJOR&url=%2FBetron-Earphones-Headphones-Definition-BlackBerry-black-gold%2Fdp%2FB00S2P0M4Y%2Fref%3Dsr_1_165_sspa%3Fdchild%3D1%26keywords%3Dheadphones%26qid%3D1631700203%26sr%3D8-165-spons%26psc%3D1&qualifier=1631700203&id=5431338563727682&widgetName=sp_btf
"Betron B750s Earphones, Wired In-Ear Headphones Earphones, Noise Isolating, Tangle-Free Cable, Enhanced Bass, White",£10.99,4.2 out of 5 stars,"1,523",https://www.amazon.co.uk//gp/slredirect/picassoRedirect.html/ref=pa_sp_btf_aps_sr_pg10_1?ie=UTF8&adId=A1022577HDJVMTT3BYKS&url=%2FBetron-Earphones-Headphones-Definition-BlackBerry-White%2Fdp%2FB00I3LTQEE%2Fref%3Dsr_1_166_sspa%3Fdchild%3D1%26keywords%3Dheadphones%26qid%3D1631700203%26sr%3D8-166-spons%26psc%3D1&qualifier=1631700203&id=5431338563727682&widgetName=sp_btf
Bose QuietComfort 20 Acoustic Noise Cancelling Headphones for Apple Devices (Black),£149.99,4.6 out of 5 stars,"1,109",https://www.amazon.co.uk//Bose-QuietComfort-Acoustic-Cancelling-Headphones/dp/B00X9KV0HU/ref=sr_1_161?dchild=1&keywords=headphones&qid=1631700205&sr=8-161
"JBL LIVE PRO+ TWS - True Wireless In-ear Noise Cancelling Bluetooth Headphones with 28-hour battery, Fast Pair, wireless charging, in beige",£169.99,4.3 out of 5 stars,245,https://www.amazon.co.uk//JBL-LIVE-PRO-TWS-ear-Beige/dp/B08QVNSKHC/ref=sr_1_162?dchild=1&keywords=headphones&qid=1631700205&sr=8-162
"DPS Deep Noise Reduction Earphone,Bluetooth 5.0 Wireless Stereo Headphone with HiFi Wireless in-Ear Earbud with Smart LCD Digital Display (C1)",£59.99,,,https://www.amazon.co.uk//Reduction-Earphone-Bluetooth-Wireless-Headphone-C1/dp/B09D3N741F/ref=sr_1_163?dchild=1&keywords=headphones&qid=1631700205&sr=8-163
beyerdynamic DT 770 PRO Studio Headphones - 80 Ohm,£92.00,4.7 out of 5 stars,"15,425",https://www.amazon.co.uk//beyerdynamic-770-PRO-Studio-Headphones/dp/B0016MNAAI/ref=sr_1_164?dchild=1&keywords=headphones&qid=1631700205&sr=8-164
"4 Packs Earphones, CBGGQ Noise Isolating In-Ear Headphones with Pure Sound and Powerful Bass, Earbuds with Microphone & Volume Control, Headphones for iOS and Android Smartphones, Laptops, Gaming,etc",£7.99,4.2 out of 5 stars,"5,430",https://www.amazon.co.uk//gp/slredirect/picassoRedirect.html/ref=pa_sp_mtf_aps_sr_pg11_1?ie=UTF8&adId=A0179374LWAQV4LIDT7B&url=%2FEarphones-CBGGQ-Headphones-Microphone-Smartphones-4-pairs-color%2Fdp%2FB07XRXSWQ6%2Fref%3Dsr_1_165_sspa%3Fdchild%3D1%26keywords%3Dheadphones%26qid%3D1631700205%26sr%3D8-165-spons%26psc%3D1&qualifier=1631700205&id=1459096726824394&widgetName=sp_mtf
AXLOIE Wireless Headphones Bluetooth 5.0 In-Ear Earbuds Waterproof Sports Earphones with ENC Noise Cancellation for HD Stereo Calls Touch Control USB-C Charging 20H Playtime,£16.99,4.1 out of 5 stars,"1,020",https://www.amazon.co.uk//AXLOIE-Headphones-Bluetooth-Waterproof-Cancellation-Black-C/dp/B08YDD1LCM/ref=sr_1_166?dchild=1&keywords=headphones&qid=1631700205&sr=8-166
HiFiMAN Arya Full-size Over Ear Planar Magnetic Audiophile Adjustable Headphone,"£1,339.99",4.6 out of 5 stars,74,https://www.amazon.co.uk//Full-Size-Magnetic-Audiophile-Adjustable-Headphone/dp/B07K59HW9R/ref=sr_1_167?dchild=1&keywords=headphones&qid=1631700205&sr=8-167
"Philips Audio SHP2500/10 Hi-Fi Headphones, TV Headphones with Long Cable (Excellent Sound, Sound Isolation, In-Cord Volume Control, Extra Long 6-m Cable) Silver/Black",£20.02,4.2 out of 5 stars,"2,994",https://www.amazon.co.uk//Philips-SHP2500-Over-Ear-Indoor-Headphone-black-silver/dp/B000FTWT00/ref=sr_1_168?dchild=1&keywords=headphones&qid=1631700205&sr=8-168
"Bluetooth Earphones, Tribit 100H Playtime Bluetooth 5.0 IPX8 Waterproof Touch Control Ture Wireless Earbuds with Mic Earphones in-Ear Deep Bass Built-in Mic Bluetooth Headphones, FlyBuds 3",£39.99,4.5 out of 5 stars,928,https://www.amazon.co.uk//Tribit-FlyBuds-Wireless-Earbuds-Waterproof-black/dp/B087TSMC3R/ref=sr_1_169?dchild=1&keywords=headphones&qid=1631700205&sr=8-169
"Betron RK300 Earphones, Wired In-Ear Headphones Earphones, Noise Isolating, Enhanced Bass, Tangle-Free Cord, Pink",£11.99,4.4 out of 5 stars,481,https://www.amazon.co.uk//gp/slredirect/picassoRedirect.html/ref=pa_sp_mtf_aps_sr_pg11_1?ie=UTF8&adId=A09699782Y6T93C2DRU41&url=%2FBetron-Earphones-Headphones-Isolating-Lightweight-Pink%2Fdp%2FB00O35B8JK%2Fref%3Dsr_1_170_sspa%3Fdchild%3D1%26keywords%3Dheadphones%26qid%3D1631700205%26sr%3D8-170-spons%26psc%3D1&qualifier=1631700205&id=1459096726824394&widgetName=sp_mtf
"Bluetooth Wireless Running Headphones, Zero Pressure Design Earphone with HiFi Stereo Sound, Clear Voice Capture Technology, Foldable Pocket Size for Gym/Yoga/Travel, Built-in Noise Cancelling Mic",£19.99,4.4 out of 5 stars,8,https://www.amazon.co.uk//Bluetooth-Wireless-Headphones-Technology-Cancelling-black/dp/B099HVBR35/ref=sr_1_171?dchild=1&keywords=headphones&qid=1631700205&sr=8-171
"Betron B25 Earphones, Noise Isolating In-Ear Wired Headphones with Strong Bass, Tangle-Free Cord, Lightweight, Carry Case and Soft Earbud Tips, Black",£9.99,4.2 out of 5 stars,"19,095",https://www.amazon.co.uk//Betron-Headphones-Earphones-Smartphones-Microphone-Black/dp/B00P89DXYI/ref=sr_1_172?dchild=1&keywords=headphones&qid=1631700205&sr=8-172
"Bluetooth Headphones, Otium Wireless Headphones IPX7 Waterproof in-Ear Earbuds Bluetooth 5.1 Earphones with 10 Hrs Playtime HD Stereo Headset for Gym Workout with Noise Cancelling Mic",£19.99,4.3 out of 5 stars,"6,059",https://www.amazon.co.uk//Bluetooth-Headphones-Waterproof-Earphones-Cancelling-Red/dp/B09C61F3C5/ref=sr_1_173?dchild=1&keywords=headphones&qid=1631700205&sr=8-173
"Wireless Earbuds, Bluetooth 5.0 Headphones True Wireless Headsets Auto Pairing HiFi Stereo Sound in-Ear Headphone IPX5 Water-Proof Wireless Earphones Built in Mic and Charging Case",£14.99,5.0 out of 5 stars,98,https://www.amazon.co.uk//Bluetooth-Headphones-Headphone-Water-Proof-Earphones-White/dp/B09DGG5QHL/ref=sr_1_174?dchild=1&keywords=headphones&qid=1631700205&sr=8-174
AILIHEN C8 Headphones with Microphone and Volume Control Folding Lightweight Headset Earphones for Cellphones Tablets Smartphones Computer PC Mp3/4 (Mint),£17.98,4.4 out of 5 stars,"6,963",https://www.amazon.co.uk//gp/slredirect/picassoRedirect.html/ref=pa_sp_mtf_aps_sr_pg11_1?ie=UTF8&adId=A06334792V9JJ60YFFEUB&url=%2FC8-Headphones-Microphone-Lightweight-Smartphones-Mint%2Fdp%2FB01EF5DBYM%2Fref%3Dsr_1_175_sspa%3Fdchild%3D1%26keywords%3Dheadphones%26qid%3D1631700205%26sr%3D8-175-spons%26psc%3D1&qualifier=1631700205&id=1459096726824394&widgetName=sp_mtf
OneOdio Over Ear Headphone Wired Hi-Fi Studio Headphones 50mm Speaker 1/4 inch Jack Adapter Closed-Back Headphones for DJ Electric Drum Keyboard Guitar PC iPad Music,£28.99,4.4 out of 5 stars,"1,572",https://www.amazon.co.uk//OneOdio-Headphone-Headphones-Closed-Back-Electric-Matte-Black/dp/B08DK51D8C/ref=sr_1_176?dchild=1&keywords=headphones&qid=1631700205&sr=8-176
"Pioneer DJ - HDJ-X7 Professional over-ear DJ Headphones, Silver",£162.00,4.3 out of 5 stars,27,https://www.amazon.co.uk//Pioneer-DJ-Professional-over-ear-Headphones/dp/B075GVWY45/ref=sr_1_177?dchild=1&keywords=headphones&qid=1631700205&sr=8-177
"AKG K702 Open-Back Over-Ear Premium Studio Headphones, Reference Grade Sound, Airy and Spacious Soundstage, Precision Crafted",£119.00,4.5 out of 5 stars,"5,814",https://www.amazon.co.uk//AKG-K702-Open-Back-Reference-Headphones/dp/B001RCD2DW/ref=sr_1_178?dchild=1&keywords=headphones&qid=1631700205&sr=8-178
"Anker Soundcore Spirit X2, True Wireless Earbuds, Body-Moving Bass, IP68 Sweatproof, 36H Playtime, Fast Charge, Secure Earhooks, Bluetooth 5, cVc 8.0 Clear Calls, Sports Earphones For Gym, Sport",£55.99,4.2 out of 5 stars,"1,168",https://www.amazon.co.uk//Soundcore-Bluetooth-Sweatproof-Headphones-Graphene-Enhanced/dp/B07X9YL62V/ref=sr_1_179?dchild=1&keywords=headphones&qid=1631700205&sr=8-179
"DOQAUS Bluetooth Headphones Over Ear, Wireless Headphones with Mic, 52 Hours Playtime, 3 EQ Modes, Foldable Headset with Soft Memory Protein Earpads, Bluetooth 5.0 & Wired Mode for Smartphone Laptop",£28.04,4.5 out of 5 stars,"16,929",https://www.amazon.co.uk//gp/slredirect/picassoRedirect.html/ref=pa_sp_btf_aps_sr_pg11_1?ie=UTF8&adId=A025463711HR66TQU4SX6&url=%2FDOQAUS-Bluetooth-Headphones-Wireless-Smartphone-Navy-Blue%2Fdp%2FB08XVVVC48%2Fref%3Dsr_1_180_sspa%3Fdchild%3D1%26keywords%3Dheadphones%26qid%3D1631700205%26smid%3DAC7NJ3WE5HQ1K%26sr%3D8-180-spons%26psc%3D1&qualifier=1631700205&id=1459096726824394&widgetName=sp_btf
"OneOdio DJ Headphones, Over Ear Headphones for Studio Monitoring and Mixing, Professional Headset with Stereo Bass Sound, Foldable Headphones Suitable for Electric Drum Keyboard Guitar Amplifier",£31.99,4.5 out of 5 stars,"2,558",https://www.amazon.co.uk//gp/slredirect/picassoRedirect.html/ref=pa_sp_btf_aps_sr_pg11_1?ie=UTF8&adId=A05228733KZPBX16NQ4SG&url=%2FOver-Ear-Headphones-Wired-Professional-Red%2Fdp%2FB07XRV1XWX%2Fref%3Dsr_1_181_sspa%3Fdchild%3D1%26keywords%3Dheadphones%26qid%3D1631700205%26sr%3D8-181-spons%26psc%3D1&qualifier=1631700205&id=1459096726824394&widgetName=sp_btf
"Sennheiser HD 300 Around-Ear Lightweight Foldable Headphones - Black, One Size",£44.00,4.6 out of 5 stars,"1,015",https://www.amazon.co.uk//gp/slredirect/picassoRedirect.html/ref=pa_sp_btf_aps_sr_pg11_1?ie=UTF8&adId=A09390071KMF82BDDS2EX&url=%2FSennheiser-Around-Ear-Lightweight-Foldable-Headphones-Black%2Fdp%2FB07N22BN3K%2Fref%3Dsr_1_182_sspa%3Fdchild%3D1%26keywords%3Dheadphones%26qid%3D1631700205%26sr%3D8-182-spons%26psc%3D1&qualifier=1631700205&id=1459096726824394&widgetName=sp_btf
"1MORE Quad Driver In-Ear Earphones Hi-Res High Fidelity Headphones with Warm Bass, Spacious Reproduction, High Resolution, Mic and In-Line Remote for Smartphones/PC/Tablet - E1010 Space Gray Silver",£119.99,4.5 out of 5 stars,"2,273",https://www.amazon.co.uk//gp/slredirect/picassoRedirect.html/ref=pa_sp_atf_next_aps_sr_pg12_1?ie=UTF8&adId=A03258253VQO4N1Z7YYRO&url=%2F1MORE-Headphones-Reproduction-Resolution-Smartphones-Silver%2Fdp%2FB06XSJV5B9%2Fref%3Dsr_1_177_sspa%3Fdchild%3D1%26keywords%3Dheadphones%26qid%3D1631700206%26sr%3D8-177-spons%26psc%3D1%26smid%3DA20M2KH5WE97MP&qualifier=1631700206&id=504225183529423&widgetName=sp_atf_next
Sony Wh-1000xM3 Wireless Over-Ear Headphone Black,£224.00,4.6 out of 5 stars,"3,952",https://www.amazon.co.uk//Sony-WH-1000XM3-Wireless-Over-Ear-Headphone/dp/B07H2DBFQZ/ref=sr_1_178?dchild=1&keywords=headphones&qid=1631700206&sr=8-178
"Soundcore by Anker Life Q35 Multi Mode Active Noise Cancelling Headphones, Bluetooth Headphones with LDAC for Hi Res Wireless Audio, 40H Playtime, Comfortable Fit, Clear Calls, For Home, Work, Travel",£129.99,4.3 out of 5 stars,505,https://www.amazon.co.uk//Soundcore-Cancelling-Headphones-Bluetooth-Comfortable/dp/B08X3PRQTD/ref=sr_1_179?dchild=1&keywords=headphones&qid=1631700206&sr=8-179
"Sennheiser HD 25 Closed-Back Dynamic Monitor Headphones Professional for DJs, black",£137.75,4.6 out of 5 stars,774,https://www.amazon.co.uk//Sennheiser-Closed-Back-Dynamic-Headphones-Professional-Black/dp/B01CRI3UOU/ref=sr_1_180?dchild=1&keywords=headphones&qid=1631700206&sr=8-180
Audio-Technica ATH-M20X Professional Headphones - Black,£41.00,4.6 out of 5 stars,"1,380",https://www.amazon.co.uk//Audio-Technica-ATH-M20X-Professional-Headphones-Black/dp/B00HVLUR18/ref=sr_1_181?dchild=1&keywords=headphones&qid=1631700206&sr=8-181
"Bluetooth Headphones Wireless,Tuinyo Over Ear Stereo Wireless Headset 35H Playtime with deep bass, Soft Memory-Protein Earmuffs, Built-in Mic Wired Mode PC/Cell Phones/TV-black/red",£19.99,4.4 out of 5 stars,"5,855",https://www.amazon.co.uk//gp/slredirect/picassoRedirect.html/ref=pa_sp_mtf_aps_sr_pg12_1?ie=UTF8&adId=A02598322VI7TAHI85EG3&url=%2FBluetooth-Headphones-Wireless-Playtime-Memory-Protein-black-red%2Fdp%2FB082W336WM%2Fref%3Dsr_1_182_sspa%3Fdchild%3D1%26keywords%3Dheadphones%26qid%3D1631700206%26sr%3D8-182-spons%26psc%3D1%26smid%3DA35CVSMAIF3R2P&qualifier=1631700206&id=504225183529423&widgetName=sp_mtf
Marshall Monitor Bluetooth Headphones - Black,£155.00,4.3 out of 5 stars,"2,473",https://www.amazon.co.uk//Marshall-Monitor-Bluetooth-Headphones-Black/dp/B06XVTKK2G/ref=sr_1_183?dchild=1&keywords=headphones&qid=1631700206&sr=8-183
"Wireless Headphones, 140H Playtime Wireless Earbuds Bluetooth Headphones with Charging Case, In Ear Headphones HiFi Stereo CVC8.0 Noise Canceling with Built-in Mic, LCD Display, IP7 Waterproof, USB-C",£21.99,4.4 out of 5 stars,"2,536",https://www.amazon.co.uk//Wireless-Headphones-Bluetooth-Canceling-Waterproof-New-Model/dp/B08JYZ38P7/ref=sr_1_184?dchild=1&keywords=headphones&qid=1631700206&sr=8-184
"Kids Headphones, PowerLocus P2 Bluetooth Headphones for Kids with Volume Limit 85DB, Kids Wireless Headphones Over Ear with Microphone, Foldable, Carry Case, Micro SD/TF for iPhone/iPad/Laptop/PC/TV",£19.99,4.3 out of 5 stars,"1,025",https://www.amazon.co.uk//PowerLocus-Headphones-Over-Ear-Bluetooth-Microphone-Blue/dp/B089T4TX74/ref=sr_1_185?dchild=1&keywords=headphones&qid=1631700206&sr=8-185
Skullcandy Grind Bluetooth Wireless On-Ear Headphones - White/Black/Red,£29.99,4.7 out of 5 stars,263,https://www.amazon.co.uk//Skullcandy-Grind-Bluetooth-Wireless-Headphones-White-Black-Red/dp/B01BPFHT70/ref=sr_1_186?dchild=1&keywords=headphones&qid=1631700206&sr=8-186
VPB Heavy bass Earphone Color Call with Mic Stereo Earbud Headphones Mixed Colors (Black + White + Pink + Green 4 Pairs),£8.99,4.3 out of 5 stars,555,https://www.amazon.co.uk//gp/slredirect/picassoRedirect.html/ref=pa_sp_mtf_aps_sr_pg12_1?ie=UTF8&adId=A0746627MW5WIP9IX50X&url=%2FVPB-Headphones-Microphone-Compatible-Smartphones%2Fdp%2FB07RPYH9C8%2Fref%3Dsr_1_187_sspa%3Fdchild%3D1%26keywords%3Dheadphones%26qid%3D1631700206%26sr%3D8-187-spons%26psc%3D1&qualifier=1631700206&id=504225183529423&widgetName=sp_mtf
"JBL Tune 750 BTNC Wireless Over-Ear Bluetooth Headphones with active noise cancellation, in white",£69.99,3.9 out of 5 stars,"1,509",https://www.amazon.co.uk//JBL-JBLT750BTNCWHT-T750BTNC-White/dp/B07XL9WMQ3/ref=sr_1_188?dchild=1&keywords=headphones&qid=1631700206&sr=8-188
