Description,Price,Ratings,Review Count,URL
"Logitech H800 Wireless Bluetooth Headsets, Hi-Definition Stereo Headphones with Noise-Cancelling Microphone, Bluetooth and USB Nano Receiver, Multi-Device, Long Battery Life, PC/Mac/Smartphone/Tablet",£82.49,4.1 out of 5 stars,"2,235",https://www.amazon.co.uk//Logitech-H800-Wireless-Headset-Mac/dp/B005FY619K/ref=sr_1_189?dchild=1&keywords=headphones&qid=1631700206&sr=8-189
JBL Tune600BTNC in Black – On Ear Active Noise-Cancelling Bluetooth Headphones – Headset w/ Built-In Microphone – 12hrs+ Wireless Streaming,£47.78,4.6 out of 5 stars,"3,711",https://www.amazon.co.uk//JBL-Tune600BTNC-Black-Noise-Cancelling-Built-Teal/dp/B07B9J2PZ7/ref=sr_1_190?dchild=1&keywords=headphones&qid=1631700206&sr=8-190
"In-Ear Headphones for i Phone, Earphones for Phone 11 Stereo Noise Isolating Wired Earbuds with Mic and Volume Control Compatible with Phone 12 11 Pro Max Phone X XS XR Phone 8 Plus Phone 7(Black)",£16.99,4.3 out of 5 stars,82,https://www.amazon.co.uk//Headphones-Earphones-Isolating-Earbuds-Compatible-Black/dp/B08YMYT1GG/ref=sr_1_191?dchild=1&keywords=headphones&qid=1631700206&sr=8-191
"Wireless Earbuds, Bluetooth Headphones In Ear Running Earphones with Noise Cancelling Mic, Built-in Microphone, IPX7 Waterproof, Upgrade Wireless Headset for laptop/Sports",£13.38,4.2 out of 5 stars,33,https://www.amazon.co.uk//gp/slredirect/picassoRedirect.html/ref=pa_sp_mtf_aps_sr_pg12_1?ie=UTF8&adId=A01182352S5HADGSU3RWR&url=%2FBluetooth-Headphones-Cancelling-Microphone-Waterproof-Black%2Fdp%2FB0963KS4NM%2Fref%3Dsr_1_192_sspa%3Fdchild%3D1%26keywords%3Dheadphones%26qid%3D1631700206%26sr%3D8-192-spons%26psc%3D1&qualifier=1631700206&id=504225183529423&widgetName=sp_mtf
"AFTERSHOKZ Trekz Air Bone Conduction Wireless Headphones Bluetooth Sweatproof Earphones with Mic for Sport, Grey",£74.96,4.6 out of 5 stars,"3,478",https://www.amazon.co.uk//AfterShokz-Conduction-Headphones-Bluetooth-Sweatproof-grey/dp/B075FMK7SD/ref=sr_1_193?dchild=1&keywords=headphones&qid=1631700206&sr=8-193
"Hama | Over-Ear Stereo Headphones | 6m | Extra Long Cable ,Black",£15.48,4.1 out of 5 stars,410,https://www.amazon.co.uk//Hama-Basic4TV-Black-headphone-Headphones/dp/B07FLBW42H/ref=sr_1_194?dchild=1&keywords=headphones&qid=1631700206&sr=8-194
"Sennheiser RS 5000 Digital Wireless TV Headphones, Black",£186.94,4.3 out of 5 stars,"1,477",https://www.amazon.co.uk//Sennheiser-RS-5000-Wireless-Headphones/dp/B06XP8YMV4/ref=sr_1_195?dchild=1&keywords=headphones&qid=1631700206&sr=8-195
Status Audio Flagship ANC Headphones,£149.00,5.0 out of 5 stars,1,https://www.amazon.co.uk//Status-Audio-Flagship-ANC-Headphones/dp/B08PDD3PGC/ref=sr_1_196?dchild=1&keywords=headphones&qid=1631700206&sr=8-196
"Baseman Kids Headphones with Microphone, Wired On-Ear Headsets with Safe Volume Limited 85 dB, Foldable and Adjustable Headphones with a 3.5mm Jack Cord for Children/School/Cellphone/Tablet Blue",£18.89,4.3 out of 5 stars,77,https://www.amazon.co.uk//gp/slredirect/picassoRedirect.html/ref=pa_sp_btf_aps_sr_pg12_1?ie=UTF8&adId=A02831281YLZ8HSSH5NFT&url=%2FHeadphones-Microphone-Headsets-Adjustable-Cellphone-Blue%2Fdp%2FB08L7JRJSX%2Fref%3Dsr_1_197_sspa%3Fdchild%3D1%26keywords%3Dheadphones%26qid%3D1631700206%26sr%3D8-197-spons%26psc%3D1&qualifier=1631700206&id=504225183529423&widgetName=sp_btf
"BASEMAN Wireless Bluetooth Headphones Over Head, Wired, Wirelss and TF Card Mode, Lightweight Foldable Headphone, Hi-Fi Stereo Deep Bass Boosted Earphone for Travel Work, for Phone TV PC (Black Gold)",£24.99,4.4 out of 5 stars,265,https://www.amazon.co.uk//gp/slredirect/picassoRedirect.html/ref=pa_sp_btf_aps_sr_pg12_1?ie=UTF8&adId=A08640193424MCKAXN2LF&url=%2FBASEMAN-Bluetooth-Headphones-Lightweight-Headphone%2Fdp%2FB082R6WMPL%2Fref%3Dsr_1_198_sspa%3Fdchild%3D1%26keywords%3Dheadphones%26qid%3D1631700206%26sr%3D8-198-spons%26psc%3D1&qualifier=1631700206&id=504225183529423&widgetName=sp_btf
Skullcandy S6HBGY-374 Hesh 2.0 Over-Ear Bluetooth Wireless Headphone - Black/Gunmetal,£39.90,4.6 out of 5 stars,"5,870",https://www.amazon.co.uk//Skullcandy-S6HBGY-374-Over-Ear-Bluetooth-Headphone-Black/dp/B00NCSIN4W/ref=sr_1_193?dchild=1&keywords=headphones&qid=1631700208&sr=8-193
Monster Active Noise Cancelling Headphones Wireless Over Ear Bluetooth Earphone Deep Bass Hi-Res Sound Headset Quick Charge 30H Playtime Comfortable Fit Clear Calls,£97.99,4.7 out of 5 stars,61,https://www.amazon.co.uk//Monster-Bluetooth-headphone-Cancelling-Headphones-Black/dp/B08SQKT51Z/ref=sr_1_194?dchild=1&keywords=headphones&qid=1631700208&sr=8-194
"Tribit XFree Go Bluetooth Headphones, Wireless Headphones over Ear with Bluetooth 5.0, HiFi Sound with Deep Bass, USB lightening Fast charge, 24H Playtime, CVC8.0 Noise Cancelling Mics, Black",£29.99,4.6 out of 5 stars,"1,986",https://www.amazon.co.uk//Tribit-Bluetooth-Headphones-lightening-Cancelling-Black/dp/B086ZK4X35/ref=sr_1_195?dchild=1&keywords=headphones&qid=1631700208&sr=8-195
"Sennheiser RS 120 II-8EU TV Wireless Headphones,Black",£99.00,4.1 out of 5 stars,"1,328",https://www.amazon.co.uk//Sennheiser-II-8EU-Wireless-Headphones-Black/dp/B07XTVJQDD/ref=sr_1_196?dchild=1&keywords=headphones&qid=1631700208&sr=8-196
AILIHEN MS300 Wired Headphones with Microphone Folding Lightweight Headset for Cellphones Tablets Smartphones Chromebook Zoom Skype Mp3/4 (Blue),£17.98,4.5 out of 5 stars,"6,196",https://www.amazon.co.uk//gp/slredirect/picassoRedirect.html/ref=pa_sp_mtf_aps_sr_pg13_1?ie=UTF8&adId=A053649313ODUVAYW0SP1&url=%2FAILIHEN-Headphones-Foldable-Smartphone-Computer%2Fdp%2FB076HPQQ7Q%2Fref%3Dsr_1_197_sspa%3Fdchild%3D1%26keywords%3Dheadphones%26qid%3D1631700208%26sr%3D8-197-spons%26psc%3D1%26smid%3DA1NCT2O30YNUW8&qualifier=1631700208&id=8502969089746623&widgetName=sp_mtf
"Avantree Aria Bluetooth 5.0 Noise Cancelling Headphones Headset for Music & Calls, Dual Microphone, Boom Mic & Built-in Mic, Comfortable 35H, Over Ear Wireless & Wired for Phone PC Computer Laptop",£64.99,4.3 out of 5 stars,848,https://www.amazon.co.uk//Avantree-Aria-Cancelling-Comfortable-Replaceable-Black/dp/B07TJRGPHL/ref=sr_1_198?dchild=1&keywords=headphones&qid=1631700208&sr=8-198
"3 IN I Advanced Touch Headphones Wireless Over Ear with COOL Seven Color,40H Playtime HiFi Stereo Bluetooth Wireless Gaming Headphones with Mic and Soft Memory Foam Earmuffs for iPhone/Samsung/iPad/PC",£29.99,4.2 out of 5 stars,225,https://www.amazon.co.uk//Advanced-Headphones-Wireless-Playtime-Bluetooth-Mix-color/dp/B08RNWZCJ3/ref=sr_1_199?dchild=1&keywords=headphones&qid=1631700208&sr=8-199
Wireless Earbuds Earphones Bluetooth 5.0 LED Display IPX7 Waterproof 40H Playtime USB-C Charging Built-in Mic in-Ear Headphones Touch Control Deep Bass for Sports Work Outdoor(Black),£24.99,4.4 out of 5 stars,"1,481",https://www.amazon.co.uk//Wireless-Earphones-Bluetooth-Waterproof-Headphones-Black/dp/B08NV7QK8B/ref=sr_1_200?dchild=1&keywords=headphones&qid=1631700208&sr=8-200
"Sleep Headphones Bluetooth Headband Personalised Tech Gifts with Built-in HD Stereo Speakers,Perfect for Sports, Side Sleepers, Ultra-Soft Wireless Sleeping Headphones Birthday Gifts for Her Him",£18.99,4.3 out of 5 stars,"6,292",https://www.amazon.co.uk//Sleep-Headphones-Bluetooth-Ultra-Thin-Meditation-Grey/dp/B07SGK28Q7/ref=sr_1_201?dchild=1&keywords=headphones&qid=1631700208&sr=8-201
"USB Headset With Microphone For Laptop, PC Headphones With Mic Noise Cancelling, Computer Headsets With In-Line Volume Control & Mute, Stereo 3.5mm Jack Super Clarity For Buisness Office Skype Zoom",£27.99,4.4 out of 5 stars,71,https://www.amazon.co.uk//gp/slredirect/picassoRedirect.html/ref=pa_sp_mtf_aps_sr_pg13_1?ie=UTF8&adId=A05124262P8V5SEM7I5S7&url=%2FUSB-Microphone-Headphones-Cancelling-Computer-3-5mm-Soft-headbend%2Fdp%2FB08VHW5MFL%2Fref%3Dsr_1_202_sspa%3Fdchild%3D1%26keywords%3Dheadphones%26qid%3D1631700208%26sr%3D8-202-spons%26psc%3D1&qualifier=1631700208&id=8502969089746623&widgetName=sp_mtf
"JBL Tune 700BT - wireless, over-ear bluetooth headphones with streaming and voice assistant, up to 27 hours of music playback, in black",£59.90,4.4 out of 5 stars,"1,445",https://www.amazon.co.uk//JBL-Tune-700BT-Bluetooth-Headphones-Black/dp/B08145ZW8Y/ref=sr_1_203?dchild=1&keywords=headphones&qid=1631700208&sr=8-203
Bose Sport Earbuds—True Wireless Earphones—Bluetooth Headphones for Workouts and Running—Triple Black,£179.00,4.3 out of 5 stars,"11,991",https://www.amazon.co.uk//Bose-Earbuds-True-Earphones-Bluetooth-Headphones-Running-Triple-Triple-Black/dp/B08CJCTG6Z/ref=sr_1_204?dchild=1&keywords=headphones&qid=1631700208&sr=8-204
"Sony In-Ear Headphones, Black",£9.00,4.3 out of 5 stars,"8,751",https://www.amazon.co.uk//Sony-MDREX15LPB-AE-In-Ear-Headphones-Black/dp/B00I3LUQPW/ref=sr_1_205?dchild=1&keywords=headphones&qid=1631700208&sr=8-205
"Sony WH-XB700 EXTRA BASS Wireless Headphones, 30 hours battery life, on-ear style, optimised for voice assistant - Black (Renewed)",£62.50,4.4 out of 5 stars,122,https://www.amazon.co.uk//Sony-WH-XB700-Headphones-optimised-assistant-Black/dp/B07V46FHQ2/ref=sr_1_206?dchild=1&keywords=headphones&qid=1631700208&sr=8-206
"Betron ELR50 Earphones with Microphone, Noise Isolating Wired Headphones Earphones with Microphone and Volume Control, Carry Case, Enhanced Bass, 3.5 mm Jack, Gold",£11.99,4.2 out of 5 stars,"1,396",https://www.amazon.co.uk//gp/slredirect/picassoRedirect.html/ref=pa_sp_mtf_aps_sr_pg13_1?ie=UTF8&adId=A1035825ZUAQFR7JL3DB&url=%2FBetron-Earphones-Headphones-Isolating-Microphone-Gold%2Fdp%2FB074P5K78Q%2Fref%3Dsr_1_207_sspa%3Fdchild%3D1%26keywords%3Dheadphones%26qid%3D1631700208%26sr%3D8-207-spons%26psc%3D1&qualifier=1631700208&id=8502969089746623&widgetName=sp_mtf
"Sennheiser CX 400BT True Wireless Earbuds - Bluetooth In-Ear Headphones for Music and Calls - with Passive Noise Cancellation and Customisable Touch Controls, Black",,4.4 out of 5 stars,"1,784",https://www.amazon.co.uk//Sennheiser-400BT-True-Wireless-Earbuds-Black/dp/B08CZQXLQJ/ref=sr_1_208?dchild=1&keywords=headphones&qid=1631700208&sr=8-208
Thomson WHP3001BK Radio UHF Wireless Headphones - Black,£37.99,4.1 out of 5 stars,"2,891",https://www.amazon.co.uk//Thomson-WHP3001BK-Radio-Wireless-Headphones-Black/dp/B0057LWOPG/ref=sr_1_209?dchild=1&keywords=headphones&qid=1631700208&sr=8-209
"Hybrid Active Noise Cancelling Headphones-Wingstime, Bluetooth 5.0 Over Ear Wireless Wired Headset with Hi-Fi Deep Bass, 30H Playtime, Memory Foam Comfortable Protein Earpads for Travel Home Office",£39.99,4.2 out of 5 stars,67,https://www.amazon.co.uk//Cancelling-Headphones-Wingstime-Bluetooth-Wireless-Comfortable/dp/B00GOLYXDO/ref=sr_1_210?dchild=1&keywords=headphones&qid=1631700208&sr=8-210
AKG Bluetooth Headphone Black (Y50BTBLK),£94.99,4.2 out of 5 stars,500,https://www.amazon.co.uk//AKG-Bluetooth-Headphone-Black-Y50BTBLK/dp/B01BX72RUY/ref=sr_1_211?dchild=1&keywords=headphones&qid=1631700208&sr=8-211
"JBL Reflect Mini NC TWS - Small waterproof sports in-ear headphones with Bluetooth, with charging case, in black",£85.00,3.9 out of 5 stars,203,https://www.amazon.co.uk//gp/slredirect/picassoRedirect.html/ref=pa_sp_btf_aps_sr_pg13_1?ie=UTF8&adId=A03316041GG42H3UUDOJ2&url=%2FJBL-Reflect-Mini-TWS-ear-Black%2Fdp%2FB08FB2V4GR%2Fref%3Dsr_1_212_sspa%3Fdchild%3D1%26keywords%3Dheadphones%26qid%3D1631700208%26sr%3D8-212-spons%26psc%3D1&qualifier=1631700208&id=8502969089746623&widgetName=sp_btf
"Betron DC950 Earphones, In-Ear Wired Headphones Earphones, Tangle-Free Cable, Noise Isolating, Powerful Bass, Black",£10.99,4.3 out of 5 stars,"7,405",https://www.amazon.co.uk//gp/slredirect/picassoRedirect.html/ref=pa_sp_btf_aps_sr_pg13_1?ie=UTF8&adId=A0020888L5L33O6BMUL6&url=%2FBetron-Headphones-Earphones-Definition-Replaceable-Black%2Fdp%2FB00LB01FNO%2Fref%3Dsr_1_213_sspa%3Fdchild%3D1%26keywords%3Dheadphones%26qid%3D1631700208%26sr%3D8-213-spons%26psc%3D1&qualifier=1631700208&id=8502969089746623&widgetName=sp_btf
"Anflowe ES850 Wired Sports Headphones, Half In-Ear Running Earphones with Mic & Pure Sound, Secure Fit with Ear Wings, Tangle-Free Braided Earbuds for Workouts, Gym, Jogging - Red",£15.99,4.3 out of 5 stars,111,https://www.amazon.co.uk//gp/slredirect/picassoRedirect.html/ref=pa_sp_btf_aps_sr_pg13_1?ie=UTF8&adId=A03147351MZLZEDRDKDT8&url=%2FAnflowe-Headphones-Earphones-Tangle-Free-Workouts-Red%2Fdp%2FB092ZNFS89%2Fref%3Dsr_1_214_sspa%3Fdchild%3D1%26keywords%3Dheadphones%26qid%3D1631700208%26sr%3D8-214-spons%26psc%3D1&qualifier=1631700208&id=8502969089746623&widgetName=sp_btf
Philips SHP9500/00 Headphone,£115.00,4.6 out of 5 stars,"5,761",https://www.amazon.co.uk//Philips-SHP9500-00-Headphone/dp/B00ENMK1DW/ref=sr_1_209?dchild=1&keywords=headphones&qid=1631700210&sr=8-209
Meze 99-Neo Over-Ear Headphones,£179.00,4.4 out of 5 stars,14,https://www.amazon.co.uk//MEZE-AUDIO-99-Neo-Over-Ear-Headphones-neo-black/dp/B06XKJ2GK4/ref=sr_1_210?dchild=1&keywords=headphones&qid=1631700210&sr=8-210
"DPS Deep Noise Reduction Earphones,Sport Headphones Bluetooth 5.0 EDR Wireless Stereo HiFi in-Ear Earbuds for Gym Running Outdoor Sports Workout (Black 13) (D3)",£59.99,,,https://www.amazon.co.uk//Reduction-Earphones-Headphones-Bluetooth-Wireless-D3/dp/B09D9L224Z/ref=sr_1_211?dchild=1&keywords=headphones&qid=1631700210&sr=8-211
"Pioneer DJ HDJ-CUE1, DJ Headphones",£63.00,4.7 out of 5 stars,133,https://www.amazon.co.uk//Pioneer-DJ-HDJ-CUE1-Headphones/dp/B08GCM6WVM/ref=sr_1_212?dchild=1&keywords=headphones&qid=1631700210&sr=8-212
AILIHEN MS300 Wired Headphones with Microphone Folding Lightweight Headset for Cellphones Tablets Smartphones Chromebook Zoom Skype Mp3/4(Rose Gold),£17.98,4.5 out of 5 stars,"6,196",https://www.amazon.co.uk//gp/slredirect/picassoRedirect.html/ref=pa_sp_mtf_aps_sr_pg14_1?ie=UTF8&adId=A00165391H0RVMXVLAOBD&url=%2FAILIHEN-Headphones-Foldable-Smartphone-Computer%2Fdp%2FB076HQ2P2X%2Fref%3Dsr_1_213_sspa%3Fdchild%3D1%26keywords%3Dheadphones%26qid%3D1631700210%26sr%3D8-213-spons%26psc%3D1%26smid%3DA1NCT2O30YNUW8&qualifier=1631700210&id=6801836481909557&widgetName=sp_mtf
"OneOdio(2021 New)Hybrid Noise Cancelling Bluetooth Headphones Over Ear headphone, Studio Level Hi-Fi Sound Deep Bass Soft Comfortable CVC 8.0 Clear Call, wireless Headphone for Smart Phones PC Travel",£54.99,4.5 out of 5 stars,380,https://www.amazon.co.uk//OneOdio-Cancelling-Bluetooth-Headphones-Comfortable/dp/B08DJ55LL3/ref=sr_1_214?dchild=1&keywords=headphones&qid=1631700210&sr=8-214
Bose Noise Cancelling Headphones 700 with Headset Stand,£234.51,4.8 out of 5 stars,58,https://www.amazon.co.uk//Noise-Cancelling-Headphones-Headset-Stand-Black/dp/B07T6MPFGN/ref=sr_1_215?dchild=1&keywords=headphones&qid=1631700210&sr=8-215
"DPS Deep Noise Reduction Earphones,Sport Headphones Bluetooth 5.0 EDR Wireless Stereo HiFi in-Ear Earbuds for Gym Running Outdoor Sports Workout (Black 13) (D2)",£59.99,,,https://www.amazon.co.uk//Reduction-Earphones-Headphones-Bluetooth-Wireless-D2/dp/B09D9KZZQP/ref=sr_1_216?dchild=1&keywords=headphones&qid=1631700210&sr=8-216
Jabra Elite 85h Over-Ear Headphones Amazon Edition – Active Noise Cancelling Wireless Earphones with Long Battery Life for Calls and Music – Copper Black. [Amazon Exclusive],£175.30,4.3 out of 5 stars,519,https://www.amazon.co.uk//Jabra-Elite-85h-Headphones-Built-Copper-Black/dp/B07PV9SJ6Y/ref=sr_1_217?dchild=1&keywords=headphones&qid=1631700210&sr=8-217
"OneOdio Hi-Res Over Ear Headphone Wired Closed-Back DJ Studio Headphones for Monitoring and Mixing, Soft Protein Leather Earcups, Noise Isolation, 90° Rotatable Housing, Portable (Upgraded Version)",£45.98,4.5 out of 5 stars,"3,182",https://www.amazon.co.uk//gp/slredirect/picassoRedirect.html/ref=pa_sp_mtf_aps_sr_pg14_1?ie=UTF8&adId=A0579457I35FA6BIBX5S&url=%2FOneOdio-Adapter-free-Closed-Back-Headphones-Monitoring-Black%2Fdp%2FB01F59T4HU%2Fref%3Dsr_1_218_sspa%3Fdchild%3D1%26keywords%3Dheadphones%26qid%3D1631700210%26sr%3D8-218-spons%26psc%3D1&qualifier=1631700210&id=6801836481909557&widgetName=sp_mtf
"JBL Live 300TWS - Truly wireless bluetooth in-ear headphones, in black",£66.98,4.3 out of 5 stars,"2,179",https://www.amazon.co.uk//JBL-Live-300TWS-Ear-Headphones-Black/dp/B07XRYDQRQ/ref=sr_1_219?dchild=1&keywords=headphones&qid=1631700210&sr=8-219
Beats Solo3 Wireless Headphone - Matte Gold,£239.81,4.6 out of 5 stars,"4,116",https://www.amazon.co.uk//Beats-Solo3-Wireless-Headphone-Matte/dp/B075MP8PYD/ref=sr_1_220?dchild=1&keywords=headphones&qid=1631700210&sr=8-220
Bowers & Wilkins PI7 True Wireless Noise Cancelling In Ear headphones with High resolution 24-bit connection – Charcoal,£349.00,3.6 out of 5 stars,135,https://www.amazon.co.uk//Bowers-Wilkins-Cancelling-headphones-resolution-Charcoal/dp/B08H8GNPLQ/ref=sr_1_221?dchild=1&keywords=headphones&qid=1631700210&sr=8-221
Jabra Evolve2 65 Wireless PC Headset – Noise Cancelling Microsoft Teams Certified Stereo Headphones With Long-Lasting Battery – USB-A Bluetooth Adapter – Black,£127.52,4.5 out of 5 stars,494,https://www.amazon.co.uk//Jabra-Evolve2-Wireless-Headset-USB/dp/B086KBXB3G/ref=sr_1_222?dchild=1&keywords=headphones&qid=1631700210&sr=8-222
"Betron RK300 Earphones, Wired In-Ear Headphones Earphones, Noise Isolating, Enhanced Bass, Tangle-Free Cord, White",£11.99,4.2 out of 5 stars,449,https://www.amazon.co.uk//gp/slredirect/picassoRedirect.html/ref=pa_sp_mtf_aps_sr_pg14_1?ie=UTF8&adId=A09698782FGE1DYEQ5HIL&url=%2FBetron-Earphones-Headphones-Isolating-Lightweight-White%2Fdp%2FB00O35B8AO%2Fref%3Dsr_1_223_sspa%3Fdchild%3D1%26keywords%3Dheadphones%26qid%3D1631700210%26sr%3D8-223-spons%26psc%3D1&qualifier=1631700210&id=6801836481909557&widgetName=sp_mtf
"JLab Audio Epic Air Sport ANC True Wireless Earbuds, Bluetooth Wireless Headphones and USB Charging Case - Active Noise Cancelling Earbuds, Sport Fit Wireless Running Earphones and IP66 Waterproof",£99.99,4.2 out of 5 stars,"1,426",https://www.amazon.co.uk//JLab-Bluetooth-Headphones-Cancelling-Signature/dp/B08KFPPJ3Y/ref=sr_1_224?dchild=1&keywords=headphones&qid=1631700210&sr=8-224
"Bluetooth Headphones, Wireless Earbuds Bluetooth 5.1, Powerful Bass, 40 Hours Playtime with Charging Case, IPX7 Waterproof, Earphones Suitable for Work, Games and Sports (Black)",£19.99,4.3 out of 5 stars,921,https://www.amazon.co.uk//Bluetooth-Headphones-Wireless-Waterproof-Earphones-Black/dp/B091GHJ7FN/ref=sr_1_225?dchild=1&keywords=headphones&qid=1631700210&sr=8-225
"Wireless Noise Cancelling Headphones, Type-C Quick Charge Over Ear Headphones with 40H Playtime, Hi-Fi Stereo Deep Bass Wireless Headset with CVC 8.0 Mic for Travel Work TV PC Cellphones",£29.99,4.0 out of 5 stars,10,https://www.amazon.co.uk//Wireless-Cancelling-Headphones-Playtime-Cellphones-Dark-Black/dp/B09794MLD6/ref=sr_1_226?dchild=1&keywords=headphones&qid=1631700210&sr=8-226
"AfterShokz Trekz Air Open-Ear Wireless Bone Conduction Sports Running Headphones with Portable Storage Case, Forest Green",£74.96,4.5 out of 5 stars,198,https://www.amazon.co.uk//AfterShokz-Open-Ear-Wireless-Conduction-Headphones-Green/dp/B07MDJTJCW/ref=sr_1_227?dchild=1&keywords=headphones&qid=1631700210&sr=8-227
"FiiO EM5 Hi-Res Earphones,Beryllium-Coated 1DD Earbuds,Strong Bass,Silver Cable,Swappable Plug 2.5mm/3.5mm/4.4mm",£229.99,5.0 out of 5 stars,11,https://www.amazon.co.uk//gp/slredirect/picassoRedirect.html/ref=pa_sp_btf_aps_sr_pg14_1?ie=UTF8&adId=A08157373B3K5ZHF2OK71&url=%2FFiiO-EM5-Earphones-Beryllium-Coated-Swappable-Black%2Fdp%2FB08G4RZPSN%2Fref%3Dsr_1_228_sspa%3Fdchild%3D1%26keywords%3Dheadphones%26qid%3D1631700210%26sr%3D8-228-spons%26psc%3D1%26smid%3DAVNA8R0KZ1BC&qualifier=1631700210&id=6801836481909557&widgetName=sp_btf
"Kids Headphones Over Ear, Wireless and Wired, 60H Playtime Wireless 5.0 HiFi Stereo Headphones with Soft Memory Protein Earmuffs, Built-in Mic & Volume Control, Headset for Study Travel Phone PC",£9.99,4.3 out of 5 stars,21,https://www.amazon.co.uk//gp/slredirect/picassoRedirect.html/ref=pa_sp_btf_aps_sr_pg14_1?ie=UTF8&adId=A05258472YKHZ027TGHIT&url=%2FHeadphones-Wireless-Playtime-Protein-Earmuffs-Black%2Fdp%2FB095JVH6WM%2Fref%3Dsr_1_229_sspa%3Fdchild%3D1%26keywords%3Dheadphones%26qid%3D1631700210%26sr%3D8-229-spons%26psc%3D1%26smid%3DA2GCDQAJDLF2CU&qualifier=1631700210&id=6801836481909557&widgetName=sp_btf
"Baseman Wireless Bluetooth Headphones Over Ear, Wired, Wireless and TF Card Mode, Lightweight Foldable Headphone, Hi-Fi Stereo Deep Bass Boosted Earphone for Travel Work, for Phone TV PC(Black Silver)",£24.99,4.4 out of 5 stars,265,https://www.amazon.co.uk//gp/slredirect/picassoRedirect.html/ref=pa_sp_btf_aps_sr_pg14_1?ie=UTF8&adId=A0864143EH1NWPY60XX&url=%2FWireless-Bluetooth-Headphones-Lightweight-Headphone%2Fdp%2FB082R75RY9%2Fref%3Dsr_1_230_sspa%3Fdchild%3D1%26keywords%3Dheadphones%26qid%3D1631700210%26sr%3D8-230-spons%26psc%3D1&qualifier=1631700210&id=6801836481909557&widgetName=sp_btf
"1MORE Triple Driver In-Ear Earphones Hi-Res Headphones with High Resolution, Bass Driven Sound, MEMS Mic, In-Line Remote, High Fidelity for Smartphones/PC/Tablet - E1001 Silver",£69.99,4.3 out of 5 stars,"5,282",https://www.amazon.co.uk//gp/slredirect/picassoRedirect.html/ref=pa_sp_atf_next_aps_sr_pg15_1?ie=UTF8&adId=A03193773V2F84KXEBYQ9&url=%2F1MORE-Earphones-Headphones-Resolution-Smartphones-Silver%2Fdp%2FB01KB9K9Z0%2Fref%3Dsr_1_225_sspa%3Fdchild%3D1%26keywords%3Dheadphones%26qid%3D1631700211%26sr%3D8-225-spons%26psc%3D1&qualifier=1631700211&id=8577655310504768&widgetName=sp_atf_next
"EKSA Active Noise Cancelling Headphones Bluetooth 5.0, 60 Hrs Playtime, Wireless Headphones with Quick Charge CVC 8.0 Mic Soft Earpads HIFI Deep Bass Bluetooth Headphones Over Ear for Business Travel",£39.98,4.3 out of 5 stars,605,https://www.amazon.co.uk//EKSA-Cancelling-Headphones-Playtime-Bluetooth/dp/B081VJ7VD5/ref=sr_1_226?dchild=1&keywords=headphones&qid=1631700211&sr=8-226
AKG Y50BTBLK Portable Foldable On-Ear Rechargeable Bluetooth Headphones - Black,£99.95,4.4 out of 5 stars,"1,869",https://www.amazon.co.uk//AKG-Y50BTBLK-Rechargeable-Bluetooth-Headphones-Black/dp/B01583HEO8/ref=sr_1_227?dchild=1&keywords=headphones&qid=1631700211&sr=8-227
"Sennheiser PXC 550 Wireless NoiseGard Adaptive Noise Cancelling, Bluetooth Headphone with Touch Sensitive Control and 30-Hour Battery Life - Black",£176.98,4.4 out of 5 stars,"4,948",https://www.amazon.co.uk//Sennheiser-PXC-550-Wireless-Cancelling-Black/dp/B01E3XLNA0/ref=sr_1_228?dchild=1&keywords=headphones&qid=1631700211&sr=8-228
"SONY WI-C200 Wireless Bluetooth Headphones with mic, up to 15h battery life - Black",£20.62,4.3 out of 5 stars,"3,630",https://www.amazon.co.uk//SONY-WI-C200-Wireless-Bluetooth-Headphones-Black/dp/B07QYWD718/ref=sr_1_229?dchild=1&keywords=headphones&qid=1631700211&sr=8-229
AILIHEN MS300 Wired Headphones with Microphone Folding Lightweight Headset for Cellphones Tablets Smartphones Chromebook Zoom Skype Mp3/4 (Purple Pink),£17.98,4.5 out of 5 stars,"6,196",https://www.amazon.co.uk//gp/slredirect/picassoRedirect.html/ref=pa_sp_mtf_aps_sr_pg15_1?ie=UTF8&adId=A10366051X4247F8QXEBH&url=%2FHeadphones-Microphone-Lightweight-Cellphones-Smartphones-Purple-Pink%2Fdp%2FB08K8KZG8Y%2Fref%3Dsr_1_230_sspa%3Fdchild%3D1%26keywords%3Dheadphones%26qid%3D1631700211%26sr%3D8-230-spons%26psc%3D1%26smid%3DA1NCT2O30YNUW8&qualifier=1631700211&id=8577655310504768&widgetName=sp_mtf
SoundPEATS Bluetooth 5.0 Wireless Headphones with Mic,£49.99,4.3 out of 5 stars,403,https://www.amazon.co.uk//SoundPEATS-T2-Canceling-Transparent-Headphones-Black/dp/B08RDGKT9Z/ref=sr_1_231?dchild=1&keywords=headphones&qid=1631700211&sr=8-231
JVC Lightweight Headphones - Black,£8.83,4.4 out of 5 stars,"3,064",https://www.amazon.co.uk//JVC-HA-L50-B-E-Lightweight-Headphones-Black/dp/B000I2J4S4/ref=sr_1_232?dchild=1&keywords=headphones&qid=1631700211&sr=8-232
Sennheiser HD 569 Around-Ear Closed Back Headphones - Black,£129.99,4.4 out of 5 stars,914,https://www.amazon.co.uk//Sennheiser-HD-569-Around-Ear-Headphones-Black/dp/B01L1IIF1A/ref=sr_1_233?dchild=1&keywords=headphones&qid=1631700211&sr=8-233
"Beats Ep Wired On-Ear Headphones - Battery Free For Unlimited Listening, Built In Mic And Controls - Red",£79.99,4.7 out of 5 stars,516,https://www.amazon.co.uk//Beats-EP-On-Ear-Headphones-Red/dp/B01LVXZVFI/ref=sr_1_234?dchild=1&keywords=headphones&qid=1631700211&sr=8-234
"Wireless Earphones, Bluetooth V5.1 Earbuds Headphones Wireless Headphones In-Ear Earphones 35H Playtime Hi-Fi Stereo Sound Headphones IXP6 Sweatproof Sport Earphones",£25.99,2.0 out of 5 stars,1,https://www.amazon.co.uk//gp/slredirect/picassoRedirect.html/ref=pa_sp_mtf_aps_sr_pg15_1?ie=UTF8&adId=A07983441JLIUWUX3MTJA&url=%2FWireless-Earphones-Bluetooth-Headphones-Sweatproof-white%2Fdp%2FB09839M23F%2Fref%3Dsr_1_235_sspa%3Fdchild%3D1%26keywords%3Dheadphones%26qid%3D1631700211%26sr%3D8-235-spons%26psc%3D1&qualifier=1631700211&id=8577655310504768&widgetName=sp_mtf
"JBL Tune 225 TWS In-Ear Earphones - True wireless headphones with up to 25 hours of battery life with charging case, feel the music with JBL Pure Bass sound, in black",£59.00,4.2 out of 5 stars,"1,583",https://www.amazon.co.uk//JBL-Tune-225-Ear-Earphones-Black/dp/B086WZWJMQ/ref=sr_1_236?dchild=1&keywords=headphones&qid=1631700211&sr=8-236
"JBL LIVE 650BTNC Wireless Over-Ear Noise-Cancelling Headphones with Alexa built-in, Google Assistant and Bluetooth – Up to 30 hours of music – Black",£125.00,4.5 out of 5 stars,"2,551",https://www.amazon.co.uk//JBL-Noise-Cancelling-Headphones-Bluetooth-Assistant-Black/dp/B07N9DNJ62/ref=sr_1_237?dchild=1&keywords=headphones&qid=1631700211&sr=8-237
Running Headphones Earphones Wireless Sports Headphones Bluetooth 5.0 Earphone In-Ear Noise Cancelling Earbuds with Charging Case Waterproof/Touch Control/HI-FI Stereo (Black),£27.99,4.3 out of 5 stars,99,https://www.amazon.co.uk//Headphones-Earphones-Bluetooth-Cancelling-Waterproof-Black/dp/B094VSW4RY/ref=sr_1_238?dchild=1&keywords=headphones&qid=1631700211&sr=8-238
